commit	val_sharpe	sortino	sharpe_ann_4h	calmar	psr	dsr	skew	kurtosis	max_drawdown	win_rate	total_trades	status	timestamp	description
b21dbd8	1.589278	3.881285	1.867512	8.977441	0.999515	0.712916	1.438	48.729	8.48	0.558	52	discard	2026-05-05 20:38	Diagnosis: Last 10 rows show repeated discards oscillating sharpe 0.18–1.61 with entry-filter mutations exhausted. Best keeps (b21a182, sharpe 1.613, 52 trades, DD 7.52%) removed all stacked entry fil
e360022	1.245414	2.605473	1.438336	6.345546	0.993546	0.419511	0.276	55.322	8.06	0.500	48	discard	2026-05-05 20:39	Diagnosis: Last 10 rows show repeated oscillation around sharpe 1.26–1.61 with entry-filter mutations exhausted. The best keep (b21a182, sharpe 1.613, 52 trades, DD 7.52%) achieved this by removing st
3520d7b	1.625276	3.845007	1.868257	8.533608	0.999516	0.711380	1.429	48.729	7.04	0.558	52	keep	2026-05-05 20:40	Diagnosis: Last 10 rows show the strategy is trapped in a discard oscillation loop (sharpe 1.24–1.60, all marked discard) with repeated failed entry-filter mutations. The best historical keep (b21a182
0a2a34a	1.334355	2.828821	1.535684	7.159406	0.996098	0.484033	0.394	48.869	7.54	0.500	48	discard	2026-05-05 20:40	Recent 10 rows stuck in discard oscillation (sharpe 1.24–1.61, all discards) from entry-filter mutations. Best keep (b21a182) achieved sharpe 1.613 by removing stacked filters. Current code has time-d
088029d	1.278244	2.673212	1.339670	5.217702	0.991441	0.349553	2.215	54.597	7.04	0.561	57	discard	2026-05-05 20:41	Reduce max_bars_in_trade from 40 to 25 bars (~4.2 days on 4h) to exit stale positions faster and reduce late-stage drawdown bleed; recent keeps show 1.59–1.63 Sharpe with time-decay at 40 bars, sugges
aa7ce7b	0.861642	1.594771	0.893989	2.120266	0.942656	0.122544	2.203	68.053	9.81	0.586	70	discard	2026-05-05 20:41	Diagnosis: Last 10 rows show repeated discards oscillating sharpe 1.24–1.63 with all entry-filter and time-decay mutations exhausted. Best keep (3520d7b, sharpe 1.625, DD 7.04%, 52 trades) is the curr
84b35bf	1.672734	3.984870	1.922512	8.760629	0.999658	0.744529	1.408	47.663	7.16	0.558	52	keep	2026-05-05 20:42	Diagnosis: Last 10 rows show repeated discards oscillating sharpe 1.24–1.63 with all entry-filter and time-decay mutations exhausted. Best keep (3520d7b, sharpe 1.625, DD 7.04%, 52 trades) is the curr
073eb2b	1.382062	2.954902	1.588448	7.483745	0.997032	0.521089	0.389	47.829	7.58	0.500	48	discard	2026-05-05 20:42	Diagnosis: Last 10 rows dominated by discard oscillations (sharpe 1.24–1.67, all marked discard except two keeps at 1.625 and 1.673) with entry-filter and time-decay mutations exhausted. Best recent k
93e00ce	1.390191	3.066998	1.543749	4.836589	0.996367	0.490937	0.614	47.828	9.67	0.556	45	discard	2026-05-05 20:43	Diagnosis: Last 10 rows show keeps at sharpe 1.625–1.673 (commits 3520d7b, 84b35bf) interspersed with discards oscillating 1.24–1.67. The keeps used base_fraction 0.75 with max_bars_in_trade 40; recen
1831ad4	1.579385	3.585696	1.769137	7.788045	0.998989	0.645700	0.775	42.629	6.87	0.560	50	discard	2026-05-05 20:44	Increase breakout_period from 28 to 35 bars (~5.8 days on 4h) to further reduce false breakouts and smooth equity curve; recent keeps (sharpe 1.625–1.673) plateau here, so widening the entry window tr
583a97c	1.685476	3.970969	1.922644	8.606471	0.999658	0.740422	1.405	47.668	6.66	0.558	52	keep	2026-05-05 20:44	Reduce base_fraction from 0.70 to 0.65 to further compress maximum drawdown and smooth equity curve; recent keeps plateau at sharpe 1.625–1.673 with DD 7.04–7.58%, suggesting conservative sizing is th
d77ab2e	1.636522	4.025023	1.922111	9.223124	0.999657	0.736196	1.416	47.651	8.58	0.558	52	discard	2026-05-05 20:45	Diagnosis: Last 10 rows show two recent keeps (583a97c sharpe 1.685 DD 6.66%, 3520d7b sharpe 1.625 DD 7.04%) achieved via conservative sizing (base_fraction 0.70→0.65). Current code at 0.65 is stable 
c0c0bf8	1.451924	3.139041	1.587784	6.436455	0.997446	0.511689	1.515	57.774	6.66	0.545	55	discard	2026-05-05 20:45	Diagnosis: Last 10 rows show two recent keeps (583a97c sharpe 1.685 DD 6.66%, 84b35bf sharpe 1.673 DD 7.16%) with base_fraction 0.65, but the sharpe has plateaued around 1.625–1.685 for the last 6 kee
ff64d79	1.491748	3.283664	1.661572	5.444427	0.998108	0.563582	0.693	41.313	8.47	0.538	52	discard	2026-05-05 20:46	Increase breakout_period from 28 to 32 bars (~5.3 days on 4h) to capture sustained multi-day trends while remaining defensive; recent 10 rows plateau at sharpe 1.625–1.685 with sizing exhausted (0.65)
4089b3c	1.231058	2.431099	1.401595	4.556417	0.992504	0.385329	0.437	42.997	9.41	0.471	68	discard	2026-05-05 20:47	Reduce atr_vol_threshold from 1.0 to 0.85 to widen entry set and capture more trending opportunities; last 6 keeps plateau at sharpe 1.625–1.685 with sizing and time-decay exhausted, so relaxing the v
69413a8	1.637378	3.825447	1.867592	8.402028	0.999513	0.702900	1.418	48.394	6.55	0.558	52	discard	2026-05-05 20:47	Reduce atr_multiplier_high_vol from 3.0 to 2.7 to tighten ATR trailing stops in volatile breakouts, reducing false exits while preserving trend-capture; recent keeps plateau at sharpe 1.625–1.685 with
0f1b4bb	0.178125	0.299306	0.190823	0.389148	0.630446	0.008024	3.674	124.124	5.91	0.396	106	discard	2026-05-05 20:48	Diagnosis: Last 10 rows show a plateau with sharpe 1.625–1.685 (6 keeps in the window) with base_fraction 0.65 as the stable floor. All entry/exit levers (breakout_period, exit_period, atr_multiplier 
12de660	1.654031	3.866322	1.884542	7.550338	0.999559	0.698798	1.375	47.341	7.43	0.558	52	discard	2026-05-05 20:49	Add RSI-based mean-reversion confirmation to exits: close position if close falls below exit_lower AND RSI drops below 40, filtering out false breakdowns in consolidations and improving Sharpe by avoi
0e1645a	1.389001	3.070488	1.571029	6.161319	0.997174	0.483704	1.397	50.829	7.09	0.528	53	discard	2026-05-05 20:49	Diagnosis: Last 10 rows show plateau at sharpe 1.625–1.685 with base_fraction 0.65 (commits 583a97c, 84b35bf) and all entry/exit levers exhausted. Recent mutations (breakout_period 28→32/35, atr_vol_t
7f5954c	1.277687	2.650206	1.452086	6.675743	0.994052	0.403998	0.381	51.154	6.83	0.531	49	discard	2026-05-05 20:50	Diagnosis: Last 10 rows show a plateau at sharpe 1.625–1.685 with base_fraction 0.65 (keep 583a97c). All 8 subsequent mutations (breakout_period width, atr_vol_threshold, atr_multiplier, RSI exit filt
2e7a3df	1.326055	2.770770	1.379742	5.286344	0.992978	0.354667	2.182	53.426	6.66	0.561	57	discard	2026-05-05 20:50	Reduce max_bars_in_trade from 40 to 25 bars (~4.2 days on 4h) to accelerate exit velocity and reduce drift-fade decay; time-decay exits are currently closing positions too late, absorbing post-breakou
c2a7d4a	0.692316	1.228059	0.798034	2.122427	0.917988	0.084878	0.892	31.700	11.63	0.390	82	discard	2026-05-05 20:51	Replace Donchian breakout entry with MACD crossover + volatility gate; MACD catches trend initiation earlier than price breakouts and avoids the whipsaw cycles that have plateaued Sharpe at 1.625–1.68
d34c2f0	-0.316352	-0.507614	-0.345902	-0.652785	0.276941	0.000476	2.933	242.460	8.96	0.217	23	discard	2026-05-05 20:51	Diagnosis: Last 10 rows show a hard plateau at sharpe 1.625–1.685 with base_fraction 0.65, breakout_period 28, and all entry/exit levers exhausted (8 mutations tried: period width, vol_threshold, atr_
c54b838	0.894482	1.834676	0.909131	3.206118	0.944615	0.102533	1.725	96.200	5.85	0.453	64	discard	2026-05-07 15:55	Replace Donchian short-break exit (15-bar) with a faster 10-bar EMA exit for earlier trend-reversal detection; structural exit-family change after 8+ parameter tweaks plateaued the strategy.
61bd1e5	1.187311	2.232116	1.263411	3.749404	0.989000	0.253597	3.691	71.641	7.02	0.671	76	discard	2026-05-07 15:56	Add fixed ATR-based take-profit (1.5x ATR from entry) as a parallel exit rail alongside the existing trailing stop and Donchian-break exit.
9773222	1.635719	3.805725	1.863867	8.316216	0.999498	0.663283	1.377	46.902	6.66	0.558	52	discard	2026-05-07 15:56	Replace regime-adaptive ATR trailing stop with a chandelier exit (ATR from highest price since entry) for structurally different trend-following stop behavior that tracks running peaks and avoids fals
dd60063	1.696561	3.983343	1.921298	8.522140	0.999655	0.697091	1.419	48.860	6.66	0.569	51	keep	2026-05-07 15:58	Add volume-confirmation filter to entries: require today's volume > 20-bar volume SMA on breakout bars to filter out low-participation false breakouts. Structurally different change after 10 consecuti
cf8402d	1.178658	2.333857	1.228620	4.420975	0.984647	0.237662	1.562	66.504	6.79	0.466	58	discard	2026-05-07 16:00	Introduce a volatility-adaptive exit rail: in high-vol regimes, widen the Donchian short-break exit threshold by requiring price to drop below the exit band adjusted by a 0.95x multiplier, providing t
db4d4a4	1.647984	3.843860	1.866820	8.305863	0.999511	0.661895	1.440	49.964	6.55	0.569	51	discard	2026-05-07 22:42	Replace regime-adaptive ATR trailing stop (2.5x/3.0x) with a fixed 2.5x ATR stop; the regime-switching logic was adding complexity without translating to better performance.
91f97e0	0.530999	0.915021	0.646178	1.499763	0.868418	0.043559	0.002	23.303	14.82	0.373	150	discard	2026-05-07 22:42	Replace price-breakout entry (close > 28-bar Donchian high) with volatility-momentum entry (ATR crossing above its 20-bar SMA) — structurally different signal family that catches trend ignition on vol
2eecbe6	1.661411	3.862200	1.880261	8.329806	0.999548	0.666395	1.393	48.157	6.66	0.569	51	discard	2026-05-07 22:44	Replace regime-adaptive ATR trailing stop with Chandelier exit (fixed 3.0x ATR from highest price since entry) to capture more of extended trends by using a running peak rather than static multipliers
cdaebbf	0.000000	0.000000	0.000000	0.000000	0.000000	0.000000	0.000	0.000	0.00	0.000	0	crash	2026-05-07 22:45	Add a two-tier partial-exit protocol: take 50% of position off at +2R profit, then let the remaining 50% ride with a chandelier-style trailing stop that only activates after a +1.5R threshold. This st
418f6f2	0.000000	0.000000	0.000000	0.000000	0.000000	0.000000	0.000	0.000	0.00	0.000	0	crash	2026-05-07 22:47	Fix crash: replace `self.position.entry_price` with `self.position.price` (the correct backtesting.py API for average entry price).
ae7eac5	0.000000	0.000000	0.000000	0.000000	0.000000	0.000000	0.000	0.000	0.00	0.000	0	crash	2026-05-07 22:48	Fix crash: replace `self.position.price` with `self.position.entry_price` (the correct backtesting.py API for average entry price).
3efaa6d	0.000000	0.000000	0.000000	0.000000	0.000000	0.000000	0.000	0.000	0.00	0.000	0	crash	2026-05-07 22:50	Fix crash: use `self.position.price` (backtesting.py's correct API) instead of the non-existent `self.position.entry_price` for computing R-based partial-exit threshold.
91e2037	0.000000	0.000000	0.000000	0.000000	0.000000	0.000000	0.000	0.000	0.00	0.000	0	crash	2026-05-07 22:50	Replace regime-adaptive ATR trailing stop with a fixed 8% trailing stop (chandelier-style) for regime-agnostic exit behavior that scales with price rather than volatile ATR, providing more consistent 
5a1e503	1.486070	3.328193	1.643758	6.909347	0.998107	0.502137	1.373	50.937	6.66	0.538	52	discard	2026-05-07 22:53	Tighten Donchian exit window from 15→12 bars to capture more of short-term trend rollovers and compress drawdown.
1f3c4f4	0.697934	1.399257	0.794525	2.004515	0.917059	0.070217	1.013	59.385	8.28	0.467	45	discard	2026-05-07 22:54	Replace 28-bar Donchian breakout entry with pullback-to-MA entry: only enter long when price is above the 50-bar EMA (uptrend) AND price pulls back to within 0.5 ATR of the EMA, with volume confirmati
dcc8c94	1.766267	3.910446	1.922140	7.763053	0.999655	0.691128	1.405	48.868	4.00	0.569	51	keep	2026-05-07 22:58	Reverse volatility scaling logic: size UP in high-vol regimes (capture stronger trends) and DOWN in low-vol regimes (avoid chop). This flips the current `vol_ratio = atr_ma / atr` pattern which parado
897bf30	1.755303	3.896858	1.923276	7.833117	0.999658	0.688748	1.391	47.701	4.00	0.558	52	discard	2026-05-07 22:59	Remove volume confirmation filter (too restrictive, 150 trades with Sharpe 0.53 vs baseline 51 trades with 1.77). Keep breakout + volatility regime core intact.
2772e54	1.464751	2.913355	1.594298	7.252399	0.997093	0.462134	0.327	48.841	4.00	0.511	47	discard	2026-05-07 23:02	Remove time-decay exit (max_bars_in_trade=40) to let ATR trailing stop and Donchian exit handle all exits — the time constraint was likely cutting short the biggest winners in a trend-following system
1c1b4fb	1.464751	2.913355	1.594298	7.252399	0.997093	0.463286	0.327	48.841	4.00	0.511	47	discard	2026-05-08 07:18	Remove time-decay exit (max_bars_in_trade=40) to let ATR trailing stop and short-Donchian exits handle all exits — the time constraint cuts short the biggest winners in trend-following systems.
c907cb7	1.475226	2.851850	1.602709	6.103896	0.997315	0.470109	0.541	45.565	4.49	0.508	63	discard	2026-05-08 07:21	Relax ATR volatility threshold from 1.0x to 0.9x to widen entry set — current 1.0x gate combined with volume confirmation is likely too restrictive, contributing to the 0-trade crashes observed in rec
5288e6c	0.000000	0.000000	0.000000	0.000000	0.000000	0.000000	0.000	0.000	0.00	0.000	0	crash	2026-05-08 07:22	Add a long-only regime filter: only enter long when price is above the 200-bar SMA to avoid bear-market breakouts that erode Sharpe in crypto.
2bd0f15	1.766267	3.910446	1.922140	7.763053	0.999655	0.688135	1.405	48.868	4.00	0.569	51	discard	2026-05-08 07:24	Fix crash: add `.copy()` to all numpy array returns in helper functions to prevent read-only arrays from causing ValueError in backtesting.py's `self.I` internal operations.
114276c	1.833997	4.108695	1.990341	9.025867	0.999779	0.726759	1.377	48.180	3.60	0.577	52	keep	2026-05-08 07:26	Tighten Donchian breakout window from 28→24 bars to capture shorter-term momentum breakouts while retaining the volatility regime and volume filters.
a6df709	1.399907	2.770054	1.496581	5.701717	0.996397	0.388188	2.570	52.051	3.60	0.600	65	discard	2026-05-08 07:27	Add a fixed take-profit target at 3× ATR to capture extended trending moves before the trailing stop or time-decay exit triggers — structural addition distinct from the recent parameter-only mutations
d9fd838	0.000000	0.000000	0.000000	0.000000	0.000000	0.000000	0.000	0.000	0.00	0.000	0	crash	2026-05-08 13:09	Replace the 15-bar short-Donchian exit with an EMA(10) cross-down exit: close drops below the 10-bar EMA triggers exit. Donchian exits are symmetric (static lookback) and lag in chop; EMA cross is a d
acb85af	1.045609	2.121498	1.014466	4.332282	0.962446	0.131703	1.656	94.914	2.86	0.484	64	discard	2026-05-08 13:10	Fix read-only array crash by adding `.copy()` to all helper function returns (same fix that resolved a prior crash in commit 2bd0f15).
02f2525	1.599984	3.429501	1.705691	6.609994	0.998667	0.539686	1.336	49.813	4.07	0.547	53	discard	2026-05-08 13:12	Replace the fixed 15-bar short-Donchian exit with a volatility-adaptive version (10-bar in calm regimes, 20-bar in volatile regimes). This structurally changes the exit behavior rather than adjusting 
5be471f	1.889877	4.286463	2.051922	6.500138	0.999853	0.761446	1.508	63.795	4.65	0.625	40	keep	2026-05-08 13:13	Add ADX momentum confirmation (ADX > 25) on breakout entries — structurally different from the crashed SMA regime filter (which blocked all trades) because ADX is a momentum indicator that confirms tr
208e8bd	1.939778	4.515684	2.127534	7.599779	0.999915	0.797564	1.665	70.207	4.00	0.632	38	keep	2026-05-08 13:15	Replace volume SMA confirmation (20-bar MA comparison) with 10-bar volume Rate-of-Change — structurally different momentum filter that fires on sudden volume surges rather than static threshold crossi
0c67e2b	1.544737	3.122103	1.709394	6.193218	0.998476	0.530146	0.691	73.391	4.23	0.568	37	discard	2026-05-08 13:20	Increase time-decay exit from 40→50 bars to let winning trades run longer — crypto trends often extend 8+ days, and the ATR stop still caps downside risk.
f5ffd58	1.539710	3.068754	1.677910	6.632617	0.998047	0.508609	0.157	63.811	4.23	0.556	36	discard	2026-05-08 19:06	Remove the time-decay exit (max_bars_in_trade) — the ATR trailing stop and short-Donchian exit already provide dual risk controls; forcing exits at 40 bars (6.7 days) on 4h bars may be cutting winners
cda0b84	1.756969	3.953614	1.896564	6.125078	0.999587	0.658818	1.583	72.231	4.31	0.564	39	discard	2026-05-08 19:06	Narrow exit period from 15→12 bars to align with the tighter 24-bar entry, letting winners run further while maintaining the proven Donchian-based exit family.
2119ee0	1.539710	3.068754	1.677910	6.632617	0.998047	0.507162	0.157	63.811	4.23	0.556	36	discard	2026-05-08 19:06	Remove time-decay exit (max_bars_in_trade) and rely solely on Donchian-break and ATR trailing stop exits, letting winning trades extend fully while the volatility-adaptive ATR stop caps drawdown.
ba00f7b	0.000000	0.000000	0.000000	0.000000	0.000000	0.000000	0.000	0.000	0.00	0.000	0	crash	2026-05-08 19:08	Replace the static 15-bar short-Donchian exit with a dynamic 10-bar EMA cross-down exit for faster mean-reversion response.
c7a5c3d	1.126797	2.235603	1.125872	4.777927	0.975671	0.171887	1.592	118.727	2.68	0.522	46	discard	2026-05-08 19:09	Fix read-only array crash by adding `.copy()` to `_ema` helper return — identical fix pattern to prior crash (commit acb85af), now applied to the EMA helper specifically.
b6fa99f	1.687749	3.415841	1.848007	7.159538	0.999342	0.626013	0.802	64.511	3.91	0.565	46	discard	2026-05-08 19:11	Relax the volatility entry gate from 1.0x → 0.9x ATR/ATR_MA threshold to allow entries when volatility is near its recent average, not strictly above it. This widens the candidate set for entries with
52a20b9	0.823550	1.684767	0.873623	2.794578	0.937017	0.082839	1.763	130.261	2.75	0.423	52	discard	2026-05-08 19:13	Add a 2-bar momentum reversal exit (close < prior bar's low) as a fourth parallel exit rail — structurally different from all prior exit changes (which all modified Donchian or ATR stop parameters and
f1fd851	1.670845	3.615490	1.824811	6.401210	0.999353	0.611494	1.408	54.301	4.39	0.520	50	discard	2026-05-08 19:13	Relax ADX momentum threshold from 25→15 to widen the entry set — the recent ADX addition (1.89 Sharpe) regressed vs the prior volume-ROC-only branch (1.94 Sharpe), suggesting the 25 threshold is over-
4c18678	1.787959	4.044186	1.937921	6.777253	0.999688	0.684652	1.471	56.541	4.39	0.553	47	discard	2026-05-09 01:59	Relax ADX threshold from 25→18 to widen the entry set — recent discards of exit-side changes suggest the bottleneck is now the entry filter stack, not exits; ADX at 25 is excluding valid momentum brea
19e7a61	0.000000	0.000000	0.000000	0.000000	0.000000	0.000000	0.000	0.000	0.00	0.000	0	crash	2026-05-09 02:00	Replace Turtle-breakout entry with 20-bar pullback-to-EMA entry in uptrends (buy the dip in confirmed trends), keeping all existing exits and filters intact — structurally different from all prior par
86c6ead	0.815790	1.481728	0.981396	2.705800	0.955456	0.116705	0.734	141.269	3.40	0.533	30	discard	2026-05-09 02:01	Fix read-only array crash by adding `.copy()` to all helper function returns — the backtesting library modifies indicators in-place (dividing by fractional unit), which fails on read-only numpy arrays
dad7f2a	1.670845	3.615490	1.824811	6.401210	0.999353	0.609504	1.408	54.301	4.39	0.520	50	discard	2026-05-09 02:02	Relax ADX momentum threshold 18→14 to widen the entry set further — the ADX filter is the dominant entry gate and the last two relaxations (25→18) each improved Sharpe, suggesting there's still room t
c9b127f	1.797325	4.057048	1.947075	6.991215	0.999710	0.688797	1.478	52.609	4.39	0.580	50	discard	2026-05-09 02:02	Remove ADX momentum confirmation filter from entries — the entry stack has been tightened progressively (25→18→14) and each relaxation consumed a slot without improving Sharpe beyond 1.79; removing it
d4f4794	1.985617	4.456648	2.127660	7.172304	0.999915	0.789675	1.660	70.016	2.31	0.632	38	keep	2026-05-09 02:04	Reverse volatility scaling logic: size DOWN when ATR spikes (strong momentum = high risk), size UP in calm regimes (chop = larger positions are acceptable). Current logic paradoxically sizes up during
ea294b8	1.487329	2.787601	1.418447	4.666235	0.993521	0.323334	1.302	76.559	2.25	0.630	46	discard	2026-05-09 02:06	Add volatility-adaptive ATR take-profit exit (3x ATR low-vol / 5x ATR high-vol) as a fourth parallel exit rail — structurally different from all recent exit changes (which all modified existing Donchi
9801e7c	0.000000	0.000000	0.000000	0.000000	0.000000	0.000000	0.000	0.000	0.00	0.000	0	crash	2026-05-09 07:44	Replace ADX momentum filter with price-above-SMA regime check (50-bar) — structurally different filter that captures uptrend confirmation via price position rather than directional movement strength.
431a0c5	1.985617	4.456648	2.127660	7.172304	0.999915	0.787283	1.660	70.016	2.31	0.632	38	discard	2026-05-09 07:46	Fix read-only array crash by adding `.copy()` to `_sma` helper return — the backtesting library modifies indicators in-place (dividing by fractional unit), which fails on read-only numpy arrays from r
2a782a4	1.813325	3.858817	1.888072	7.913765	0.999558	0.639992	1.298	49.789	2.08	0.560	50	discard	2026-05-09 07:48	Remove volume ROC filter from entries to widen the candidate set — it adds marginal signal on top of ADX momentum confirmation while shrinking trade count, and recent discards show the filter stack is
1ab3fac	1.639778	3.327282	1.694990	5.464169	0.998413	0.505823	0.969	78.975	2.35	0.564	39	discard	2026-05-09 07:51	Replace the ATR-trailing-stop exit with a Chandelier-style exit (highest high since entry minus ATR multiple) — fundamentally different from the current bar-by-bar ATR subtraction because it only move
