commit	val_sharpe	sortino	sharpe_ann_4h	calmar	psr	dsr	skew	kurtosis	max_drawdown	win_rate	total_trades	status	timestamp	description
4be1584	1.137666	1.946900	1.139407	4.024677	0.975090	0.975090	-0.069	75.574	1.63	0.581	43	keep	2026-05-26 00:16	Replace time-decay exit (40 bars) with ATR-based fixed R-multiple exit (3x ATR take-profit) for cleaner trend capture.
db186b4	0.000000	0.000000	0.000000	0.000000	0.000000	0.000000	0.000	0.000	0.00	0.000	0	crash	2026-05-26 13:54	Relax ATR take-profit from 3.0x to 4.0x ATR to let winners run longer before being clipped; the trailing stop already provides a volatility-aware ceiling so increasing TP distance should improve reali
7733a35	1.072543	1.829219	1.078676	3.483622	0.967657	0.967657	-0.486	91.561	1.83	0.500	40	discard	2026-05-26 13:55	Fix read-only array crash by adding `.copy()` to all `to_numpy()` calls — PyArrow-backed DataFrames return read-only arrays that backtesting's in-place normalization can't modify.
26a88b8	0.000000	0.000000	0.000000	0.000000	0.000000	0.000000	0.000	0.000	0.00	0.000	0	crash	2026-05-26 13:56	Replace ATR-based fixed R-multiple take-profit (4be1584) with a 30-bar time-decay exit to remove redundant exit rail and reduce trade duration sensitivity to volatility regime.
8159fe3	1.250632	2.331410	1.292059	4.829169	0.987365	0.985198	0.458	72.630	1.63	0.571	35	keep	2026-05-26 13:58	Fix read-only array crash by adding `.copy()` to all `to_numpy()` calls in helper functions — the same crash that was previously fixed in 7733a35 but reappeared when the time-decay exit variant (26a88
1b23fdc	1.424492	2.760424	1.425018	6.742376	0.993368	0.987628	0.743	70.943	1.32	0.618	34	keep	2026-05-26 13:58	Remove redundant Donchian short-exit rail to let trailing stop capture more of trending moves; keep ATR stop and time-decay as the two complementary exit rails.
42f5436	1.453972	2.746489	1.535240	5.439565	0.996772	0.989957	2.047	77.713	1.99	0.585	41	keep	2026-05-26 13:58	Remove the 200-bar SMA regime filter from entry conditions — it's been identified as too restrictive and caused 0-trade crashes; ADX momentum confirmation and volatility regime filter already provide 
9dc8828	1.453972	2.746489	1.535240	5.439565	0.996772	0.985387	2.047	77.713	1.99	0.585	41	discard	2026-05-26 13:59	Revert ATR-based fixed R-multiple take-profit exit back to time-decay (30 bars) — ATR TP was redundant with the trailing stop and regressed sharpe from 1.45→1.14; prior time-decay crash (26a88b8) was 
fe2d71e	1.453807	2.681413	1.578954	6.285910	0.996752	0.983609	0.243	65.196	2.22	0.556	36	discard	2026-05-26 14:02	Remove time-decay exit (30 bars) to let the ATR trailing stop be the sole exit — the time exit was cutting trending trades short before the volatility-aware stop could capture full moves; ATR stop alo
b3d540b	1.385374	2.598045	1.455918	5.184707	0.995053	0.972888	1.990	75.304	1.99	0.581	43	discard	2026-05-26 14:05	Remove the volume_sma confirmation filter (only 20-bar volume comparison) which is redundant with the ATR volatility regime and ADX momentum filters that already validate trade quality — volume in cry
fb53bd2	1.518491	2.899054	1.600187	5.670704	0.997751	0.986039	2.064	78.410	1.99	0.600	40	keep	2026-05-26 12:49	Add directional indicator (+DI > -DI) filter to entry — only take breakouts when upward momentum dominates, improving win rate.
5a179cc	1.303750	2.434977	1.357879	4.774033	0.991793	0.958079	1.851	71.197	2.05	0.543	46	discard	2026-05-26 12:51	Recent 2 crashes from over-filtering; widen entry by lowering ADX threshold from 25 to 22 to increase trade count while keeping trend-following discipline.
32b104d	1.869113	3.890156	2.060726	7.135241	0.999881	0.998713	1.971	64.539	2.17	0.622	37	keep	2026-05-26 12:52	Increase time-decay exit from 30 to 40 bars to let winning trends run longer while retaining a ceiling on holding time.
57ffd87	1.465948	2.720423	1.624123	5.948374	0.997624	0.969057	0.863	77.266	2.17	0.571	35	discard	2026-05-26 12:53	Increase time-decay exit from 40 to 50 bars to let winning trends run longer while retaining a ceiling on holding time.
32a0501	1.869113	3.890156	2.060726	7.135241	0.999881	0.996544	1.971	64.539	2.17	0.622	37	discard	2026-05-26 12:54	Increase volatility scaling ceiling to 1.5 to allow larger positions in low-vol regimes, capturing more trend profits while tail risk remains capped by ATR trailing stops.
0fe4790	0.000000	0.000000	0.000000	0.000000	0.000000	0.000000	0.000	0.000	0.00	0.000	0	crash	2026-05-26 12:57	Add partial profit-taking exit: close 50% when price >= entry + 3×ATR to lock gains and reduce drawdown.
a417ab6	1.537376	2.607933	1.604160	4.473973	0.997303	0.952830	0.939	101.834	2.17	0.750	56	discard	2026-05-26 13:14	Fix partial profit-taking crash: use position.close(portion=0.5) instead of self.sell(size=self.position.size/2) to correctly halve fractional position sizes.
fa7729e	1.809385	3.724593	1.997678	6.915267	0.999814	0.992688	1.956	64.007	2.17	0.605	38	discard	2026-05-26 13:17	Remove the +DI > -DI directional filter that reduced sharpe from 1.869 to 1.518 – reverting to the configuration that produced the best result so far.
5a3582b	1.597802	3.113571	1.681572	5.604698	0.998675	0.964363	2.352	74.581	2.17	0.568	37	discard	2026-05-26 13:20	Make time exit regime-adaptive: exit after 30 bars in low volatility vs 50 bars in high volatility, letting strong trends run while preventing chop.
b56d59c	1.979135	4.212794	2.168129	7.728286	0.999943	0.996324	1.829	58.948	2.17	0.649	37	keep	2026-05-26 13:23	Increase ATR trailing stop multipliers (2.5→3.0 low-vol, 3.0→3.5 high-vol) to give trades more room, reducing premature exits and capturing more trend.
9784c01	1.961764	4.231321	2.167397	7.889671	0.999943	0.994678	1.823	59.031	2.76	0.649	37	discard	2026-05-26 13:25	Increase base fraction from 0.55 to 0.70 to increase position sizes in low-vol regimes and capture more trend profit, leveraging the current low drawdown headroom.
65c34e4	1.666880	3.176421	1.733253	7.668374	0.998625	0.949459	0.299	49.230	2.22	0.606	33	discard	2026-05-26 13:29	Remove time-decay exit to let trades run indefinitely until stopped out by ATR trailing stop. Simplifies exit to single rail.
ef8fbb2	1.885078	3.965060	2.056969	7.357979	0.999873	0.988828	1.783	57.215	2.17	0.615	39	discard	2026-05-27 14:26	Remove volume confirmation filter to widen entry set; volume spikes lag price in crypto and stack unnecessarily with the other four filters.
4d82ca5	1.917342	4.104694	2.084753	8.196190	0.999895	0.989227	1.745	56.285	2.00	0.600	40	discard	2026-05-27 14:27	Shorten Donchian entry period from 24 to 20 bars to capture faster momentum breakouts on 4h crypto data.
eca4b0f	1.472142	2.781152	1.614970	3.943384	0.997675	0.920687	0.974	36.865	3.97	0.480	75	discard	2026-05-27 14:27	Replace Donchian breakout entries with EMA(20) pullback entries within trend (price > EMA(50) + ADX > 25), targeting entries near support for better risk-reward and fewer false breakouts.
314227e	0.291887	0.491201	0.314781	0.740288	0.708672	0.199149	2.993	457.579	1.27	0.378	82	discard	2026-05-27 14:29	Add Turtle System Two-style Donchian exit (10-bar lower band) as a parallel exit alongside the existing ATR trailing stop, allowing slow rollover trend reversals to be detected earlier than the volati
20363eb	0.000000	0.000000	0.000000	0.000000	0.000000	0.000000	0.000	0.000	0.00	0.000	0	crash	2026-05-27 14:34	Replace the noisy volume SMA filter with Williams %R as a complementary entry confirmation that measures price position relative to recent range without overlapping with ADX (which measures trend stre
25479da	1.885078	3.965060	2.056969	7.357979	0.999873	0.963394	1.783	57.215	2.17	0.615	39	discard	2026-05-27 14:34	Remove the Williams %R entry filter that caused 0 trades by over-constraining the entry set — revert to the 4-filter configuration (breakout + ATR regime + ADX + directional) that produced 38 trades a
709cef1	1.745065	4.484535	2.157215	10.481863	0.999936	0.974543	1.741	60.263	10.50	0.649	37	discard	2026-05-27 14:36	Remove inverse ATR position sizing; replace with fixed 0.55 fraction. The ATR trailing stop already provides risk protection by widening in high-vol regimes, making the separate inverse-scaling mechan
2889d40	1.886304	4.314716	2.164075	8.660891	0.999941	0.973624	1.795	59.419	5.36	0.649	37	discard	2026-05-27 14:36	Raise `vol_scale_floor` from 0.20 to 0.50 to increase position sizing in high-volatility breakouts, where the strategy's edge is strongest and the ATR trailing stop already provides downside protectio
0f3447d	1.838290	3.896237	2.000439	7.844778	0.999805	0.946829	1.648	55.394	2.00	0.571	42	discard	2026-05-27 14:38	Shorten Donchian breakout entry from 24 to 18 bars (from ~4-day to ~3-day confirmation) to capture faster momentum breakouts while relying on the existing ATR regime filter to eliminate whipsaws in ra
