commit	val_sharpe	sortino	sharpe_ann_4h	calmar	psr	dsr	skew	kurtosis	max_drawdown	win_rate	total_trades	train_sharpe	train_calmar	train_max_drawdown	train_total_trades	val_sub_min	val_sub_std	val_sub_neg_count	status	discard_reason	timestamp	description
f57088b	1.783795	3.630252	1.932539	5.199418	0.996226	0.843944	0.079	34.759	2.16	0.500	36	0.524577	1.305742	4.82	51	0.030857	0.016436	0	discard	val_regression	2026-06-02 18:02	Remove ATR volatility regime gate from entry but keep ADX(25), volume(1.2x), SMA regime, and breakout; after 10+ sequential discards plateauing ~2.4-2.45 Sharpe, the vol_regime_high condition (ATR > A
ab3245a	1.868552	4.062058	2.004298	6.262284	0.996758	0.861821	-0.442	63.519	1.83	0.545	22	0.678846	1.804930	4.20	33	0.009724	0.023757	0	discard	val_regression	2026-06-02 18:03	Increase time-decay exit from 40 to 60 bars (10 days) to let stronger trends run longer, aiming to break the ~2.45 Sharpe plateau.
b5f9dcf	2.298695	6.356612	2.717927	10.435503	0.999965	0.986774	2.373	49.035	1.27	0.591	22	0.507734	1.094528	5.18	37	0.019860	0.029334	0	discard	val_regression	2026-06-02 18:03	After 0-trade crash from volatility-momentum stop (entry_atr never set), fix by restoring time-decay exit and relaxing volume threshold to 1.0x to widen entry set.
562428d	2.066843	4.425701	2.180444	8.406012	0.998482	0.908320	-0.412	49.791	1.62	0.619	21	1.419532	6.358664	2.81	27	0.010819	0.024923	0	discard	val_regression	2026-06-02 18:03	Replace time-decay exit with original Turtle Donchian short-exit rail (close < exit_lower[-2]) — structural exit change, not a parameter nudge, aiming to break the ~2.45 Sharpe plateau by letting tren
4a136e3	1.904462	3.838258	2.156058	7.294904	0.998476	0.906803	0.097	53.123	1.46	0.640	25	1.061633	4.252496	2.57	35	0.023772	0.015068	0	discard	val_regression	2026-06-02 18:04	Use entry ATR for trailing stop (not current bar ATR) — stop no longer widens as vol expands mid-trade, locking in gains during volatility climaxes.
6a93080	2.426433	6.058441	2.625646	12.543446	0.999894	0.978705	1.278	55.317	1.18	0.643	28	0.922219	3.320457	3.10	44	0.042603	0.014656	0	keep		2026-06-02 18:04	Remove SMA200 regime filter from entry conditions to break plateau ~2.45 Sharpe — SMA200 is lagging and may overfit to bull trend in train window, restricting trade opportunities on pullbacks that sti
4ef4b11	0.389190	0.622707	0.434277	0.795936	0.724836	0.150799	-2.096	123.576	1.95	0.472	36	0.316985	0.898487	2.25	46	-0.009000	0.015651	1	discard	val_regression	2026-06-02 18:04	Replace ATR trailing stop with Parabolic SAR exit — structurally different exit family to break plateau near 2.45 Sharpe.
8d5d3e3	2.392253	5.750223	2.560563	11.830953	0.999796	0.949005	0.356	45.500	1.18	0.667	27	0.856760	3.040335	3.10	42	0.031192	0.019822	0	discard	no_improvement	2026-06-02 18:05	Relax SMA regime filter from 200 to 100 bars to increase trade count and break the plateau
ce834d9	2.193751	4.896192	2.373785	7.229083	0.999590	0.921378	1.039	39.946	2.05	0.605	38	0.788564	2.607127	3.42	51	0.008369	0.032409	0	discard	val_regression	2026-06-02 18:05	Replace ADX threshold filter with DI alignment (plus_di > minus_di) to widen entry set; ADX>25 was blocking moderate trends that still have directional momentum, while DI alignment captures all breako
7ffdd1d	2.336320	5.757126	2.518622	12.071604	0.999809	0.948625	1.248	53.992	1.18	0.621	29	0.712846	1.884713	4.47	49	0.042603	0.010937	0	discard	val_regression	2026-06-02 18:05	Remove volume confirmation filter (volume > 1.2x SMA) after recent RSI crash showed over-filtered entry. Subtraction reduces filter count from 4 to 3, widening entry set to avoid 0-trade traps.
008c12d	2.426433	6.058441	2.625646	12.543446	0.999894	0.963410	1.278	55.317	1.18	0.643	28	0.922219	3.320457	3.10	44	0.042603	0.014656	0	keep		2026-06-02 18:05	Add plus_di > minus_di direction alignment to entry conditions — structural regime gate, not a parameter nudge, to align breakouts with proven momentum direction.
5b386b6	2.426433	6.058441	2.625646	12.543446	0.999894	0.963799	1.278	55.317	1.18	0.643	28	0.952626	3.889244	2.69	43	0.042603	0.014656	0	keep		2026-06-02 18:06	Increase breakout_period from 24 to 28 bars (4.7 days) to require stronger trend confirmation before entry, aiming to boost Sharpe beyond the ~2.45 plateau by filtering weaker breakouts.
bdc8e7b	1.620238	3.345566	1.535152	4.447525	0.984228	0.603194	1.119	82.650	1.69	0.600	35	0.657421	2.048356	2.68	52	0.019544	0.011761	0	discard	val_regression	2026-06-02 18:06	Replace fixed time-decay exit (40 bars) with volatility-adaptive time exit (bars_allowed = 40 * ATR_MA / ATR, clamped [20,80]) — structural exit change to hold longer in low-vol regimes and exit soone
b538155	2.150197	4.775447	2.326560	6.861126	0.999480	0.911339	1.037	39.791	2.11	0.590	39	0.860038	2.961239	3.28	49	0.004007	0.034281	0	discard	val_regression	2026-06-02 18:06	Replace ADX+DI entry filters with MACD histogram > 0 — structurally different momentum confirmation to break the ~2.42 Sharpe plateau.
a9a25c9	2.066780	4.560471	2.226387	6.536173	0.999140	0.888406	1.072	46.328	2.01	0.571	35	0.915282	4.365904	2.32	45	0.013274	0.026872	0	discard	val_regression	2026-06-02 18:07	Reduce ADX threshold from 25 to 20 to widen entry set and potentially break plateau, capturing moderate trends still offering positive edge.
de1f7c2	1.795335	3.593556	1.936106	6.726322	0.996357	0.790344	0.289	42.824	1.79	0.545	33	0.882765	3.312450	3.19	50	0.025475	0.015277	0	discard	val_regression	2026-06-02 18:07	Replace Donchian breakout entry with Keltner upper-band breakout — EMA(20) + 2.5×ATR(14) naturally adapts to volatility, allowing removal of the separate ATR regime gate while keeping the same ADX+vol
702427f	1.894173	4.292870	2.061601	5.001003	0.998191	0.841791	1.441	70.273	2.19	0.519	27	0.475067	1.260086	3.09	46	0.026875	0.014944	0	discard	val_regression	2026-06-02 18:07	Replace fixed time-decay exit (40 bars) with 20-period SMA exit to capture trend rollover dynamically.
fd5b2f7	1.981002	4.216939	2.078122	7.787187	0.997881	0.842997	0.023	44.402	1.84	0.542	24	1.041489	2.472946	6.98	31	0.026169	0.014613	0	discard	val_regression	2026-06-02 18:07	Remove time-decay exit to let trends run indefinitely, capturing larger winning moves; retain ATR trailing stop for risk control.
e37f86a	2.236724	5.510197	2.406980	7.589630	0.999611	0.931672	0.975	63.526	1.89	0.520	25	1.094721	4.278900	2.61	41	0.039253	0.013291	0	discard	val_regression	2026-06-02 18:07	Replace time-decay exit with ADX-based exit (exit when trend strength wanes, ADX < 20) — structurally different exit family to break 2.426 Sharpe plateau.
87c0304	2.496070	6.324386	2.720437	12.767050	0.999936	0.974589	1.310	59.759	1.18	0.640	25	0.773878	2.123993	3.80	40	0.042603	0.013783	0	discard	no_improvement	2026-06-02 18:08	Add volatility expansion filter: require current ATR > its 10-bar MA to ensure volatility is expanding, confirming breakout sustainability. Structural change, not parameter nudge.
33ed513	2.405220	5.888875	2.568029	10.480580	0.999815	0.956335	0.581	49.955	1.27	0.680	25	1.073336	4.995181	2.17	34	0.026708	0.021628	0	keep		2026-06-02 18:08	Add 200-period SMA trend filter to entry: only take breakouts above the long-term moving average.
7461796	1.910883	4.076285	2.090664	6.814755	0.998284	0.856181	0.720	38.363	1.92	0.513	39	0.640376	2.623897	3.07	55	0.037406	0.013711	0	discard	val_regression	2026-06-02 18:08	Replace volatility regime gate with 50-bar SMA trend filter (close > SMA50) to structurally break the 2.42 plateau using a price-based regime filter instead of volatility-based one.
e8180fd	2.405220	5.888875	2.568029	10.480580	0.999815	0.957508	0.581	49.955	1.27	0.680	25	0.781859	2.116979	4.04	38	0.026708	0.021628	0	discard	no_improvement	2026-06-02 18:09	Add 100-bar SMA trend filter (close > SMA100) to entry — structural regime gate to avoid bear-market breakouts.
1e9a770	2.392253	5.750223	2.560563	11.830953	0.999796	0.955866	0.356	45.500	1.18	0.667	27	0.886374	3.565357	2.69	41	0.031192	0.019822	0	discard	no_improvement	2026-06-02 18:09	Remove volume confirmation filter (volume > 1.2× SMA20) from entry to reduce overfitting — recent plateau suggests overconstrained entry set; subtraction simplifies logic and may improve val generaliz
f2f730a	1.990260	4.230072	2.095973	5.641446	0.998247	0.860787	0.522	39.702	2.05	0.576	33	0.988575	4.174783	2.47	39	0.026483	0.025868	0	discard	val_regression	2026-06-02 18:09	Remove ADX momentum confirmation from entry — reduces filter stack without losing trend selectivity since breakout + vol regime + SMA200 + volume already ensure trending context.
9d35b2b	1.924565	3.988875	2.081096	6.000285	0.998101	0.857343	0.398	34.632	2.05	0.595	37	0.562427	1.455293	4.58	52	0.013361	0.025577	0	discard	val_regression	2026-06-02 18:09	Replace ADX + volume confirmation with 20-bar return z-score > 1.0 — a single, volatility-robust momentum filter that naturally captures both trend strength and relative magnitude, simplifying the ent
d888649	1.903830	3.906726	2.028417	6.809802	0.997145	0.836776	-0.435	47.648	1.88	0.571	21	1.182880	3.046844	6.22	23	0.010626	0.023699	0	discard	val_regression	2026-06-02 18:09	Replace time-decay exit with long-term trend exit (close < SMA200) — structurally different exit that lets trends run until the bull regime ends, reducing premature exits and aligning exit logic with 
c1d8ea2	1.943391	4.110633	2.044409	5.475879	0.997794	0.848493	0.511	40.156	2.05	0.545	33	0.988575	4.174783	2.47	39	0.021640	0.027058	0	discard	val_regression	2026-06-02 18:09	Replace ADX strength filter (ADX > 25) with DI+ > DI- directional momentum filter — align entry momentum direction with breakout direction, eliminating a direction-agnostic gate that may discard stron
c0c6e53	1.898747	3.929538	2.004059	6.818626	0.996873	0.831277	-0.419	45.156	1.88	0.571	21	1.173339	2.998521	6.27	23	0.009724	0.023836	0	discard	val_regression	2026-06-02 18:10	Replace time‑decay exit with a 5‑bar minimum holding period before the ATR trailing stop can trigger, preventing premature exits while letting trends run.
92fab1c	2.357525	5.746674	2.523727	10.133878	0.999770	0.955534	0.571	47.406	1.31	0.720	25	1.078103	4.836342	2.30	34	0.027957	0.022278	0	keep		2026-06-02 18:10	Make ATR trailing stop time-adaptive: multiplier increases with time in position (up to +1.0 at time_exit_bars) to let strong trends run longer without premature stops, breaking the plateau through ex
949d014	2.405220	5.888875	2.568029	10.480580	0.999815	0.961333	0.581	49.955	1.27	0.680	25	0.927094	3.052471	3.33	36	0.026708	0.021628	0	discard	no_improvement	2026-06-02 18:10	Replace volume confirmation with MACD bullish cross (MACD line > signal) to provide a different momentum filter that may be less correlated with price breakout, reducing overfitting risk.
31bd405	2.139544	5.000348	2.266871	9.203802	0.998956	0.907385	-0.320	57.168	1.47	0.667	21	0.576374	1.537988	4.19	32	0.024109	0.019147	0	discard	val_regression	2026-06-02 18:10	Increase time-exit bars from 40 to 60 to let trends run longer in crypto 4h bars, capturing larger moves while maintaining drawdown buffer.
02f5be8	1.366363	2.569809	1.535265	3.166102	0.980627	0.631997	-1.347	83.630	2.49	0.583	24	1.259608	5.890964	1.96	33	0.010013	0.020752	0	discard	val_regression	2026-06-02 18:10	Replace ATR trailing stop & time exit with a 20-period EMA trailing stop — structurally different exit that adapts to price action without ATR parameter tuning.
30c2d54	2.097945	5.010293	2.281011	7.129999	0.999159	0.911102	0.333	59.851	1.79	0.571	21	1.080172	4.218454	2.45	32	0.025052	0.023343	0	discard	val_regression	2026-06-02 18:11	Replace time-decay exit with ADX trend-weakness exit (ADX < 20) to let strong trends run indefinitely and only exit when momentum finally stalls.
254b82a	2.294434	5.328256	2.472718	8.731099	0.999696	0.948543	0.498	45.948	1.50	0.720	25	1.391512	5.518060	2.71	33	0.024524	0.023442	0	discard	val_regression	2026-06-02 18:11	Increase ATR trailing stop multipliers (low_vol 3.0→3.5, high_vol 3.6→4.2) to let strong trends run longer before being stopped out, reducing premature exits and allowing larger trend capture.
8463331	2.357525	5.746674	2.523727	10.133878	0.999770	0.956342	0.571	47.406	1.31	0.720	25	0.889644	3.685315	2.66	38	0.027957	0.022278	0	discard	no_improvement	2026-06-02 18:11	Replace volume confirmation (volume > 1.2× SMA20) with Williams %R > -80 (not oversold) to filter entry against buying at short-term extremes, reducing false breakouts and overfitting risk.
911bdbc	2.043021	4.249283	1.958201	7.635981	0.996267	0.820010	-0.219	60.881	1.31	0.677	31	0.909899	3.991421	2.10	40	0.014928	0.022218	0	discard	val_regression	2026-06-02 18:11	Add a take-profit exit at 4× ATR from entry price to lock in gains on strong trends, reducing volatility and potentially improving sharpe without adding entry filters.
11076bd	0.000000	0.000000	0.000000	0.000000	0.000000	0.000000	0.000	0.000	0.00	0.000	0	1.238606	3.991718	5.07	22	0.000000	0.000000	0	discard	min_trades	2026-06-02 18:11	Replace time-decay exit with Donchian channel exit (close < lower of exit_period=15) — a structurally different exit that historically worked for Turtle; may complement ATR stop by exiting on new lows
9f8a952	1.467016	2.978123	1.607225	3.982774	0.986716	0.670834	-0.009	51.022	1.95	0.577	26	1.146530	5.396923	1.83	28	0.009352	0.021798	0	discard	val_regression	2026-06-02 18:12	Replace ADX > 25 entry filter with ADX > 20 and ADX > its 10-bar average to ensure trend strength is increasing
e34fa7d	2.357525	5.746674	2.523727	10.133878	0.999770	0.955392	0.571	47.406	1.31	0.720	25	1.029997	4.664348	2.30	36	0.027957	0.022278	0	discard	no_improvement	2026-06-02 18:12	Lower ADX threshold from 25 to 20 to allow entries in moderate trends, potentially capturing more profitable breakouts without sacrificing drawdown.
d7f9323	1.892378	4.039393	2.024097	6.237503	0.997549	0.843181	0.432	41.404	1.75	0.600	30	1.029997	4.664348	2.30	36	0.030415	0.022195	0	discard	val_regression	2026-06-02 18:12	Loosen volume confirmation from 1.2x to 1.1x SMA20 to increase trade count from 25 towards 30–35, reducing over‑filtering while still requiring above‑average participation.
0da413d	2.151865	5.148283	2.310985	6.169879	0.999325	0.921073	0.536	51.794	1.91	0.652	23	1.028727	4.743011	2.22	32	0.027957	0.019090	0	discard	val_regression	2026-06-02 18:12	Add 200-period SMA rising filter (increasing SMA200) to entry to ensure only long trades in confirmed uptrend regime, reducing false breakouts in topping or declining markets.
ef4a0f4	1.540467	2.868886	1.673353	3.937372	0.988305	0.699618	-0.885	67.996	2.03	0.538	26	0.831633	2.545974	2.69	36	-0.009501	0.031515	1	discard	val_regression	2026-06-02 18:13	Replace volatility‑adaptive ATR trailing stop with a fixed‑percentage (3.5%) trailing stop — a structurally different exit that does not depend on ATR parameter tuning and may better accommodate crypt
beb0110	1.528617	2.946661	1.677313	3.775475	0.989956	0.701635	0.179	40.176	2.40	0.531	32	1.194933	5.163358	2.62	41	0.000975	0.031028	0	discard	val_regression	2026-06-02 18:13	Replace Donchian breakout entry with Bollinger band breakout (20,2) to use volatility‑adaptive bands instead of fixed‑range max/min, potentially improving entry timing and risk‑adjusted returns.
99e09fa	0.000000	0.000000	0.000000	0.000000	0.000000	0.000000	0.000	0.000	0.00	0.000	0	1.292945	4.166791	5.07	22	0.000000	0.000000	0	discard	min_trades	2026-06-02 18:13	Remove time-decay exit to let strong trends run indefinitely; only exit via adaptive ATR trailing stop — reduces premature exits and may capture full trend length.
e9075e0	1.155412	2.100781	1.228538	2.435318	0.955654	0.458718	-0.079	28.057	3.05	0.476	42	0.366253	0.902006	4.81	52	0.007572	0.013633	0	discard	val_regression	2026-06-02 18:13	Simplify entry by removing volatility regime gate and lowering ADX threshold to 20, reducing over‑filtering and increasing trade count without sacrificing drawdown.
e5b06b2	2.357525	5.746674	2.523727	10.133878	0.999770	0.950185	0.571	47.406	1.31	0.720	25	0.889644	3.685315	2.66	38	0.027957	0.022278	0	discard	no_improvement	2026-06-02 18:14	Replace volume confirmation with price momentum (close > 10-bar high) for structurally different entry filter — reduces overfitting risk and may improve breakout timing.
e8bcfb5	1.892378	4.039393	2.024097	6.237503	0.997549	0.831166	0.432	41.404	1.75	0.600	30	1.029997	4.664348	2.30	36	0.030415	0.022195	0	discard	val_regression	2026-06-02 18:14	Replace ADX>25 entry filter with ADX>20 AND Plus_DI > Minus_DI to ensure bullish directional alignment, potentially improving trade quality by entering only when upward momentum dominates.
e287e16	0.000000	0.000000	0.000000	0.000000	0.000000	0.000000	0.000	0.000	0.00	0.000	0	0.000000	0.000000	0.00	0	0.000000	0.000000	0	crash	crash	2026-06-02 18:14	Replace time-decay exit with Donchian (exit_period=15) channel exit; retain ATR trailing stop for volatility-based stop.
2c63454	1.898747	3.929538	2.004059	6.818626	0.996873	0.820843	-0.419	45.156	1.88	0.571	21	1.173339	2.998521	6.27	23	0.009724	0.023836	0	discard	val_regression	2026-06-02 18:14	Increase ATR trailing stop multipliers (low_vol 3.0→3.5, high_vol 3.6→4.0, time_extra 1.0→1.5) to reduce premature exits and let winners run longer.
2940a70	1.898747	3.929538	2.004059	6.818626	0.996873	0.820843	-0.419	45.156	1.88	0.571	21	1.173339	2.998521	6.27	23	0.009724	0.023836	0	discard	val_regression	2026-06-02 18:14	Fix crash: remove stale reference to removed `time_exit_bars` in time‑adaptive ATR trailing stop, simplifying exit to only regime‑adaptive multiplier.
97101fc	1.898747	3.929538	2.004059	6.818626	0.996873	0.820843	-0.419	45.156	1.88	0.571	21	1.173339	2.998521	6.27	23	0.009724	0.023836	0	discard	val_regression	2026-06-02 18:14	Fix AttributeError crash by removing time-adaptive increment that referenced deleted `time_exit_bars` — ATR trailing stop now uses only regime-adaptive multiplier.
c656700	0.743687	1.226071	0.794094	1.378555	0.859672	0.236938	-2.308	114.991	2.25	0.457	35	0.613036	1.896891	1.90	42	-0.016523	0.028421	1	discard	val_regression	2026-06-02 18:15	Replace time-decay exit with MACD bearish cross exit — a structurally different exit that reacts to momentum reversal rather than time, improving trend capture.
1d67455	2.226567	5.048671	2.410409	7.419419	0.999586	0.921957	0.494	45.660	1.72	0.680	25	1.036087	4.064833	2.88	37	0.021466	0.024922	0	discard	val_regression	2026-06-02 18:15	Replace volume confirmation with fast-SMA(10) momentum filter in init/next — structurally different entry that validates short-term price strength instead of erratic 4h crypto volume, aiming for bette
4ea73f9	1.801522	3.534098	1.900699	4.558099	0.995364	0.760552	-0.401	37.392	2.84	0.500	26	0.958780	2.759520	6.17	36	0.008404	0.024826	0	discard	val_regression	2026-06-02 18:16	Remove volatility regime gate (ATR > 0.95×ATR_MA) from entry to allow more breakouts during moderate‑vol regimes, increasing trade count without adding ADX or SMA filter changes.
50bca5b	1.770415	3.575544	1.852948	5.793291	0.994371	0.740393	-0.429	41.657	2.09	0.571	21	1.061720	3.405598	4.94	26	0.009794	0.020967	0	discard	val_regression	2026-06-02 18:16	Replace dual exit (Donchian + ATR) with volatility-scaled percent trailing stop — structurally different exit that adapts stop distance to both volatility and price level, simplifying logic and reduci
0d6d8c3	1.573490	2.999111	1.692948	5.379921	0.989838	0.665470	-0.438	40.771	2.05	0.500	24	1.099147	2.551829	6.92	28	0.009724	0.017603	0	discard	val_regression	2026-06-02 18:16	Replace Donchian breakout entry with Keltner channel breakout (EMA+ATR bands) to structurally change entry signal — captures trends with volatility-adaptive envelope rather than rolling high/low, aimi
1852eea	1.375084	2.427889	1.502088	3.342671	0.981469	0.564527	0.111	26.792	3.17	0.459	37	0.978455	2.233342	7.86	34	-0.011037	0.032349	1	discard	val_regression	2026-06-02 18:16	Replace Donchian breakout entry with pullback-to-20SMA entry in uptrend — structural change from breakout to mean-reversion within trend, aiming to enter during normal pullbacks rather than at new hig
5e170ba	1.609754	3.139104	1.698777	5.067814	0.990057	0.660749	-0.423	41.484	2.17	0.480	25	1.071575	2.488604	6.98	27	0.014227	0.015307	0	discard	val_regression	2026-06-02 18:17	Lower ADX threshold from 25 to 20 to increase trade frequency while keeping structural entry filters intact
c28a826	1.742144	3.279666	1.604407	5.916948	0.986958	0.611831	0.415	66.420	1.26	0.639	36	0.265184	0.413697	6.07	52	0.018309	0.016797	0	discard	val_regression	2026-06-02 18:17	Replace Donchian channel exit with volatility-scaled take-profit (2.5×ATR) while retaining ATR trailing stop — structural exit change that locks in gains before reversals instead of waiting for a clos
14e1b5f	1.890756	3.903804	1.997094	7.439178	0.996790	0.790158	-0.416	44.479	1.72	0.545	22	1.112813	2.583246	7.07	28	0.009724	0.024307	0	discard	val_regression	2026-06-02 18:17	Reduce Donchian breakout period from 28 to 20 to increase trade frequency, moving closer to original Turtle System One parameters.
922ce03	1.898747	3.929538	2.004059	6.818626	0.996873	0.794305	-0.419	45.156	1.88	0.571	21	1.050887	2.416309	6.98	26	0.009724	0.023836	0	discard	val_regression	2026-06-02 18:18	Remove Donchian channel exit, relying solely on ATR trailing stop to let trends run longer while maintaining volatility-adaptive protection.
99d4050	1.973390	4.100606	2.074100	6.844493	0.997688	0.822024	-0.370	41.779	1.98	0.591	22	1.008608	2.307661	7.16	29	0.005828	0.026560	0	discard	val_regression	2026-06-02 18:18	Relax volatility regime gate threshold from 0.95 to 0.90 to allow more entries during near‑average volatility regimes, increasing trade frequency while maintaining volatility‑aware filtering.
