commit	val_sharpe	sortino	sharpe_ann_4h	calmar	psr	dsr	skew	kurtosis	max_drawdown	win_rate	total_trades	train_sharpe	train_calmar	train_max_drawdown	train_total_trades	val_sub_min	val_sub_std	val_sub_neg_count	status	discard_reason	timestamp	description
f410346	1.898747	3.929538	2.004059	6.818626	0.996873	0.797575	-0.419	45.156	1.88	0.571	21	1.130080	2.895739	6.29	24	0.009724	0.023836	0	discard	val_regression	2026-06-02 18:18	Add DI bearish cross exit (minus_DI > plus_DI) to capture momentum reversals earlier, leveraging already-computed directional indicators.
1b00220	1.521627	2.906497	1.581842	3.517471	0.985453	0.602496	0.168	75.418	2.05	0.519	27	0.505094	1.456986	2.69	43	0.017871	0.013210	0	discard	val_regression	2026-06-02 18:18	Add directional confirmation (Plus_DI > Minus_DI) to the ADX momentum gate — ADX measures trend strength but not direction; this ensures breakouts only fire when bullish momentum is dominant, not duri
3018a0c	1.898747	3.929538	2.004059	6.818626	0.996873	0.796522	-0.419	45.156	1.88	0.571	21	1.046813	2.406064	6.98	26	0.009724	0.023836	0	discard	val_regression	2026-06-02 18:19	Add volume confirmation filter (volume > 20-bar SMA) to entry to suppress low-participation breakouts and raise signal quality.
870f2c3	1.665064	3.151750	1.619885	5.892034	0.986280	0.621604	-0.695	64.013	1.34	0.571	35	0.814884	2.144242	3.80	46	0.006824	0.020734	0	discard	val_regression	2026-06-02 18:19	Replace DI bearish cross exit with a fixed take-profit at 3.5×ATR from entry to lock in big winners while retaining volatility-adaptive trailing stop and Donchian exit.
09aaefe	2.004603	4.179947	2.110711	7.971879	0.998007	0.834784	-0.379	43.021	1.72	0.619	21	1.023858	2.289113	7.27	28	0.009724	0.024569	0	discard	val_regression	2026-06-02 18:20	Lower volatility regime gate from 0.95 to 0.93 to increase trade frequency while maintaining structural filtering.
951cae8	1.127788	2.081435	1.050484	2.907762	0.924520	0.320010	-0.911	110.641	1.39	0.600	40	-0.133958	-0.245604	3.56	55	0.001432	0.014632	0	discard	val_regression	2026-06-02 18:20	Add time-based exit (max 10 bars = ~1.6 days) to force shorter trade duration, boosting win rate and sharpe by exiting indecisive positions earlier than the slower Donchian or trailing stops.
a7df85a	2.078479	4.925644	2.249971	6.524617	0.999021	0.871812	0.330	63.405	1.90	0.545	22	0.894504	2.767239	3.42	35	0.022369	0.021395	0	discard	val_regression	2026-06-02 18:20	Add ADX regime exit: if ADX drops below 18 while in a position, close the trade to avoid holding through trend decay — complements ADX entry gate.
6f83082	1.673546	3.268165	1.884433	6.065270	0.994525	0.734450	-0.873	62.703	1.75	0.591	22	1.343573	4.161617	4.39	29	0.010460	0.020531	0	discard	val_regression	2026-06-02 18:21	Replace vol-adaptive ATR trailing stop with a fixed 2.5×ATR stop to tighten exits, increase trade frequency, and cut losers earlier — no Donchian exit change.
103f794	1.583571	3.025330	1.707403	5.402901	0.990335	0.654042	-0.446	41.539	2.05	0.522	23	1.078455	2.603243	6.72	29	0.009724	0.017783	0	discard	val_regression	2026-06-02 18:21	Replace Donchian entry breakout with Keltner channel breakout (EMA±2×ATR) to reduce whipsaw and improve trend capture.
bcbb979	1.890756	3.903804	1.997094	7.439178	0.996790	0.784710	-0.416	44.479	1.72	0.545	22	1.112813	2.583246	7.07	28	0.009724	0.024307	0	discard	val_regression	2026-06-02 18:22	Replace volatility-regime gate with ADX rising condition (ADX[-1] > ADX[-2]) to filter for accelerating trends instead of absolute volatility, structurally different from prior parameter nudges.
91d4695	1.877197	3.743905	1.983880	5.248403	0.996646	0.779694	-0.417	39.283	2.55	0.542	24	0.949818	2.698540	6.15	33	0.012339	0.025551	0	discard	val_regression	2026-06-02 18:22	Shorten breakout period from 28 to 20 bars to increase trade frequency and catch trend entries earlier — a structural parameter change after a streak of discards from filter additions.
36c5e20	0.000000	0.000000	0.000000	0.000000	0.000000	0.000000	0.000	0.000	0.00	0.000	0	0.000000	0.000000	0.00	0	0.000000	0.000000	0	crash	crash	2026-06-02 18:22	Remove volatility regime gate from entry (ATR > 0.95×ATR_MA) to simplify entry logic and increase trade frequency, relying on ADX and Donchian for quality filtering.
1a505f4	1.852206	4.730107	2.135201	8.415363	0.998610	0.844511	0.828	44.146	6.64	0.542	24	0.751424	2.465257	11.95	33	0.015811	0.025922	0	discard	val_regression	2026-06-02 18:22	Replace volatility-based position sizing with ADX-strength-based sizing: higher ADX => larger size, lower ADX => smaller size, to allocate more capital to strongest trends.
fc81d10	1.910004	3.827585	2.017352	6.484333	0.997098	0.797904	-0.366	38.964	2.10	0.500	26	0.793949	2.168066	6.25	39	0.008404	0.024786	0	discard	val_regression	2026-06-02 18:23	Fix crash from passing non‑integer window to _atr_ma by restoring atr_ma_period=50 and using it in the call.
db06361	1.609754	3.139104	1.698777	5.067814	0.990057	0.657218	-0.423	41.484	2.17	0.480	25	1.071575	2.488604	6.98	27	0.014227	0.015307	0	discard	val_regression	2026-06-02 18:23	Lower ADX entry threshold from 25 to 20 to increase trade frequency and capture earlier trend entries, addressing the crash pattern from over-filtered entry conditions.
380d18b	1.898747	3.929538	2.004059	6.818626	0.996873	0.793168	-0.419	45.156	1.88	0.571	21	1.050887	2.416309	6.98	26	0.009724	0.023836	0	discard	val_regression	2026-06-02 18:24	Increase exit Donchian period from 15 to 20 bars to let winners run longer, aiming to improve trade capture and sharpe while maintaining trade frequency above 20.
328acb4	1.580637	3.054332	1.654765	4.532300	0.988514	0.636309	-0.334	38.470	2.42	0.464	28	1.096270	2.858190	6.29	29	0.014227	0.017103	0	discard	val_regression	2026-06-02 18:24	Replace ADX threshold entry gate with DI+ > DI- direction filter to ensure breakouts align with bullish momentum, reducing false entries during bear trends with high ADX.
9b7af8d	1.437132	2.696862	1.484687	3.982963	0.979345	0.544356	-0.429	39.861	2.42	0.464	28	0.928409	2.100651	6.98	31	0.012799	0.020375	0	discard	val_regression	2026-06-02 18:25	Replace ADX>25 entry confirmation with Williams %R>-20 overbought filter — structurally different momentum signal that catches breakouts in strong trending regimes (when price is already pushing highs
7bb7d0b	0.000000	0.000000	0.000000	0.000000	0.000000	0.000000	0.000	0.000	0.00	0.000	0	1.091815	3.605466	4.94	25	0.000000	0.000000	0	discard	min_trades	2026-06-02 18:25	Loosen ATR trailing stop multipliers: low_vol 3.0→3.5, high_vol 3.6→4.2 to let winners run longer — opposite of previous tightening attempt (6f83082 discard) — aiming to improve sharpe without adding 
c264edc	1.705546	3.307139	1.869959	5.747180	0.994424	0.733141	-0.727	51.418	1.95	0.571	21	1.222929	3.670777	4.92	27	0.009260	0.021465	0	discard	val_regression	2026-06-02 18:26	Make ATR trailing stop multiplier ADX-adaptive: tighter stop in strong trends (ADX>30) to lock profits, looser in weak trends to avoid premature exits.
635e9ea	1.898747	3.929538	2.004059	6.818626	0.996873	0.791517	-0.419	45.156	1.88	0.571	21	1.050887	2.416309	6.98	26	0.009724	0.023836	0	discard	val_regression	2026-06-02 18:26	Add volume confirmation filter (volume > 0.8×20-bar SMA) to breakout entries — structurally different signal quality improvement, not a parameter tweak.
07bab4e	1.876056	3.977493	2.010129	7.003506	0.996960	0.795447	-0.401	44.889	2.54	0.571	21	1.043240	2.537992	9.21	26	0.009791	0.023879	0	discard	val_regression	2026-06-02 18:27	Increase base_fraction from 0.55 to 0.75 to risk more capital per trade, aiming to boost returns and sharpe given current low drawdown and 24 trades.
10a8f85	0.000000	0.000000	0.000000	0.000000	0.000000	0.000000	0.000	0.000	0.00	0.000	0	0.836908	1.518732	7.81	20	0.000000	0.000000	0	discard	min_trades	2026-06-02 18:27	Replace Donchian breakout entry with pullback to 50-period SMA cross — structurally different entry signal that buys dips in uptrends, aiming to capture earlier entries and increase trade frequency.
430fd47	1.580637	3.054332	1.654765	4.532300	0.988514	0.636106	-0.334	38.470	2.42	0.464	28	1.018702	2.382876	6.98	31	0.014227	0.017103	0	discard	val_regression	2026-06-02 18:28	Remove ADX>25 momentum entry filter to increase trade frequency and avoid over‑filtering – structurally simpler entry addresses the recent cluster of discards.
7d9af9b	1.580637	3.054332	1.654765	4.532300	0.988514	0.635009	-0.334	38.470	2.42	0.464	28	1.018702	2.382876	6.98	31	0.014227	0.017103	0	discard	val_regression	2026-06-02 18:28	Remove ADX entry filter (ADX > 25) to increase trade frequency — recent mutations keep crashing with 0 trades from over-filtered entries; vol regime + trend filter remain to ensure quality.
533f1a5	1.526826	2.877089	1.716558	4.660968	0.990079	0.663474	-0.836	57.326	2.11	0.545	22	1.485027	5.291663	4.21	28	0.003445	0.022792	0	discard	val_regression	2026-06-02 18:29	Replace ATR trailing stop with 50-bar SMA exit to let trends run longer and avoid volatility‑based whipsaws, while keeping Donchian exit as hard floor.
1764dd6	1.783630	3.763497	1.806870	6.089239	0.993371	0.708653	-0.138	63.430	1.49	0.607	28	0.397506	0.931024	4.10	42	0.008221	0.026346	0	discard	val_regression	2026-06-02 18:29	Add time-based exit at 30 bars (5 days) to lock in profits and reduce drawdown — structurally different exit family.
81da709	1.609754	3.139104	1.698777	5.067814	0.990057	0.656596	-0.423	41.484	2.17	0.480	25	1.071575	2.488604	6.98	27	0.014227	0.015307	0	discard	val_regression	2026-06-02 18:30	Recent rows show repeated 0-trade crashes and discards from over-filtered entries; lowering ADX threshold from 25→20 to increase trade frequency while retaining trend‑strength confirmation.
44cfcc2	1.273143	2.593651	1.353300	3.039994	0.970292	0.471111	0.654	73.095	1.99	0.500	28	0.686377	2.003831	2.90	42	-0.008229	0.032454	1	discard	val_regression	2026-06-02 18:30	Replace two‑state ATR stop multipliers with a continuous volatility‑adaptive formula (base * ATR/ATR_MA) for smoother, more responsive stop placement.
a3f2fee	1.625407	2.923388	1.682731	3.811431	0.990511	0.644676	0.311	18.214	3.19	1.000	23	0.373686	0.685970	8.57	20	0.015033	0.017786	0	discard	val_regression	2026-06-02 18:31	Add profit-dependent trailing stop: tighten multiplier from 3.0/3.6 to 2.0×ATR once profit reaches 2.0 ATR, locking gains while letting winners run.
5d834dc	0.000000	0.000000	0.000000	0.000000	0.000000	0.000000	0.000	0.000	0.00	0.000	0	0.000000	0.000000	0.00	0	0.000000	0.000000	0	crash	crash	2026-06-02 18:32	Add RSI overbought filter (< 70) to entry to avoid buying overextended breakouts — structurally different oscillator-based filter to reduce drawdown and improve risk-adjusted returns.
6930b2c	1.932072	4.020805	2.038235	6.935658	0.997278	0.801391	-0.416	45.338	1.88	0.571	21	1.361678	4.667876	4.40	26	0.009724	0.024045	0	discard	val_regression	2026-06-02 18:33	Remove RSI<70 filter (crashed to 13/7 trades) to restore >=20 trade count
dd31680	1.512754	2.917253	1.613909	4.650913	0.986430	0.608121	-0.437	55.234	1.87	0.583	24	1.161925	4.026388	3.96	30	0.010956	0.018267	0	discard	val_regression	2026-06-02 18:34	Use highest High instead of highest Close for ATR trailing stop to make exit more responsive to intra-bar extremes and reduce drawdown without altering trade frequency.
e3de251	1.604712	3.071954	1.725843	5.485641	0.990973	0.664494	-0.436	40.926	2.05	0.500	24	1.415203	4.921205	4.34	28	0.009724	0.017967	0	discard	val_regression	2026-06-02 18:35	Replace Donchian breakout entry with Keltner channel breakout (EMA+ATR bands) to reduce sensitivity to extreme highs and improve trend-entry robustness — structurally different entry family.
ced2c5b	1.926989	3.868230	2.047431	5.542351	0.997476	0.806582	-0.268	39.878	2.46	0.500	26	1.414632	5.132341	4.59	36	0.008404	0.025351	0	discard	val_regression	2026-06-02 18:36	Remove volatility-regime entry filter (ATR > 0.95×ATR_MA) to increase entry frequency — recent mutations have been discarding with low trade counts; trend filter and ADX remain to preserve quality.
11981c6	1.612171	3.129483	1.686972	4.621717	0.989759	0.647377	-0.332	38.611	2.42	0.464	28	1.374609	5.749630	3.69	30	0.014227	0.017367	0	discard	val_regression	2026-06-02 18:37	Replace ADX trend-strength filter with MACD histogram entry confirmation: macd_hist > 0 signals bullish momentum, structurally different from ADX and less restrictive, aiming to increase trade frequen
052f0f7	1.932072	4.020805	2.038235	6.935658	0.997278	0.803397	-0.416	45.338	1.88	0.571	21	1.361678	4.667876	4.40	26	0.009724	0.024045	0	discard	val_regression	2026-06-02 18:38	Remove dual Donchian exit — rely solely on ATR trailing stop for exits; simplifies the strategy and lets winners run longer without premature reversal exits.
08cc9c1	1.779487	3.523734	1.873209	4.822641	0.994955	0.738446	-0.251	37.113	2.62	0.419	31	1.422940	5.390081	4.41	37	0.006415	0.022607	0	discard	val_regression	2026-06-02 18:39	Recent experiments show frequent single-digit trade counts from over-filtered entries; relax ADX to 22 and remove vol_regime_high filter to restore >=20 trades while keeping trend and momentum filters
27c5563	1.641825	3.216902	1.731801	5.167404	0.991174	0.672489	-0.421	41.643	2.17	0.480	25	1.372840	4.759554	4.40	28	0.014227	0.015810	0	discard	val_regression	2026-06-02 18:40	Recent experiments show 0-trade crashes from over-filtered entries and discards from low trade counts; reduce ADX threshold from 25 to 20 and lower Donchian breakout period from 28 to 24 to widen the 
851933c	1.269399	2.318915	1.346127	2.770115	0.967332	0.467735	-0.553	75.210	2.34	0.560	25	0.852096	3.188764	2.56	39	-0.008560	0.029763	1	discard	val_regression	2026-06-02 18:41	Replace binary vol regime switching in ATR trailing stop with continuous scaling to avoid abrupt stops and improve risk-adjusted exits.
afef2a4	1.450406	2.548182	1.302875	4.738865	0.964370	0.438125	0.159	67.279	1.26	0.639	36	0.188482	0.304898	5.85	52	0.018309	0.009609	0	discard	val_regression	2026-06-02 18:42	Add fixed ATR-based take-profit exit (price >= entry + 3×ATR) to lock gains earlier and improve risk-adjusted returns.
663bc3d	1.855708	3.872732	1.975286	6.509746	0.996416	0.772416	-0.493	50.480	1.88	0.545	22	1.358702	4.681833	4.21	27	0.016411	0.017985	0	discard	val_regression	2026-06-02 18:42	Recent mutations are being discarded with lower Sharpe than the best-kept (targeting ~1.93 peak); the Donchian breakout + ADX + SMA200 regime filter + dual exit is generating trades but we are stuck i
bad7013	2.029833	4.689042	2.193796	6.773782	0.998722	0.855361	0.248	62.207	1.80	0.545	22	0.797622	2.502905	3.41	35	0.022369	0.018868	0	discard	val_regression	2026-06-02 18:43	Replace Donchian channel exit with ADX/DI trend-fading exit to break out of local optimum — exits when trend weakens (ADX<20 & Plus_DI<Minus_DI) instead of price breaching lower band, capturing profit
5a293ea	0.000000	0.000000	0.000000	0.000000	0.000000	0.000000	0.000	0.000	0.00	0.000	0	1.262272	4.476701	4.98	23	0.000000	0.000000	0	discard	min_trades	2026-06-02 18:43	Remove profit-dependent trailing stop tightening and increase base ATR trailing multipliers to let winners run longer, targeting higher Sharpe.
74a0d0e	0.000000	0.000000	0.000000	0.000000	0.000000	0.000000	0.000	0.000	0.00	0.000	0	0.000000	0.000000	0.00	0	0.000000	0.000000	0	crash	crash	2026-06-02 18:44	Replace Donchian breakout entry with Bollinger pullback entry (price < lower band) to increase trade frequency via mean-reversion in uptrend — structural change from previous parameter tweaks that fai
67556fb	1.624794	3.019702	1.740270	5.530817	0.991961	0.671364	-0.022	28.031	2.35	0.474	38	1.348118	3.373900	7.45	43	0.005116	0.021666	0	discard	val_regression	2026-06-02 18:45	Replace Bollinger lower-band pullback entry with middle-band breakout (close > bb_mid) to increase trade frequency and fix 0-trade crash from over-filtered entry stack.
2103a89	1.926989	3.868230	2.047431	5.542351	0.997476	0.805417	-0.268	39.878	2.46	0.500	26	1.414632	5.132341	4.59	36	0.008404	0.025351	0	discard	val_regression	2026-06-02 18:47	Remove volatility regime gate (ATR>0.95*ATR_MA) from entry to simplify and increase trade frequency while keeping ADX and SMA200 filters — prior discard combined this with ADX relaxation; isolating th
970a960	1.932072	4.020805	2.038235	6.935658	0.997278	0.802344	-0.416	45.338	1.88	0.571	21	1.448994	5.945429	3.69	24	0.009724	0.024045	0	discard	val_regression	2026-06-02 18:48	Add directional filter (Plus_DI > Minus_DI) to entry, ensuring breakouts align with bullish momentum, to improve trade quality and break out of local optimum near Sharpe 1.93.
198b208	1.932072	4.020805	2.038235	6.935658	0.997278	0.803740	-0.416	45.338	1.88	0.571	21	1.361678	4.667876	4.40	26	0.009724	0.024045	0	discard	val_regression	2026-06-02 18:48	Remove Donchian channel exit — let ATR trailing stop (with profit-dependent tightening) be the sole exit, simplifying the strategy and letting winners run longer without early pullback exits.
8f2e63c	1.641825	3.216902	1.731801	5.167404	0.991174	0.671575	-0.421	41.643	2.17	0.480	25	1.380585	4.786195	4.40	27	0.014227	0.015810	0	discard	val_regression	2026-06-02 18:49	Lower ADX threshold from 25 to 20 to increase trade frequency and capture more trends, aiming to break local optimum near Sharpe 1.93.
07bca79	1.932072	4.020805	2.038235	6.935658	0.997278	0.805374	-0.416	45.338	1.88	0.571	21	1.361678	4.667876	4.40	26	0.009724	0.024045	0	discard	val_regression	2026-06-02 18:50	Recent experiments have been hovering just below the best-kept Sharpe (~1.93) with discards and zero-trade crashes. The ADX threshold reduction (25→20) still discarded at 1.64. The common pattern: the
b4b7e28	1.512533	2.947588	1.681810	4.802566	0.988572	0.646886	-0.967	65.167	1.94	0.545	22	1.388924	5.428097	3.62	28	0.010252	0.020692	0	discard	val_regression	2026-06-02 18:54	Replace binary profit-dependent stop tightening with continuous linear interpolation, gradually tightening the trailing multiplier from regime-adaptive base to tight multiplier as profit increases fro
d1b015a	1.546974	2.940951	1.658678	5.220706	0.988493	0.636751	-0.454	42.083	2.05	0.500	24	1.342154	5.350380	3.89	30	0.009724	0.017312	0	discard	val_regression	2026-06-02 18:55	Replace Donchian upper-band entry with Keltner channel upper-band breakout for volatility-adaptive trend-following entry signal — structural change to break local optimum near Sharpe 1.93.
62638c3	1.923900	3.994104	2.031125	7.566829	0.997203	0.803845	-0.413	44.656	1.72	0.545	22	1.430387	5.012403	4.40	28	0.009724	0.024417	0	discard	val_regression	2026-06-02 18:55	Reduce Donchian breakout entry period from 28 to 20 bars to increase trade frequency while keeping all existing quality filters — prior parameter tweaks and structural swaps all discarded; frequency c
2c09642	1.149911	1.924580	1.209028	2.907901	0.951027	0.396628	-0.772	71.710	1.81	0.611	36	0.436032	0.986709	3.86	49	0.013220	0.012833	0	discard	val_regression	2026-06-02 18:56	Replace dual exit (Donchian lower + ATR trailing) with single ATR trailing stop plus take-profit at 3.0 ATR to improve risk/reward and break local optimum near Sharpe 1.93.
a6ef740	1.932072	4.020805	2.038235	6.935658	0.997278	0.802593	-0.416	45.338	1.88	0.571	21	1.360484	4.666274	4.40	27	0.009724	0.024045	0	discard	val_regression	2026-06-02 18:57	Reduce Donchian breakout entry period from 28 to 24 bars to increase trade frequency while keeping all existing filters — recent experiments show 0-trade crashes and discards around the optimum; a mod
c6ef3b7	2.012243	4.306184	2.110011	7.908477	0.998151	0.831993	0.026	44.559	1.84	0.542	24	1.291203	4.604562	4.42	32	0.026169	0.014718	0	discard	val_regression	2026-06-02 19:00	Replace SMA200 trend filter with Plus_DI > Minus_DI directional filter to capture breakouts earlier while aligning with bullish momentum — single-filter swap to break local optimum near Sharpe 1.93.
70e2c3b	1.932072	4.020805	2.038235	6.935658	0.997278	0.805257	-0.416	45.338	1.88	0.571	21	1.361678	4.667876	4.40	26	0.009724	0.024045	0	discard	val_regression	2026-06-02 19:01	Add volume confirmation filter (Volume > 0.75 * 20-period SMA) to entry to filter weak breakouts and improve trade quality, aiming to break local optimum near Sharpe 1.93.
511fab1	1.612171	3.129483	1.686972	4.621717	0.989759	0.651410	-0.332	38.611	2.42	0.464	28	1.318462	4.613160	4.40	31	0.014227	0.017367	0	discard	val_regression	2026-06-02 19:02	Remove volatility-regime ADX threshold requirement on entry — ADX > 25 is the most restrictive filter causing 0-trade crashes when combined with breakout+trend+vol; drop it to widen the entry set and 
56c8e71	1.672649	3.467209	1.798513	5.479722	0.993254	0.706250	-0.236	42.064	3.03	0.464	28	1.250355	4.406864	5.48	31	0.015249	0.015340	0	discard	val_regression	2026-06-02 19:03	Replace binary ADX threshold with continuous ADX-weighted entry filter — use ADX z-score to scale position size, rewarding stronger trends while retaining marginal entries near the threshold.
6e0f359	2.032226	4.292404	2.157527	7.430195	0.998368	0.848578	-0.357	44.287	1.88	0.571	21	1.218926	3.687810	5.12	32	0.021220	0.018689	0	discard	val_regression	2026-06-02 19:04	Reduce SMA trend filter period from 200 to 150 to capture stronger uptrends earlier while maintaining regime protection — a conservative parameter tweak to break out of the current orbit near Sharpe 1
49c71ab	0.658667	1.108967	0.700204	1.012357	0.835938	0.164704	0.735	39.609	3.73	0.345	29	0.593443	0.897976	8.93	28	-0.043540	0.053452	2	discard	val_regression	2026-06-02 19:05	Replace Donchian breakout entry with MACD bullish crossover entry – structural shift from price breakout to momentum signal to break out of the local optimum plateau with similar Sharpe values.
