commit	val_sharpe	sortino	sharpe_ann_4h	calmar	psr	dsr	skew	kurtosis	max_drawdown	win_rate	total_trades	status	timestamp	description
2da5fcb	1.262948	2.595571	1.329891	6.046244	0.990726	0.665439	1.844	49.996	6.77	0.548	62	discard		Recent keeps (1b519de, 413e1ba) both used atr_multiplier=2.5 and achieved sharpe 1.52–1.58 with 44–57 trades and 6–7% DD; the last 3 rows show oscillation near that basin (sharpe 1.37–1.47, all discar
eea6e77	1.282689	2.679212	1.482397	7.711747	0.994823	0.755214	0.235	43.975	7.54	0.491	53	discard		Recent best keeps (413e1ba sharpe 1.58 DD 6.77%, 1b519de sharpe 1.52 DD 6.16%) both used atr_multiplier=2.5, base_fraction=0.75, and atr_vol_threshold=1.0 with 44–57 trades. The last 5 rows show all d
49c80e1	1.582011	3.657823	1.812853	9.694214	0.999272	0.901031	1.112	44.254	6.77	0.544	57	discard		Recent 10 rows show tight clustering around sharpe 1.28–1.52 with all discards; the best keeps (413e1ba, 1b519de) achieved sharpe 1.52–1.58 with atr_multiplier=2.5, base_fraction=0.75, atr_vol_thresho
a6e269c	1.122911	2.145450	1.193383	3.392455	0.982996	0.572895	2.279	57.472	9.55	0.618	76	discard		Recent best keeps (413e1ba sharpe 1.58 DD 6.77%, 1b519de sharpe 1.52 DD 6.16%) both used atr_multiplier=2.5, base_fraction=0.75, atr_vol_threshold=1.0, and max_bars_in_trade=40 — achieving stable 44–5
7245629	1.262948	2.595571	1.329891	6.046244	0.990726	0.667943	1.844	49.996	6.77	0.548	62	discard		Reduce max_bars_in_trade from 40 to 25 bars (~4.2 days on 4h) to exit earlier in post-breakout chop; recent 10 rows cluster tightly (sharpe 1.12–1.58, all discards except one keep at 1.58) suggesting 
b898613	1.416859	3.833609	1.812796	12.484244	0.999277	0.901309	1.144	44.012	13.07	0.544	57	discard		Recent 10 rows cluster tightly around sharpe 1.28–1.58 with all discards except two keeps (413e1ba 1.58, 1b519de 1.52); all mutations of atr_multiplier, base_fraction, atr_vol_threshold, and max_bars_
aa50e2f	0.117201	0.175993	0.145546	0.225380	0.599660	0.050895	0.826	84.469	8.96	0.491	108	discard		Recent 10 rows show tight clustering (sharpe 1.28–1.58) with 7 consecutive discards; the last two keeps (413e1ba 1.58, 1b519de 1.52) both used atr_multiplier=2.5, base_fraction=0.75, atr_vol_threshold
ebdd5bf	1.285292	2.751658	1.492037	4.768451	0.995564	0.727040	1.223	58.234	9.55	0.458	48	discard		Recent 10 rows show tight clustering around sharpe 1.28–1.58 with 7+ consecutive discards; all parameter tweaks of atr_multiplier, base_fraction, atr_vol_threshold, and max_bars_in_trade have been exh
2005d09	0.850464	1.380962	0.896084	1.923073	0.942434	0.331137	2.170	137.127	6.19	0.714	28	discard	2026-05-05 19:17	The last 10 rows cluster tightly around sharpe 1.28–1.58 with all discards except two keeps (413e1ba 1.58, 1b519de 1.52). All parameter mutations have been exhausted without escaping this basin. The e
a50f6e7	0.400929	0.665906	0.402687	1.105491	0.757341	0.099006	0.227	91.595	6.40	0.500	28	discard	2026-05-05 19:18	Add RSI-based exit: close position when RSI drops below 30 (oversold capitulation after breakout), complementing the Donchian and ATR exits. Recent 10 rows show tight clustering (sharpe 1.28–1.58) wit
d521cca	0.629540	1.154502	0.735653	1.772858	0.900373	0.221788	1.031	33.380	14.50	0.367	79	discard	2026-05-05 19:18	Replace Donchian entry with MACD crossover (fast=12, slow=26); retains ATR trailing stop and time-decay exit. Recent 10 rows all discard clustered near sharpe 1.28–1.58 — exhausted all Donchian parame
c20da6b	0.288073	0.460343	0.294400	0.721095	0.695299	0.061867	0.693	102.369	6.40	0.462	26	discard	2026-05-05 19:19	Replace Donchian breakout entry with volume-confirmation rule: only trigger breakout if volume is above 20-bar MA. Recent 10 rows show exhaustion of parameter tuning on existing Donchian logic (atr_mu
fd8254b	1.396162	3.117237	1.627562	6.002473	0.997805	0.764303	0.932	40.610	9.82	0.530	66	discard	2026-05-05 19:19	Replace Donchian breakout entry with Bollinger Band breakout (20-period, 2σ), filtering for RSI momentum confirmation (RSI > 50). Recent 10 rows exhausted all Donchian parameter mutations; Bollinger c
5eb7f36	1.106476	2.252753	1.203914	4.140080	0.984947	0.490565	4.146	191.741	3.56	0.679	28	discard	2026-05-05 19:55	Recent 10 rows show persistent clustering around sharpe 1.28–1.58 with exhausted parameter tuning on entry/exit thresholds. Structural mutations (MACD, volume, Bollinger) all crashed or regressed. Dia
0366193	0.000000	0.000000	0.000000	0.000000	0.000000	0.000000	0.000	0.000	0.00	0.000	0	crash	2026-05-05 19:56	Recent 10 rows show exhaustion of parameter tweaks (atr_multiplier, base_fraction, max_bars_in_trade) and failed structural mutations (MACD, volume, Bollinger). All clustering near sharpe 1.28–1.58 wi
44be89b	-0.144322	-0.198521	-0.107057	-0.234273	0.426454	0.011199	0.296	97.813	7.84	0.450	20	discard	2026-05-05 19:59	Regime gate (price > EMA-200) is filtering out too many valid breakouts, causing only 19 trades (below MIN_TRADES=20). Remove the uptrend regime filter and relax RSI threshold from 70→65 to admit slig
685c8ee	1.582011	3.657823	1.812853	9.694214	0.999272	0.824688	1.112	44.254	6.77	0.544	57	discard	2026-05-05 20:00	Recent 10 rows show exhaustion of parameter tuning and structural mutations clustered near sharpe 1.28–1.58. The strategy crashes or discards repeatedly (aa50e2f sharpe 0.117 with 108 trades suggests 
51eeb0c	0.496796	0.948127	0.501795	1.091228	0.808097	0.085835	0.892	212.429	6.50	0.429	28	discard	2026-05-05 20:00	Recent 10 rows show exhaustion of parameter tuning and structural mutations clustered tightly around sharpe 1.28–1.58. All Donchian variants, MACD, Bollinger, volume, and regime gates have been tested
3e3f419	0.000000	0.000000	0.000000	0.000000	0.000000	0.000000	0.000	0.000	0.00	0.000	0	crash	2026-05-05 20:01	Recent 10 rows cluster tightly at sharpe 1.28–1.58 with all structural mutations (MACD, Bollinger, volume) either crashing or regressing. The core Donchian + ATR system is locally optimal. Diagnosis: 
c78fa55	1.582011	3.657823	1.812853	9.694214	0.999272	0.814012	1.112	44.254	6.77	0.544	57	discard	2026-05-05 20:02	The RSI momentum-crossing filter (`rsi[-2] <= 40 and rsi[-1] > 40`) is too strict for crypto's volatile 4h bars. RSI rarely holds a clean crossing threshold; entry set shrank to 3 trades. Revert to th
b4eb090	1.158052	2.353920	1.203128	2.908453	0.981482	0.425109	1.280	194.172	6.53	0.679	28	discard	2026-05-05 20:03	Recent 10 rows show persistent clustering near sharpe 1.28–1.58 with repeated crashes/discards from structural mutations (MACD, Bollinger, volume). The core Donchian + ATR system is locally trapped. D
a387ac4	0.292467	0.484286	0.320562	0.865644	0.710783	0.043742	0.375	134.220	5.71	0.500	28	discard	2026-05-05 20:03	Recent 10 rows show tight clustering around sharpe 1.28–1.58 with all structural mutations (MACD, Bollinger, volume, RSI momentum gates) exhausted and crashing. The current Donchian + ATR + RSI overbo
accac42	0.949719	1.870448	0.989105	3.485522	0.957996	0.274756	1.104	62.534	6.28	0.526	38	discard	2026-05-05 20:04	Recent 10 rows show the strategy is locally trapped near sharpe 1.28–1.58 with exhausted parameter tuning and failed structural mutations (MACD, Bollinger, volume, RSI gates all crashed/regressed). Th
dc5bb1a	0.382973	0.639642	0.402450	1.164448	0.757666	0.054024	0.680	78.839	6.55	0.429	28	discard	2026-05-05 20:05	Recent 10 rows are trapped in a tight local basin (sharpe 1.28–1.58) with all structural mutations exhausted and crashing. The current strategy has locked in: Donchian breakout entry + ATR trailing st
2b17956	-0.144322	-0.198521	-0.107057	-0.234273	0.426454	0.005913	0.296	97.813	7.84	0.450	20	discard	2026-05-05 20:05	Recent 10 rows show the core Donchian+ATR system is trapped near sharpe 1.28–1.58 with all structural mutations (MACD, Bollinger, volume, RSI gates) exhausted and crashing. The last kept baseline (685
5840618	0.592749	1.023868	0.606134	1.631260	0.853502	0.083796	0.577	114.747	6.40	0.536	28	discard	2026-05-05 20:06	Recent 10 rows show the strategy is stuck near sharpe 1.28–1.58 with all structural mutations (MACD, Bollinger, volume, RSI gates) exhausted. The current parameters (20/15 Donchian, 2.5× ATR trailing,
ed405d2	0.382973	0.639642	0.402450	1.164448	0.757666	0.040477	0.680	78.839	6.55	0.429	28	discard	2026-05-05 20:06	The strategy is trapped in a local optimum (sharpe ~1.28–1.58) with all structural mutations exhausted. Recent rows show the core Donchian+ATR system has converged; parameter tweaks now regress. Diagn
2178ba1	0.000000	0.000000	0.000000	0.000000	0.000000	0.000000	0.000	0.000	0.00	0.000	0	crash	2026-05-05 20:07	Replace RSI overbought filter (rejection at RSI > 70) with RSI momentum confirmation (entry only when RSI crosses above 40 from below), to capture mean-reversion bounces after crypto liquidations and 
7272b21	0.387662	0.643068	0.390193	1.067637	0.750523	0.036837	0.225	91.410	6.40	0.500	28	discard	2026-05-05 20:11	RSI momentum-crossing filter is too strict for crypto 4h bars; RSI rarely sustains clean threshold crossings. Reverting to RSI overbought rejection (RSI < 70) to restore entry set width while maintain
cf49191	0.866300	1.442459	0.963866	2.706665	0.952931	0.205568	0.453	43.033	8.84	1.000	21	discard	2026-05-05 20:12	Recent 10 rows show the strategy is trapped in a sharpe 1.28–1.58 basin with all structural mutations (MACD, Bollinger, volume, RSI momentum gates) exhausted and crashing. The core Donchian+ATR system
d641f40	0.000000	0.000000	0.000000	0.000000	0.000000	0.000000	0.000	0.000	0.00	0.000	0	crash	2026-05-05 20:12	Recent 10 rows show the strategy is trapped in a sharpe 1.28–1.58 local basin with structural mutations exhausted and crashing. The Donchian+ATR+RSI system has converged; time to escape the basin by r
2c337a2	0.387662	0.643068	0.390193	1.067637	0.750523	0.035421	0.225	91.410	6.40	0.500	28	discard	2026-05-05 20:15	RSI < 50 filter is too strict for mean-reversion on crypto 4h bars; reverting to RSI overbought rejection (RSI > 70) to restore entry set width and fix the 0-trade crash.
1384aaa	0.409388	0.688892	0.428018	1.121774	0.770961	0.038727	0.385	111.734	7.19	0.464	28	discard	2026-05-05 20:15	The strategy is trapped in a sharpe 1.28–1.58 local basin with all structural mutations (MACD, Bollinger, volume, RSI gates) exhausted and crashing. Recent successful keeps (685xxxx, be1c4a6, 3312101)
eb22e80	1.555808	3.580626	1.781685	9.251822	0.999127	0.715336	1.173	47.449	6.77	0.536	56	discard	2026-05-05 20:16	Recent 10 rows show the strategy is stuck in a tight local basin (sharpe 1.28–1.58) with all entry/exit mutations exhausted and repeated crashes from over-filtering. The core Donchian+ATR system has c
8f10036	0.681001	1.263479	0.696902	1.513674	0.886444	0.091724	0.286	64.909	10.79	0.386	44	discard	2026-05-05 20:17	Recent 10 rows show repeated crashes (0 trades) from over-constrained entry filters and parameter tweaks to sharpe 1.28–1.58. The Donchian+ATR+RSI system has exhausted structural mutations. Diagnosis:
5c0761a	1.185965	2.320767	1.340389	6.483837	0.989728	0.414521	0.089	38.055	7.90	0.455	77	discard	2026-05-05 20:17	The last 10 rows show repeated crashes (0 trades) and discards from over-filtering the entry set. The core issue: Donchian breakout + ATR vol gate + RSI overbought filter + time-decay exit create a ti
c982ca0	0.327078	0.541501	0.335371	0.891539	0.719447	0.025570	0.239	95.193	6.40	0.464	28	discard	2026-05-05 20:18	Recent experiments show the strategy is trapped in a sharpe 1.28–1.58 basin with all entry/exit mutations exhausted. The diagnosis: the Donchian+ATR+RSI system has converged and further tweaks crash o
41ca78a	0.382973	0.639642	0.402450	1.164448	0.757666	0.031190	0.680	78.839	6.55	0.429	28	discard	2026-05-05 20:18	Diagnosis: Last 10 rows show the strategy stuck in sharpe 1.28–1.58 basin with repeated crashes (0 trades) from over-constrained entry filters. The core issue is that Donchian breakout + ATR vol gate 
2a54994	0.000000	0.000000	0.000000	0.000000	0.000000	0.000000	0.000	0.000	0.00	0.000	0	crash	2026-05-05 20:19	Recent 10 rows exhausted entry-filter mutations and are trapped in a sharpe 0.39–1.56 oscillation with repeated crashes from over-filtering. The Donchian+ATR+RSI system has converged. Replace the RSI 
a2edf06	1.582011	3.657823	1.812853	9.694214	0.999272	0.716532	1.112	44.254	6.77	0.544	57	discard	2026-05-05 20:21	Stochastic %K threshold of 50 is too strict — crypto 4h breakouts need momentum confirmation, not rejection. Replace with Stochastic %D > 30 (early uptrend signal) to widen entry set and escape 0-trad
e8e4e32	0.000000	0.000000	0.000000	0.000000	0.000000	0.000000	0.000	0.000	0.00	0.000	0	crash	2026-05-05 20:21	The strategy is trapped in a local basin (sharpe 1.28–1.58) with repeated crashes from over-constrained entry filters. Replace the RSI overbought gate (RSI < 70) with a volatility-normalized mean-reve
53b5d66	0.387662	0.643068	0.390193	1.067637	0.750523	0.027837	0.225	91.410	6.40	0.500	28	discard	2026-05-05 20:22	Diagnosis: The pullback filter is too strict — it requires a 1.5% pullback from the upper Donchian band within 3 bars before entry, but crypto 4h breakouts often spike directly without prior consolida
ddc60d1	1.036411	2.066858	1.135257	2.699423	0.976348	0.258753	1.147	75.575	10.71	0.405	42	discard	2026-05-05 20:23	Replace RSI overbought gate (which filters out 90% of breakouts in strong trends) with a pullback confirmation: only enter if close is within 2% of the upper Donchian band and price has pulled back at
54332ea	0.000000	0.000000	0.000000	0.000000	0.000000	0.000000	0.000	0.000	0.00	0.000	0	crash	2026-05-05 20:23	Replace RSI overbought filter with Stochastic %K mean-reversion gate: only enter when Stochastic %K is below 50 (early uptrend, not late-stage exhaustion), avoiding false breakouts near RSI 70 extreme
b75b3c1	0.000000	0.000000	0.000000	0.000000	0.000000	0.000000	0.000	0.000	0.00	0.000	0	crash	2026-05-05 20:24	Diagnosis: The Stochastic %K threshold of 50 is too strict for crypto 4h breakouts. The filter rejects >90% of valid breakout entries because %K oscillates 20–80 over a single trend move; only the fir
f553e7f	0.000000	0.000000	0.000000	0.000000	0.000000	0.000000	0.000	0.000	0.00	0.000	0	crash	2026-05-05 20:24	Stochastic %K threshold of 70 is still too strict — crypto 4h breakouts collapse to 3 trades. Relax to threshold 80 (true overbought, not mid-trend rejection) to widen entry set and escape 0-trade cli
2242892	1.232082	2.822620	1.431235	4.705160	0.996022	0.449177	5.009	112.083	6.08	0.538	26	discard	2026-05-05 20:25	Stochastic %K threshold of 80 still too strict — only 6 trades generated. Relax to 90 (true extreme exhaustion zone) to widen entry set and escape 0-trade cliff while preserving the overbought filter'
c9746e6	0.558175	0.993788	0.586793	1.750046	0.846631	0.056422	1.156	99.484	6.19	0.429	28	discard	2026-05-05 20:26	Diagnosis: Last 10 rows show repeated 0-trade crashes from entry-filter stack that has grown too constrained. Every mutation oscillates sharpe 0.38–1.58 with clusters of crashes. The root cause is NOT
83f1b33	1.582011	3.657823	1.812853	9.694214	0.999272	0.708327	1.112	44.254	6.77	0.544	57	discard	2026-05-05 20:26	The recent 10 rows show a pathological cycle: every entry-filter mutation (RSI, Stochastic %K at various thresholds, pullback checks) crashes to 0 trades or oscillates 0.39–1.58 with repeated crashes.
6e8d93c	1.582011	3.657823	1.812853	9.694214	0.999272	0.703825	1.112	44.254	6.77	0.544	57	discard	2026-05-05 20:27	Diagnosis: Last 10 rows show the strategy trapped in a cycle of entry-filter mutations (RSI, Stochastic %K thresholds, pullback checks) that repeatedly crash to 0 trades or oscillate wildly (0.39–1.58
babeeff	0.263265	0.410293	0.296910	0.689672	0.696980	0.017178	0.945	89.277	6.19	0.556	27	discard	2026-05-05 20:27	Diagnosis: Last 10 rows are dominated by 0-trade crashes from stacked entry filters (RSI overbought gate + volatility regime gate + Donchian breakout). Every attempt to add a new gate (Stochastic %K, 
a6bfde1	0.841300	1.646579	0.911595	3.247388	0.943252	0.141610	0.547	68.885	7.63	0.431	65	discard	2026-05-05 20:28	Diagnosis: Last 10 rows show a pathological cycle of entry-filter mutations — every attempt to add RSI, Stochastic, or pullback confirmation crashes to 0 trades or oscillates 0.38–1.58 Sharpe. The roo
8d9af5b	1.582011	3.657823	1.812853	9.694214	0.999272	0.692890	1.112	44.254	6.77	0.544	57	discard	2026-05-05 20:28	Diagnosis: Last 10 rows show repeated 0-trade crashes and wild oscillations (0.26–1.58 Sharpe) from stacked entry filters. Every mutation that *adds* a gate (RSI, Stochastic %K, pullback) collapses tr
b21a182	1.613154	3.857140	1.868012	8.679187	0.999515	0.723163	1.432	48.729	7.52	0.558	52	keep	2026-05-05 20:29	Diagnosis: Last 10 rows show a pathological cycle of entry-filter mutations causing repeated 0-trade crashes. Every attempt to add a gate (RSI overbought, Stochastic %K at various thresholds) collapse
5d341dc	1.613154	3.857140	1.868012	8.679187	0.999515	0.718060	1.432	48.729	7.52	0.558	52	discard	2026-05-05 20:30	Remove the Stochastic %K overbought filter entirely; it has caused 10 consecutive crashes/discards by over-constraining the entry set. Revert to the last known-good baseline (b21a182, sharpe 1.613, 52
f4baf95	1.325121	2.838685	1.536829	7.261169	0.996126	0.491255	0.404	48.754	8.06	0.500	48	discard	2026-05-05 20:30	Remove the time-decay exit (max_bars_in_trade = 40) — recent crashes suggest it is triggering too early and closing winning trades prematurely, reducing total profit. Simplify to two-rail exit (Donchi
7a21010	1.260658	2.612993	1.472114	6.479220	0.994546	0.447827	0.220	43.589	9.01	0.456	57	discard	2026-05-05 20:31	Diagnosis: Last 10 rows show repeated crashes and oscillations (0.26–1.58 Sharpe) from entry-filter mutations. The strategy is stuck in a local loop of adding gates (RSI, Stochastic, pullback) that co
55910a6	0.912701	1.893630	0.989179	2.934956	0.957972	0.165726	1.147	74.628	9.17	0.431	58	discard	2026-05-05 20:31	Diagnosis: Last 10 rows are dominated by entry-filter mutations that repeatedly crash to 0 trades or oscillate wildly (0.26–1.58 Sharpe). The best recent keep (b21a182, sharpe 1.613, 52 trades) remove
6f2dbdc	1.092350	2.134797	1.211193	2.785959	0.985541	0.276023	3.407	64.990	10.60	0.639	72	discard	2026-05-05 20:32	Diagnosis: Last 10 rows show the strategy stuck in a pathological loop — every entry-filter mutation (RSI, Stochastic, pullback checks) crashes to 0 trades or oscillates wildly (0.26–1.58 Sharpe). The
fcc1d82	0.184905	0.307702	0.203314	0.402002	0.638712	0.009987	3.700	123.954	6.98	0.396	106	discard	2026-05-05 20:32	Diagnosis: Last 10 rows are dominated by entry-filter mutations that crash to 0 trades or oscillate wildly (0.26–1.58 Sharpe). The best recent keep (b21a182, sharpe 1.613, 52 trades) uses no entry fil
33d114b	1.325774	3.019666	1.495137	6.169256	0.995782	0.458455	1.461	54.182	7.67	0.500	54	discard	2026-05-05 20:33	Diagnosis: Last 10 rows show a tight oscillation around sharpe 1.26–1.61 with repeated discards when attempting new entry filters. The best keep (b21a182, sharpe 1.613, 52 trades, DD 7.52%) uses a cle
fae35f4	1.334355	2.828821	1.535684	7.159406	0.996098	0.488591	0.394	48.869	7.54	0.500	48	discard	2026-05-05 20:33	Diagnosis: Last 10 rows reveal a pathological loop — every entry-filter mutation crashes or oscillates wildly (0.26–1.58 Sharpe). The best keep (b21a182, sharpe 1.613, 52 trades, DD 7.52%) removed all
244d723	1.254447	2.652682	1.446898	5.548026	0.993922	0.428589	0.385	47.425	9.84	0.500	48	discard	2026-05-05 20:34	Diagnosis: Last 10 rows show the strategy is stuck in a discard loop oscillating around sharpe 1.26–1.61 with repeated entry-filter mutations causing 0-trade crashes or wild swings. The best keep (b21
6839dee	1.245414	2.605473	1.438336	6.345546	0.993546	0.424960	0.276	55.322	8.06	0.500	48	discard	2026-05-05 20:35	Diagnosis: Last 10 rows show the strategy is stuck in a local optimum (sharpe 1.613, 52 trades, DD 7.52%) with repeated entry-filter mutations causing crashes or discards. The best keep (b21a182) remo
7215df1	1.325121	2.838685	1.536829	7.261169	0.996126	0.494528	0.404	48.754	8.06	0.500	48	discard	2026-05-05 20:35	Diagnosis: Last 10 rows show the strategy is stuck oscillating sharpe 0.18–1.61 with repeated crashes from entry-filter mutations. The best keeps (b21a182, 5d341dc) both removed filters entirely, reac
08778f9	1.245414	2.605473	1.438336	6.345546	0.993546	0.428037	0.276	55.322	8.06	0.500	48	discard	2026-05-05 20:36	Restore the time-decay exit (max_bars_in_trade = 40) but increase it to 60 bars (~10 days on 4h) to prevent premature closure of winning trades while retaining the benefit of exiting stale positions t
4814207	1.589278	3.881285	1.867512	8.977441	0.999515	0.718423	1.438	48.729	8.48	0.558	52	discard	2026-05-05 20:37	Increase base_fraction from 0.75 to 0.85 to recover capital deployment and Sharpe ratio after repeated entry-filter mutations exhausted the exploration space. The last stable keep (b21a182, sharpe 1.6
a471fbb	1.601155	3.869233	1.867764	8.827122	0.999515	0.714354	1.435	48.729	8.00	0.558	52	discard	2026-05-05 20:37	Diagnosis: Last 10 rows show repeated crashes and oscillations (0.18–1.59 Sharpe) from entry-filter mutations. Best recent keeps (b21a182, sharpe 1.613; 5d341dc) both removed filters entirely. Current
51a5bd7	1.131362	2.209908	1.265895	4.447122	0.986002	0.308509	0.451	46.328	9.95	0.461	102	discard	2026-05-05 20:38	Diagnosis: Last 10 rows dominated by entry-filter mutations causing 0-trade crashes or oscillations (0.18–1.61 Sharpe). Best keeps (b21a182, sharpe 1.613; 5d341dc) removed all stacked filters. Current
