commit	val_sharpe	sortino	sharpe_ann_4h	calmar	psr	dsr	skew	kurtosis	max_drawdown	win_rate	total_trades	status	timestamp	description
230412a	1.573018	3.021636	1.671968	6.301539	0.997971	0.490695	0.121	64.317	2.44	0.556	36	discard	2026-05-09 07:52	Remove time-decay exit (max_bars_in_trade) — the ATR trailing stop + Donchian break already handle exit rails; 40-bar time cutoff was added when Sharpe was oscillating 0.45–1.35 but may now be cutting
47bc776	1.677962	3.491546	1.773888	5.494376	0.999067	0.562503	1.302	70.999	2.48	0.537	41	discard	2026-05-09 07:56	Widen breakout entry to 20-bar (classic Turtle entry period) with tighter 12-bar exit to capture sharper momentum moves — structurally different from the current 24/15 split which trades less frequent
d090c67	1.873482	4.115177	2.004806	5.731820	0.999799	0.714320	1.592	68.302	2.72	0.632	38	discard	2026-05-09 12:57	Remove the short-Donchian break exit (15-bar lower band) — let winners run with only the ATR trailing stop and time-decay exit; the 15-bar exit may be cutting trends short before momentum fully develo
46223ae	1.949070	4.340470	2.085793	6.436143	0.999885	0.758640	1.620	68.972	2.53	0.605	38	discard	2026-05-09 12:59	Replace rolling-close-based ATR trailing stop with a highest-high Chandelier-style stop — ATR subtracted from the running peak since entry rather than from the most recent close. This is structurally 
3e62c75	1.477792	3.089675	1.581931	5.165380	0.997260	0.421725	1.660	104.840	2.04	0.548	42	discard	2026-05-09 13:05	Add volatility-adaptive Chandelier exit: stop distance scales with 1.5x the 14-bar ATR computed from the highest high since entry, adapting to evolving market volatility rather than using a fixed mult
da582f7	1.037397	2.095280	0.989297	2.630351	0.963278	0.101766	4.580	122.426	2.01	0.600	20	discard	2026-05-09 13:07	Replace volume ROC filter with RSI momentum confirmation (< 70) — structurally different signal that captures overbought avoidance rather than volume acceleration; loosens the entry set after recent s
4308bc5	1.899119	4.094628	1.990761	6.051992	0.999774	0.701743	1.403	59.301	2.68	0.619	42	discard	2026-05-09 13:08	Remove volume ROC filter and restore ATR-based trailing stop instead of the Chandelier exit — the previous removal of volume ROC improved Sharpe to 1.81 with 50 trades, but it was tested before the AD
181e7e0	1.573018	3.021636	1.671968	6.301539	0.997971	0.484934	0.121	64.317	2.44	0.556	36	discard	2026-05-09 13:16	Remove time-decay exit (40-bar max) — let winners run with ATR + Donchian exits only; trades can now run beyond 6.7 days to capture sustained trends that currently get cut short.
c494084	1.912161	4.256349	2.054807	6.801943	0.999857	0.738806	1.642	73.399	2.31	0.611	36	discard	2026-05-09 18:48	Add Bollinger Band breakout confirmation to entry conditions — require price to also exceed the upper Bollinger Band (2SD above 20-bar SMA) in addition to the existing Donchian breakout. This confirms
70898ec	0.740522	1.423019	0.836211	2.396322	0.922191	0.071823	-1.308	221.249	13.49	0.632	38	discard	2026-05-09 18:51	Replace inverse-ATR position sizing with volatility-targeting: size positions so that a 1% price move translates to a fixed fraction of account equity, maintaining consistent dollar exposure across hi
5489c87	1.899119	4.094628	1.990761	6.051992	0.999774	0.697217	1.403	59.301	2.68	0.619	42	discard	2026-05-09 18:52	Remove volume ROC momentum filter from entry conditions — recent experiment 4308bc5 showed removing it improved Sharpe to 1.899 with 42 trades; given the current baseline already includes ADX and ATR 
3d2e923	0.000000	0.000000	0.000000	0.000000	0.000000	0.000000	0.000	0.000	0.00	0.000	0	crash	2026-05-09 19:01	Add daily-trend filter: only take longs when 4h close > 20-bar SMA of daily closes. This gates entries into the direction of the larger trend without the 200-bar restriction that caused 0-trade crashe
9b4d73d	1.899119	4.094628	1.990761	6.051992	0.999774	0.695084	1.403	59.301	2.68	0.619	42	discard	2026-05-22 17:52	Fix 0-trade crash by removing the daily-trend filter (incompatible 4h-vs-daily bar mismatch); also strip the volume ROC filter per prior best-result experiment 5489c87 which showed removing it improve
f73cf38	1.985617	4.456648	2.127660	7.172304	0.999915	0.772787	1.660	70.016	2.31	0.632	38	discard	2026-05-22 17:52	Restore time-decay exit (40-bar max) that was removed in experiment 181e7e0, which caused Sharpe to regress from 1.899→1.573. The trade-off is acceptable: the 2.68% drawdown floor and 38-trade count e
697b8bf	1.934194	4.303399	2.069884	6.362445	0.999872	0.737072	1.621	69.173	2.53	0.632	38	discard	2026-05-22 18:27	Increase Donchian exit period from 15 to 18 bars — letting winners run longer in sustained trends while remaining within the structural family that achieved best Sharpe (1.985 at 38 trades).
ecb2cf2	1.217636	2.316514	1.197812	3.869579	0.984023	0.176922	3.350	133.252	1.77	0.558	52	discard	2026-05-22 18:27	Replace the 40-bar fixed time-decay exit with an ATR-scaled time limit: hold for at most N × ATR periods where N scales with volatility regime (tighter in calm markets, looser during trends). This con
435387e	-0.329967	-0.503518	-0.292765	-0.414320	0.307250	0.000281	2.017	167.633	3.26	0.238	21	discard	2026-05-22 18:28	Switch from Turtle breakout entry to mean-reversion pullback entry — buy when price retraces to the EMA during an confirmed uptrend, confirmed by ADX and ATR regime, replacing the Donchian-channel-bre
ed00b4f	0.000000	0.000000	0.000000	0.000000	0.000000	0.000000	0.000	0.000	0.00	0.000	0	crash	2026-05-22 18:29	Add ATR-based take-profit exit as fourth parallel exit rail: close when price reaches entry + 3× current ATR (scales with volatility regime, tighter in calm markets). Complementing the existing Donchi
578b1b0	1.426596	2.831384	1.487749	4.516653	0.996062	0.320838	2.614	95.017	2.08	0.681	47	discard	2026-05-22 18:30	Fix AttributeError: track entry price manually since `self.position.entry_price` doesn't exist in this backtesting.py version.
