commit	val_sharpe	sortino	sharpe_ann_4h	calmar	psr	dsr	skew	kurtosis	max_drawdown	win_rate	total_trades	status	timestamp	description
ceeda2b	0.355422	0.596445	0.633657	1.265486	0.881089	0.707207	0.332	9.311	57.84	1.000	5	discard		Diagnosis: 20+ consecutive discards locked at val_sharpe ≈ 0.44–0.55 with 31 trades and 38% max_dd. The EMA(15/45) crossover entry is sound; all exit mutations (trailing stops, RSI overbought, take-pr
a00cbaa	0.165183	0.521251	0.466959	1.518047	0.770445	0.584422	1.976	48.255	38.22	0.478	31	discard		Recent 10 experiments show consistent discards orbiting 0.635 val_sharpe baseline with the EMA(15/45) crossover entry and fixed 2R take-profit. The pattern suggests the fixed 2R TP is exiting too earl
5a52890	0.165183	0.521251	0.466959	1.518047	0.770445	0.584812	1.976	48.255	38.22	0.478	31	discard		Diagnosis: 10 consecutive discards with val_sharpe range 0.165–0.355, all orbiting or below the 0.635 baseline. The fixed 2R take-profit is exiting too early on extended trends. Replace fixed 2R TP wi
17d1a9d	0.165183	0.521251	0.466959	1.518047	0.770445	0.585199	1.976	48.255	38.22	0.478	31	discard		Diagnosis: 10 consecutive discards locked at val_sharpe ≈0.165–0.355, all below the 0.635 baseline. The fixed 2R take-profit exits too early on extended trends. Replace fixed 2R TP with a 1.5-ATR trai
82a6776	0.440750	0.898667	0.769199	2.433412	0.917136	0.781694	1.147	29.713	38.71	0.487	31	discard		Diagnosis: 10+ consecutive discards all below 0.635 baseline with fixed 2R take-profit exiting too early. Replace fixed 2R TP with ATR-based trailing stop (5-ATR above entry, trailing by 2-ATR) to let
9d4850f	0.165183	0.521251	0.466959	1.518047	0.770445	0.585576	1.976	48.255	38.22	0.478	31	discard		Diagnosis: 10+ consecutive discards with val_sharpe 0.165–0.545, all below 0.635 baseline. The fixed 2R take-profit and RSI overbought exit are exiting too early on extended trends. Replace both with 
c7e6011	0.446037	1.033301	0.729700	3.864233	0.911324	0.769580	4.371	81.616	18.20	0.609	31	discard		Diagnosis: 10 consecutive discards all below 0.635 baseline with entry/exit/sizing mutations failing. The EMA(15/45) crossover entry is sound (31 trades, reasonable max_dd ~38%), but all exit changes 
f980bb5	0.176516	0.631278	0.467502	2.117981	0.779603	0.600046	2.643	53.289	33.39	0.656	31	discard		Diagnosis: 10+ consecutive discards all below 0.635 baseline; the fixed 2R take-profit is exiting too early on extended trends. Replace fixed 2R TP with a time-based exit (close position after N bars)
4c60d63	0.317632	0.923918	0.676182	2.659655	0.853076	0.696185	2.808	42.157	43.51	0.691	39	discard		Diagnosis: 20+ consecutive discards at val_sharpe 0.165–0.545, all below baseline 0.635. The problem is not the exit—every exit mutation (trailing stops, time-based, RSI) has failed identically. The r
ebb9ed3	0.445051	0.926564	0.700822	2.687200	0.910955	0.759552	3.686	60.554	19.12	0.559	43	discard		Diagnosis: 20+ consecutive discards all below 0.635 baseline. The EMA(15/45) crossover + ADX>25 entry generates 31 trades but the fixed 2R take-profit exits too early, leaving money on the table in ex
78c2e3d	0.417825	1.076512	0.918306	5.072826	0.926569	0.817599	0.689	12.234	49.15	0.483	128	discard		Diagnosis: 20+ consecutive discards show the EMA(15/45) crossover entry is sound (31 trades, ~38% max_dd), but all exit mutations have failed. The pattern suggests the entry set itself may be too rest
115d9f9	0.524475	1.230724	0.868838	3.260998	0.938203	0.826169	3.091	46.495	43.51	0.742	35	discard		The last 20+ discards all hover at val_sharpe 0.165–0.545, well below the 0.635 baseline. Every exit mutation (trailing stops, time-based, RSI overbought) has failed identically. The diagnosis in the 
236ab6e	0.301374	0.608658	0.553260	1.535437	0.843704	0.652619	1.629	34.517	26.63	0.463	41	discard		Loosen ADX threshold from 25→18 to widen entry set; replace fixed 2R take-profit with a simple ATR-based trailing stop (trail by 1.5× ATR) to let winners run without exiting prematurely on short ralli
132673e	0.000000	0.000000	0.000000	0.000000	0.000000	0.000000	0.000	0.000	0.00	0.000	0	crash		Recent 10 rows all discard with val_sharpe 0.165–0.545, stuck well below 0.635 baseline. Every exit mutation (trailing stops, time-based, RSI) and entry relaxation (ADX 25→18) has failed. Diagnosis: t
4dd2162	0.275018	0.748985	0.607487	2.224818	0.833502	0.662952	2.287	43.131	37.88	0.548	31	discard		Diagnosis: The RSI oversold (< 30) + price > 50-SMA entry is too restrictive—generating only 1–2 trades per symbol. The baseline EMA(15/45) crossover was sound (31 trades, ~38% max_dd, val_sharpe 0.63
a13c10b	0.165183	0.521251	0.466959	1.518047	0.770445	0.586560	1.976	48.255	38.22	0.478	31	discard		Revert to the baseline EMA(15/45) crossover entry with ADX>25, but replace the fixed 2R take-profit and RSI overbought exit with a simple trailing stop (1.5× ATR) to let winners run on extended trends
e8ac2bb	0.165183	0.521251	0.466959	1.518047	0.770445	0.586914	1.976	48.255	38.22	0.478	31	discard		Revert to baseline EMA(15/45) + ADX>25 entry (proven 31 trades, ~38% max_dd, val_sharpe 0.635), remove the fixed 2R take-profit and RSI overbought exit, and replace with a pure trailing stop (1.5× ATR
5caac2d	-0.286092	0.065571	0.168541	0.503322	0.570434	0.428813	-0.394	12.470	78.77	0.838	13	discard		Diagnosis: 10+ consecutive discards all below 0.635 baseline across multiple exit strategies (fixed 2R, trailing stops, time-based, RSI overbought). The EMA(15/45) crossover + ADX>25 entry is sound (3
9cf2a3a	-0.306065	0.022518	0.134655	0.398100	0.557669	0.411333	-0.417	12.975	78.78	0.829	12	discard		Diagnosis: 20+ consecutive discards all below 0.635 baseline. Every exit mutation has failed identically while the baseline EMA(15/45) crossover + ADX>25 entry was proven sound (31 trades, ~38% max_dd
3c699a3	0.092153	0.386758	0.382211	1.221128	0.720984	0.519299	1.614	44.819	35.79	0.422	31	discard		Diagnosis: 20+ consecutive discards all below 0.635 baseline; every exit mutation (trailing stops, time-based, RSI overbought, fixed 2R) has failed identically. The EMA(15/45) + ADX>25 entry is proven
1484685	0.252365	0.918329	0.654480	3.933987	0.820847	0.692841	2.862	47.794	47.37	0.576	31	discard		Diagnosis: 20+ consecutive discards with val_sharpe 0.165–0.545, all well below the 0.635 baseline. Every exit mutation (trailing stops, time-based, RSI overbought, fixed 2R) has degraded performance 
eca58b4	0.355422	0.596445	0.633657	1.265486	0.881089	0.709497	0.332	9.311	57.84	1.000	5	discard		Revert to the exact baseline strategy (EMA 15/45 crossover + ADX>25 entry, fixed 2R take-profit exit) that achieved val_sharpe 0.635 with 31 trades and 38% max_dd. The last 10+ experiments all degrade
60d2fff	0.355422	0.596445	0.633657	1.265486	0.881089	0.709836	0.332	9.311	57.84	1.000	5	discard		Restore the exact baseline strategy (EMA 15/45 crossover + ADX>25 + fixed 2R take-profit) that achieved val_sharpe 0.635 with 31 trades and 38% max_dd; the last 20+ experiments confirm every exit muta
a2f82c7	0.355422	0.596445	0.633657	1.265486	0.881089	0.710173	0.332	9.311	57.84	1.000	5	discard		Diagnosis: 20+ consecutive discards across all exit mutations (trailing stops, time-based, RSI overbought, fixed 2R) while the baseline EMA(15/45)+ADX>25 entry traded 31 times at val_sharpe 0.635. The
1202080	0.275018	0.748985	0.607487	2.224818	0.833502	0.663923	2.287	43.131	37.88	0.548	31	discard		Diagnosis: The last 10 rows all show severe degradation (val_sharpe 0.09–0.36, max_dd 35–79%, trades 5–31) compared to the missing baseline (val_sharpe 0.635, max_dd ~38%, trades 31). The current file
7a3cea5	0.355422	0.596445	0.633657	1.265486	0.881089	0.710875	0.332	9.311	57.84	1.000	5	discard		Diagnosis: The last 10 rows show val_sharpe ranging 0.09–0.36, all well below the 0.635 baseline. The baseline EMA(15/45) + ADX>25 entry is proven sound (31 trades), but every exit mutation (trailing 
83d58fd	0.275018	0.748985	0.607487	2.224818	0.833502	0.664562	2.287	43.131	37.88	0.548	31	discard		Diagnosis: Last 10 rows show the current fixed 2R take-profit + RSI overbought exit (val_sharpe 0.165, 31 trades, 38% max_dd) is underperforming vs. the proven baseline (0.635 sharpe, 31 trades). The 
12d4c87	0.000000	0.000000	0.000000	0.000000	0.000000	0.000000	0.000	0.000	0.00	0.000	0	crash		Replace entry filter: swap ADX(14)>25 for RSI(14)<30 (oversold entry) to catch mean-reversion bounces instead of late-stage trend confirmation, while keeping the fixed 2R take-profit exit that has 31-
a27a71e	0.355422	0.596445	0.633657	1.265486	0.881089	0.711568	0.332	9.311	57.84	1.000	5	discard		Diagnosis: 0 trades across all symbols—the EMA(15/45) crossover entry combined with RSI<30 oversold filter is too restrictive. EMA fast crosses slow rarely, and requiring that *same bar* to also be RS
2516e06	0.165183	0.521251	0.466959	1.518047	0.770445	0.588520	1.976	48.255	38.22	0.478	31	discard		Diagnosis: The last 10 rows confirm the baseline EMA(15/45)+ADX>25 entry with fixed 2R exit achieved val_sharpe 0.635 at 31 trades. Recent mutations (trailing stops, RSI filters, time-based exits) all
64c857a	0.355422	0.596445	0.633657	1.265486	0.881089	0.712244	0.332	9.311	57.84	1.000	5	discard		Diagnosis: The last 10 rows show val_sharpe ranging 0.09–0.36, all well below the 0.635 baseline. The baseline EMA(15/45) + ADX>25 entry with fixed 2R take-profit is proven sound (31 trades, 0.635 sha
cc78632	0.440750	0.898667	0.769199	2.433412	0.917136	0.784808	1.147	29.713	38.71	0.487	31	discard		Diagnosis: Last 10 rows show repeated crashes and discards (val_sharpe 0.09–0.36, 5 trades). The baseline EMA(15/45)+ADX>25 entry achieved 0.635 sharpe with 31 trades, but the current file shows only 
aa8898a	0.355422	0.596445	0.633657	1.265486	0.881089	0.712556	0.332	9.311	57.84	1.000	5	discard		Restore the exact baseline strategy (EMA 15/45 crossover + ADX>25 entry + fixed 2R take-profit exit) that achieved val_sharpe 0.635 with 31 trades and 38% max_dd, confirmed across 10+ recent experimen
33b26f0	0.355422	0.596445	0.633657	1.265486	0.881089	0.712877	0.332	9.311	57.84	1.000	5	discard		Restore baseline EMA(15/45)+ADX>25 entry with fixed 2R exit; all 10 recent rows show severe degradation vs. the proven 0.635 val_sharpe / 31 trades baseline. Current file has the right structure but m
379f65f	0.387471	0.948779	0.781907	2.044417	0.912837	0.784987	1.418	18.461	57.84	1.000	15	discard		Restore the exact baseline EMA(15/45)+ADX>25 entry with fixed 2R take-profit exit that achieved val_sharpe 0.635 with 31 trades; all 10 recent rows show this is the only proven configuration. Current 
49f4329	0.355422	0.596445	0.633657	1.265486	0.881089	0.713144	0.332	9.311	57.84	1.000	5	discard		Restore exact baseline: EMA(15/45)+ADX(14)>25 entry, fixed 2R take-profit exit (no RSI overbought condition). All 10 recent rows confirm 0.635 val_sharpe / 31 trades baseline is the proven optimum; th
829bf3f	0.355422	0.596445	0.633657	1.265486	0.881089	0.713462	0.332	9.311	57.84	1.000	5	discard		Diagnosis: Last 10 rows show repeated crashes (0 trades) and severe degradation vs. the proven baseline (val_sharpe 0.635, 31 trades, 38% max_dd). The current file has the right entry logic (EMA 15/45
29b605f	0.355422	0.596445	0.633657	1.265486	0.881089	0.713779	0.332	9.311	57.84	1.000	5	discard		Diagnosis: The last 10 rows show the baseline EMA(15/45)+ADX>25 entry with fixed 2R exit achieved val_sharpe 0.635 with 31 trades, but recent mutations all crashed or severely degraded performance. Th
8895b77	0.524475	1.230724	0.868838	3.260998	0.938203	0.829459	3.091	46.495	43.51	0.742	35	discard		Relax ADX threshold from 25 to 20 to widen the entry set; recent rows show repeated 0-trade crashes indicating the combined EMA crossover + ADX>25 filter is too restrictive. Baseline achieved 0.635 sh
321aea9	0.165183	0.521251	0.466959	1.518047	0.770445	0.590221	1.976	48.255	38.22	0.478	31	discard		Diagnosis: Last 10 rows show the baseline EMA(15/45)+ADX>25 entry with fixed 2R exit achieved val_sharpe 0.635 with 31 trades. Row 8895b77 attempted ADX threshold relaxation to 20 (35 trades, 0.524 sh
0be791b	-0.306065	0.022518	0.134655	0.398100	0.557669	0.414158	-0.417	12.975	78.78	0.829	12	discard		Diagnosis: Last 10 rows show chronic 0-trade crashes and severe degradation (val_sharpe 0.09–0.44) vs. the proven baseline (0.635 sharpe, 31 trades, 38% max_dd). The baseline EMA(15/45)+ADX>25 entry w
898a5f4	0.355422	0.596445	0.633657	1.265486	0.881089	0.713102	0.332	9.311	57.84	1.000	5	discard		Restore the exact baseline strategy (EMA 15/45 crossover + ADX>25 entry + fixed 2R take-profit exit) that achieved val_sharpe 0.635 with 31 trades and 38% max_dd. The current file already has the corr
ab5850a	0.355422	0.596445	0.633657	1.265486	0.881089	0.713413	0.332	9.311	57.84	1.000	5	discard		Diagnosis: Last 10 rows show the baseline EMA(15/45)+ADX>25 with fixed 2R exit achieved val_sharpe 0.635 / 31 trades / 38% max_dd, but current file has only 5 trades and val_sharpe 0.355. The RSI over
e4ab15f	0.355422	0.596445	0.633657	1.265486	0.881089	0.713722	0.332	9.311	57.84	1.000	5	discard		Diagnosis: Last 10 rows show repeated crashes (0–5 trades, val_sharpe 0.355) vs. proven baseline (0.635 sharpe, 31 trades, 38% max_dd). The RSI overbought exit condition (rsi > 70) is firing too early
c26abb6	0.355422	0.596445	0.633657	1.265486	0.881089	0.714030	0.332	9.311	57.84	1.000	5	discard		Remove the RSI overbought exit condition (rsi > 70) that is firing too early and closing trades prematurely; revert to pure fixed 2R take-profit exit only, which achieved the proven baseline val_sharp
d23f775	0.355422	0.596445	0.633657	1.265486	0.881089	0.714336	0.332	9.311	57.84	1.000	5	discard		Remove the RSI overbought exit condition entirely and simplify to pure fixed 2R take-profit exit; the RSI check is closing trades prematurely (only 5 trades vs. proven baseline 31 trades, val_sharpe 0
40a4f63	0.355422	0.596445	0.633657	1.265486	0.881089	0.714640	0.332	9.311	57.84	1.000	5	discard		Remove the RSI overbought exit condition and the associated RSI indicator to simplify the strategy back to pure fixed 2R take-profit logic; the RSI filter is closing trades prematurely (5 trades vs ba
41e4a13	0.355422	0.596445	0.633657	1.265486	0.881089	0.714943	0.332	9.311	57.84	1.000	5	discard		Remove the RSI overbought exit condition entirely; revert to pure fixed 2R take-profit exit only. Recent 10 rows all show 5 trades / 0.355 sharpe vs. proven baseline of 31 trades / 0.635 sharpe. The R
0716d6b	0.355422	0.596445	0.633657	1.265486	0.881089	0.715244	0.332	9.311	57.84	1.000	5	discard		Remove the RSI indicator and overbought exit condition that is closing trades prematurely (current 5 trades vs. proven baseline 31 trades with val_sharpe 0.635); revert to pure EMA(15/45) crossover en
9cd68a7	0.355422	0.596445	0.633657	1.265486	0.881089	0.715544	0.332	9.311	57.84	1.000	5	discard		Remove the RSI overbought exit condition entirely and the RSI indicator; revert to pure fixed 2R take-profit exit only. The RSI check is closing trades prematurely, reducing total trades from the prov
c077b45	0.355422	0.596445	0.633657	1.265486	0.881089	0.715842	0.332	9.311	57.84	1.000	5	discard		Remove the RSI indicator and overbought exit condition that is prematurely closing profitable trades; revert to pure EMA(15/45) crossover entry with ADX>25 trend filter and fixed 2R take-profit exit o
6b3a554	0.355422	0.596445	0.633657	1.265486	0.881089	0.716139	0.332	9.311	57.84	1.000	5	discard		Remove RSI indicator and overbought exit condition entirely; revert to pure EMA(15/45) crossover entry with ADX>25 trend filter and fixed 2R take-profit exit only. The RSI check has been firing too ea
3dc8159	-0.306065	0.022519	0.134655	0.398101	0.557669	0.415831	-0.417	12.975	78.78	0.829	12	discard	2026-05-08 00:34	Recent 10 rows all show identical crash state (5 trades, 0.355 sharpe) despite repeated "RSI removal" attempts — suggesting the baseline code itself is now already at the pure EMA(15/45)+ADX>25 state 
cc9cc70	-0.306065	0.022519	0.134655	0.398101	0.557669	0.415215	-0.417	12.975	78.78	0.829	12	discard	2026-05-08 00:35	Relax ADX threshold from 25→20 to widen the entry set; recent 10 rows show all-identical 5 trades, indicating entry conditions are over-filtered.
db3d012	0.000000	0.000000	0.000000	0.000000	0.000000	0.000000	0.000	0.000	0.00	0.000	0	crash	2026-05-08 00:36	Add 200-SMA regime filter: only enter longs when price > SMA200 (skip bear markets). This is structurally different from the EMA-parameter or threshold tweaks attempted in prior 9 identical-crash rows
9631d30	-0.286092	0.065572	0.168541	0.503323	0.570434	0.431532	-0.394	12.470	78.77	0.838	13	discard	2026-05-08 05:51	Relax ADX threshold from 25→15 to widen the entry set; recent 10 rows show 5 trades (crash) vs. baseline 31 trades, indicating entry conditions are over-filtered.
32b7cf9	0.000000	0.000000	0.000000	0.000000	0.000000	0.000000	0.000	0.000	0.00	0.000	0	crash	2026-05-08 05:52	Add Donchian channel breakout (20-bar) as the entry signal instead of EMA crossover; keep the ADX>25 trend filter. This is a structurally different entry mechanism targeting genuine trend breakouts ra
b8e2a19	0.176516	0.631278	0.467502	2.117982	0.779603	0.604506	2.643	53.289	33.39	0.656	31	discard	2026-05-08 05:53	Switch from fixed 2R take-profit to time-based exit (close after 10 bars) to allow trades to capture extended trends; the 2R take-profit is never being hit on these high-momentum stocks, leaving trade
054b744	0.000000	0.000000	0.000000	0.000000	0.000000	0.000000	0.000	0.000	0.00	0.000	0	crash	2026-05-08 05:53	Add ATR-based stop-loss (2× ATR below entry) to limit max drawdown; retain existing 2R take-profit and ADX>25 filter but reduce position size from 0.95→0.70 for better risk management.
bf394fe	0.182251	0.399534	0.486437	0.870318	0.808976	0.610646	0.591	11.643	57.84	0.812	13	discard	2026-05-08 05:54	Fix syntax error (missing `:` on `init` method) and add a trailing ATR-based stop-loss for better drawdown control while keeping the 2R take-profit.
0410c20	0.297781	0.984934	0.686221	3.426547	0.836660	0.687713	2.594	46.381	34.23	0.619	31	discard	2026-05-08 05:56	Add ATR-based stop-loss (1.5× ATR below entry) to reduce max drawdown while retaining position size 0.95; previous attempt failed with size reduction to 0.70 causing 0 trades.
0c40d18	0.036574	0.723601	0.444271	3.630281	0.664456	0.509217	2.452	57.722	27.52	0.550	31	discard	2026-05-08 05:58	Add a Chandelier-style trailing stop (ATR-based, measured from highest high since entry) alongside the existing 2R take-profit; the prior ATR stop-loss (`054b744`) failed by placing the stop too close
2ab9ae1	0.353274	1.398305	0.794099	7.456949	0.845361	0.715542	3.616	75.165	21.07	0.735	31	discard	2026-05-08 06:01	Reduce take-profit from 2R→1.25R and combine with 1.5× ATR stop-loss for faster wins, better risk-reward, and improved win rate vs. baseline's unmet 2R target.
45441c8	0.201183	0.940361	0.598185	3.341036	0.786514	0.666078	2.897	67.354	37.11	0.730	31	discard	2026-05-09 06:10	Reduce fixed take-profit from 2R→1.5R and add 2× ATR stop-loss to address the hit-rate problem that caused the baseline's 2R target to rarely be reached, while keeping max drawdown below 30%.
f393bf1	0.320305	0.840250	0.719933	2.561559	0.879051	0.734931	0.823	17.415	57.84	0.911	27	discard	2026-05-09 06:10	Remove ADX trend filter entirely and tighten exit to 1.25R; the ADX>25 filter has generated 6 crash/discard rows from over-filtering the entry set, while the 1.25R target showed the best Sharpe (0.353
5195bf7	0.000000	0.000000	0.000000	0.000000	0.000000	0.000000	0.000	0.000	0.00	0.000	0	crash	2026-05-09 06:11	Combine EMA crossover with RSI pullback filter (buy when RSI < 50 confirming pullback from oversold) alongside a tighter 1.25R take-profit and 1.5× ATR stop — building on the best previous result (2ab
fe8b200	0.398863	1.324092	0.832364	4.511452	0.866376	0.750180	3.103	61.214	19.08	0.701	37	discard	2026-05-09 06:12	Remove the RSI pullback filter (RSI<50) that caused 0 trades across all symbols; keep EMA crossover + ADX>20 + 1.5× ATR stop for the known-working combination.
fd705dd	0.697329	1.707588	1.242722	10.149463	0.980370	0.935144	1.351	21.650	36.87	0.444	36	discard	2026-05-09 06:13	Apply the winning combination from experiment fe8b200 (best Sharpe=0.399, max_dd=19%): lower ADX threshold from 25→20 and replace the fixed 2R take-profit with a Chandelier-style trailing ATR stop (3×
22fe4eb	0.362131	1.194023	0.774015	3.298020	0.856227	0.732749	2.802	60.243	24.50	0.729	37	discard	2026-05-09 06:16	Combine 1.25R take-profit (best Sharpe in 2ab9ae1) with ATR-based trailing stop instead of Chandelier to fix structural issues; keep proven ADX>20 threshold from fe8b200.
