commit	val_sharpe	sortino	sharpe_ann_4h	calmar	psr	dsr	skew	kurtosis	max_drawdown	win_rate	total_trades	status	timestamp	description
548d0cf	0.288870	0.802872	0.579940	3.100140	0.838399	0.697567	3.137	53.279	26.57	0.656	31	discard		Fix AttributeError: use `self.position.open_price` → `self.data.Close[self.entry_bar - 1]` to retrieve entry price from bar history instead of nonexistent Position attribute.
3cd2754	0.000000	0.000000	0.000000	0.000000	0.000000	0.000000	0.000	0.000	0.00	0.000	0	crash		Diagnosis: Strategy stuck at val_sharpe≈0.635 for 20+ iterations. The EMA(15/45) + ADX(25) entry is overfiltered (~30 trades); every exit mutation regressed. Structural change required. Swap entry log
2778dc0	0.193970	0.676712	0.458507	2.180185	0.776824	0.619938	4.200	106.426	14.63	0.554	31	discard		Diagnosis: The entry filter is completely over-constrained. Requiring **both** RSI < 30 **and** price > slow EMA produces 0–2 trades across the basket (TSLA 0, NVDA 2, PYPL 1). This is a classic "stac
9df7b42	0.374960	1.538222	1.045162	10.290304	0.842687	0.769061	1.521	24.241	43.83	0.492	69	discard		Diagnosis: Strategy stuck at val_sharpe≈0.635 for 20+ iterations with ~30 trades and 13% DD. Entry filter (EMA 15/45 + ADX>25) is sound but overfiltered. Every exit mutation (trailing stop, RSI, fixed
12a1eac	0.355422	0.596445	0.633657	1.265486	0.881089	0.736576	0.332	9.311	57.84	1.000	5	discard		Diagnosis: Strategy stuck at val_sharpe≈0.635 for 20+ iterations with ~30 trades and 13% DD. The entry (EMA 15/45 + ADX>25) is sound but overfiltered. All exit mutations regressed. Structural change: 
5ca78f4	0.257387	1.301745	0.903949	8.518544	0.795180	0.724033	1.527	27.733	49.18	0.417	65	discard		Diagnosis: Strategy is trapped in a local basin (val_sharpe ≈ 0.485–0.635) with ~30 trades and 13% DD across 10+ consecutive discards. Every exit mutation (trailing stop, RSI, fixed TP) has regressed,
81496fa	-0.305742	-0.378977	-0.173015	-0.477071	0.373282	0.191716	-1.573	24.753	76.32	0.000	7	discard		Diagnosis: Strategy stuck at val_sharpe≈0.635 for 20+ iterations. The entry (EMA 15/45 + ADX>25) generates only ~30 trades, limiting statistical edge. Recent exit mutations (trailing stop, RSI overbou
5e8d71b	0.000000	0.000000	0.000000	0.000000	0.000000	0.000000	0.000	0.000	0.00	0.000	0	crash		Diagnosis: Strategy is stuck at val_sharpe≈0.635 for 25+ iterations with ~30 trades and 13% DD. The entry filter (EMA 15/45 + ADX>25) is sound but severely overfiltered. Recent mutations clustered aro
6990cab	0.479460	1.033901	0.703849	2.604306	0.915018	0.775692	5.033	112.546	12.12	0.687	31	discard		Diagnosis: Strategy crashed with 0 trades across all three symbols (TSLA/NVDA/PYPL). The Donchian breakout entry combined with ADX>20 is too restrictive — close rarely breaks above a 20-bar high on th
cd76d38	-0.051771	0.512522	0.542821	2.860133	0.723801	0.600954	0.060	9.936	77.84	0.876	63	discard		Diagnosis: Recent 4 rows show 2 crashes with 0 trades and 2 discards (sharpe ≤0.29). The time-based exit (10-bar) and fixed 2-ATR stop failed. Strategy is oscillating between entry over-filtering and 
465a090	0.497173	1.106703	0.796080	3.030480	0.929832	0.818367	3.130	43.915	17.54	0.687	41	discard		Diagnosis: Strategy crashed with 0 trades (commit 3cd2754). The entry filter (EMA 15/45 crossup + ADX>25) is severely overfiltered on the stocks basket. Relaxing ADX threshold from 25→18 widens the en
96e66cd	0.545987	1.072403	0.974761	3.464090	0.965897	0.893595	0.390	4.680	60.83	1.000	13	discard		Diagnosis: Last 10 rows show 2 crashes (0 trades) and 8 discards. The entry filter (EMA 15/45 crossup + ADX>25) is severely overfiltered, generating only ~30 trades basket-wide. Every exit mutation ha
52e8126	-0.010631	0.047945	0.065985	0.115137	0.549214	0.326054	1.759	150.030	15.50	0.472	26	discard		Diagnosis: Strategy stuck in local basin (val_sharpe ≈ 0.635) with ~30 trades and 13% DD across 25+ iterations. Every exit mutation (trailing stop, RSI, fixed TP) has regressed. Root cause: entry filt
1d6cbf0	0.362386	1.450364	1.011906	9.386222	0.843311	0.761550	1.390	22.482	43.82	0.487	78	discard		Diagnosis: Strategy is trapped in a tight local basin (val_sharpe ≈0.375–0.545, ~30–70 trades, 12–78% DD) across 10 consecutive discards. The EMA(15/45) crossover + ADX>25 entry is severely overfilter
45ff80f	0.550481	1.359227	0.757277	3.747884	0.951059	0.834114	9.651	212.682	12.12	0.703	25	discard		The strategy has been stuck in a local basin for 25+ iterations with val_sharpe ≈ 0.635, ~30 trades, and 13% DD. The EMA(15/45) + ADX>25 entry is severely overfiltered. Instead of further exit tweaks 
2b78473	0.502572	0.943568	0.684415	2.343940	0.910339	0.762456	3.708	78.770	12.12	0.614	41	discard		The strategy has been stuck in a local basin for 30+ iterations with val_sharpe ≈ 0.635, only ~30 trades, and severe entry over-filtering. The EMA(15/45) + ADX>25 entry is too restrictive on the stock
d8235bb	0.055393	0.665025	0.605909	2.300631	0.753126	0.636569	-0.102	20.308	66.67	0.428	94	discard		Replace EMA(15/45) entry with RSI(14) < 30 oversold condition to bypass the severely overfiltered ADX gate and generate 3–4x more trades; keep trailing stop exit.
d8aeef8	0.215101	0.554945	0.425921	1.478409	0.773311	0.579562	2.854	83.220	14.58	0.577	40	discard		Diagnosis: Last 10 rows show 9 discards + 1 crash; strategy is trapped in a tight basin with val_sharpe≈0.5–0.635, only 25–41 trades, and 12–13% DD when entry works. The EMA(15/45) + ADX>25 entry is s
6cb096e	-0.039053	0.232774	0.328386	0.648423	0.683053	0.502367	-0.377	28.504	60.77	0.438	94	discard		Diagnosis: Last 10 rows show persistent 0-trade crashes (6990cab, cd76d38, 465a090) alternating with tight-basin discards (val_sharpe ≈ 0.5–0.635, ~25–41 trades). The EMA(15/45) crossup + ADX>25 entry
c44cfe4	-0.012017	0.566287	0.574789	3.951813	0.729141	0.578240	0.219	9.399	79.28	0.384	171	discard		Diagnosis: Last 10 rows show persistent oscillation between 0-trade crashes and tight-basin discards (val_sharpe ≈0.5–0.635, ~25–41 trades). The EMA(15/45) crossup + ADX>25 entry is severely overfilte
063a8ae	-0.224641	0.064444	0.079285	0.439614	0.518026	0.374276	-0.969	56.962	44.96	0.339	21	discard		The last 10 rows show a clear pattern: the EMA(15/45) + ADX>25 entry is severely overfiltered, oscillating between 0-trade crashes and tight basins of ~25–41 trades. Previous attempts to relax ADX (25
b44584b	-0.039053	0.232774	0.328386	0.648423	0.683053	0.499164	-0.377	28.504	60.77	0.438	94	discard		Replace EMA(15/45) crossover + ADX>25 entry with a simpler RSI(14) < 30 oversold entry to escape the severe over-filtering that has trapped the strategy in a 30-trade basin for 50+ iterations; keep tr
875770d	-0.146562	0.288804	0.375778	1.806549	0.666310	0.528886	-0.202	15.289	73.34	0.385	135	discard		Diagnosis: Last 10 rows show persistent local basin (val_sharpe ≈ 0.375–0.635, only 25–94 trades) with 50+ consecutive discards. The EMA(15/45) + ADX>25 entry is severely overfiltered. Replace with si
9d9520b	-0.057065	0.224599	0.255008	0.893473	0.650959	0.479425	0.347	29.997	43.28	0.519	226	discard		Diagnosis: Last 10 rows show the strategy stuck in a severe over-filtering trap for 50+ consecutive discards. EMA(15/45) + ADX>25 entry generates only 25–41 trades when it works, and crashes to 0 trad
5ff8407	0.055393	0.665025	0.605909	2.300631	0.753126	0.634412	-0.102	20.308	66.67	0.428	94	discard		Diagnosis: 50+ consecutive discards show the strategy oscillating between 0-trade crashes and tight basins (25–41 trades, val_sharpe ≈0.5–0.635). The EMA(15/45) + ADX>25 entry is severely overfiltered
ae6b623	-0.057065	0.224599	0.255008	0.893473	0.650959	0.479304	0.347	29.997	43.28	0.519	226	discard		Diagnosis: 50+ consecutive discards trapped in severe over-filtering (0 trades or 25–41 trades with val_sharpe≈0.5). The EMA(15/45)+ADX>25 entry is the bottleneck. Replace it with a simpler Donchian(2
cbdd128	0.000000	0.000000	0.000000	0.000000	0.000000	0.000000	0.000	0.000	0.00	0.000	0	crash		Diagnosis: Last 10 rows are all discards; the strategy oscillates between 0-trade crashes and tight basins (25–94 trades, val_sharpe ≈0.055–0.215). The EMA(15/45) + ADX>25 entry is severely overfilter
332a2cc	0.000000	0.000000	0.000000	0.000000	0.000000	0.000000	0.000	0.000	0.00	0.000	0	crash		Diagnosis: The Donchian(20) breakout entry is too strict — it requires close > 20-bar high, which triggers rarely on daily stock data. This causes 0 trades across all symbols. Relax to Donchian(10) to
36b50fa	0.000000	0.000000	0.000000	0.000000	0.000000	0.000000	0.000	0.000	0.00	0.000	0	crash		Donchian(10) breakout entry is still too strict on daily stock data; relax to Donchian(5) to widen entry signal frequency and escape the 0-trade crash.
451d3a4	0.000000	0.000000	0.000000	0.000000	0.000000	0.000000	0.000	0.000	0.00	0.000	0	crash		Diagnosis: 0-trade crash on Donchian(5) breakout entry — the 5-bar rolling high is too tight for daily stock data, rarely triggering. Replace with a looser, more reliable entry: RSI(14) < 30 (oversold
c5c0b50	-0.306065	0.022518	0.134655	0.398100	0.557669	0.416502	-0.417	12.975	78.78	0.829	12	discard		Diagnosis: Last 10 rows show 50+ consecutive crashes and discards, primarily 0-trade outcomes from successive failed entry relaxations (Donchian(20) → Donchian(10) → Donchian(5) → RSI<30). The baselin
7961e87	0.333799	0.700588	0.534841	1.818313	0.838947	0.651349	2.816	74.732	13.96	0.583	43	discard		Diagnosis: 50+ consecutive discards trapped in severe over-filtering. The baseline EMA(15/45)+ADX>25 was too strict; recent attempts (RSI<30, Donchian breakouts) crashed or regressed. Return to the ba
f605540	0.333799	0.700588	0.534841	1.818313	0.838947	0.652244	2.816	74.732	13.96	0.583	43	discard		Diagnosis: 50+ consecutive discards show the strategy is trapped in severe over-filtering. Recent attempts (Donchian breakouts, RSI<30) crashed or regressed; baseline EMA(15/45)+ADX>25 is the constrai
3417115	0.333799	0.700588	0.534841	1.818313	0.838947	0.653126	2.816	74.732	13.96	0.583	43	discard		Diagnosis: 50+ consecutive discards reveal severe entry over-filtering. The baseline EMA(15/45)+ADX>25 generates only 25–43 trades; relaxations (Donchian, RSI<30) crashed to 0 trades. Root cause: ADX>
ab4886a	-0.010104	0.533537	0.509186	3.556431	0.689872	0.531689	0.092	9.465	72.52	0.398	118	discard		Diagnosis: 50+ consecutive discards show the strategy is trapped between two extremes: the baseline EMA(15/45)+ADX>25 is severely overfiltered (25–43 trades, val_sharpe≈0.333), while all relaxations (
c72466c	0.485224	0.942241	0.679312	2.341423	0.907309	0.756445	3.758	79.885	12.12	0.635	38	discard		Diagnosis: 50+ consecutive discards trapped between overfiltered baseline (25–43 trades, val_sharpe≈0.333) and failed relaxations (Donchian/RSI crashes to 0 trades). The EMA(15/45)+ADX>25 entry is the
c6de6ba	0.485224	0.942241	0.679312	2.341423	0.907309	0.757108	3.758	79.885	12.12	0.635	38	discard		Replace ADX>25 threshold with ADX>20 to widen entry signal frequency while maintaining trend quality; ADX>25 is the primary bottleneck causing 25–43 trades. This structural relaxation avoids 0-trade c
e93eba8	0.485224	0.942241	0.679312	2.341423	0.907309	0.757763	3.758	79.885	12.12	0.635	38	discard		Relax ADX threshold from 25 to 20 to widen entry signal frequency; baseline EMA(15/45)+ADX>25 generates only 25–43 trades across 50+ consecutive discards, trapping the strategy in severe over-filterin
76f93da	0.000000	0.000000	0.000000	0.000000	0.000000	0.000000	0.000	0.000	0.00	0.000	0	crash		Diagnosis: 50+ consecutive discards show the strategy is trapped between two extremes. The baseline EMA(15/45)+ADX>25 generates only 25–43 trades (val_sharpe≈0.333), while all relaxations (ADX>20, Don
5037331	0.165183	0.521251	0.466959	1.518047	0.770445	0.596507	1.976	48.255	38.22	0.478	31	discard		Diagnosis: 0-trade crashes across all three symbols (TSLA: 0, NVDA: 2, PYPL: 1 trades). The entry filter stack is now too tight: RSI<30 AND price>slow_EMA AND ADX>25 creates a near-empty candidate set
b5140ee	0.165183	0.521251	0.466959	1.518047	0.770445	0.597059	1.976	48.255	38.22	0.478	31	discard		Remove the RSI overbought exit condition (rsi_overbought check) to simplify the exit logic and allow the trailing stop to work without interference; recent crashes suggest the entry filter is the bott
f42674f	0.485224	0.942241	0.679312	2.341423	0.907309	0.759518	3.758	79.885	12.12	0.635	38	discard		The last 50+ experiments show the strategy is trapped: baseline EMA(15/45)+ADX>25 generates only 25–43 trades (val_sharpe≈0.333), while all relaxations crash to 0 trades. The root cause is that ADX>25
0360252	0.165183	0.521251	0.466959	1.518047	0.770445	0.598217	1.976	48.255	38.22	0.478	31	discard		Remove the RSI overbought exit condition (rsi_overbought check) and simplify exit to trailing stop only; 50+ consecutive discards indicate the entry filter stack (EMA crossup AND ADX>25) is the true b
51f9aa0	0.502572	0.943568	0.684415	2.343940	0.910339	0.764847	3.708	78.770	12.12	0.614	41	discard		Relax ADX threshold from 25 to 18 to significantly widen the entry candidate set; baseline is trapped in severe over-filtering (25–43 trades, val_sharpe≈0.333) and all prior relaxations to ADX>20 also
cc095c8	0.000000	0.000000	0.000000	0.000000	0.000000	0.000000	0.000	0.000	0.00	0.000	0	crash		The strategy is trapped in a 50+ experiment cycle between severe over-filtering (baseline EMA(15/45)+ADX>25 yields only 25–43 trades, val_sharpe≈0.333) and crashes when relaxing ADX. The root issue is
45515a6	0.165183	0.521251	0.466959	1.518047	0.770445	0.599327	1.976	48.255	38.22	0.478	31	discard		Diagnosis: 0-trade crash across all three symbols (TSLA/NVDA/PYPL). The Donchian breakout entry combined with ADX>20 is too restrictive—the intersection of "close > 20-bar high" AND "ADX>20" almost ne
3574c52	0.333444	1.430874	0.993930	9.613493	0.829308	0.750344	1.339	21.746	46.50	0.503	80	discard		Replace the EMA(15/45) crossover entry with a simpler, broader Donchian(20)-breakout entry combined with ADX>18; the baseline is trapped generating only 25–43 trades. Donchian breaks are less specific
3b345f6	0.000000	0.000000	0.000000	0.000000	0.000000	0.000000	0.000	0.000	0.00	0.000	0	crash		Switch from EMA(15/45) crossover entry to RSI(14) oversold entry (RSI < 30) combined with price above EMA(45) trend filter; this replaces the overly-restrictive ADX>25 gate with a momentum-mean-revers
4892346	0.265329	0.515920	0.491523	1.204051	0.817630	0.626097	1.540	33.525	31.46	0.441	43	discard		Diagnosis: 0-trade crash across all three symbols (TSLA: 0, NVDA: 2, PYPL: 1 trades). The entry filter stack is now too tight: RSI<30 AND price>slow_EMA AND ADX>25 creates a near-empty candidate set. 
f3cca10	-0.144191	0.677418	0.428356	3.399541	0.669131	0.617163	0.982	33.332	41.59	0.440	52	discard		The strategy is stuck in a 50+ experiment loop oscillating between over-filtered entries (ADX>25 with EMA crossup = 25–43 trades, val_sharpe≈0.333) and crashes when attempting to relax. Root diagnosis
09f6d8b	0.206053	0.998784	0.838549	5.964873	0.823669	0.728734	0.355	8.301	69.11	0.416	175	discard		Diagnosis: 50+ consecutive experiments show the baseline EMA(15/45)+ADX>25 is trapped—it generates only 25–43 trades with val_sharpe≈0.333, and every relaxation (ADX>18, ADX>20, Donchian, RSI<30) cras
4663a1b	-0.357917	0.219928	0.238094	1.734618	0.598582	0.498709	-0.369	17.215	76.33	0.335	189	discard		Diagnose: 50+ consecutive experiments show the baseline is trapped oscillating between over-filtered entries (25–43 trades, val_sharpe≈0.333) and 0-trade crashes. The root cause is that EMA(15/45) cro
52ae98c	-0.352905	0.242609	0.200818	3.839436	0.487978	0.393767	-0.284	13.800	67.49	0.371	102	discard		Diagnosis: The last 10 rows show the strategy is trapped in a deep local minimum. The baseline EMA(15/45)+ADX>25 generates only 25–43 trades with val_sharpe≈0.333, and every attempt to widen entries (
8b5d37e	-0.178836	-0.027346	0.050909	0.165215	0.539479	0.341540	0.001	34.068	61.15	0.515	36	discard		Diagnosis: Recent row shows ADX>18 relaxation yielded 0.503 Sharpe with 41 trades—a meaningful improvement but still suboptimal. The issue is that EMA(15/45) crossovers are rare events (41 trades acro
bacd1b1	-0.399570	0.151090	0.062559	0.908907	0.600040	0.493355	0.203	38.680	47.16	0.483	116	discard		Replace the rare EMA(15/45) crossover entry with a volatility-adjusted Bollinger Band breakout (price closes above upper band after being below it) combined with a relaxed ADX>18 trend gate; this broa
a0aee69	-0.010181	0.099316	0.188713	0.204129	0.631402	0.402722	0.532	29.404	43.33	0.542	78	discard		Diagnosis: The last 10 rows show a persistent trap: EMA(15/45) crossover + ADX threshold oscillates between 25–43 trades (val_sharpe≈0.333) and 0-trade crashes when attempting relaxation. The fundamen
5d7beab	0.000000	0.000000	0.000000	0.000000	0.000000	0.000000	0.000	0.000	0.00	0.000	0	crash		Diagnosis: Recent rows show the baseline EMA(15/45)+ADX>25 is trapped generating 25–43 trades with val_sharpe≈0.333. Every attempt to relax or replace the entry (ADX threshold, Donchian, RSI<30, Bolli
4997ce4	0.000000	0.000000	0.000000	0.000000	0.000000	0.000000	0.000	0.000	0.00	0.000	0	crash		Diagnosis: 0-trade crash — the pullback entry logic is too restrictive. The condition `is_pullback = close <= pullback_threshold and close >= pullback_threshold - self.atr[-1]` creates a narrow band t
e0c21d3	0.485224	0.942241	0.679312	2.341423	0.907309	0.751725	3.758	79.885	12.12	0.635	38	discard		Revert to the baseline EMA(15/45) crossover with relaxed ADX threshold (20 instead of 25) to escape the 0-trade crash; the pullback entry logic was too restrictive on all three symbols.
efdb695	0.000000	0.000000	0.000000	0.000000	0.000000	0.000000	0.000	0.000	0.00	0.000	0	crash		Diagnosis: The last 10 rows show the strategy is trapped in a deep local minimum oscillating between baseline EMA(15/45)+ADX>25 (25–43 trades, val_sharpe≈0.333) and 0-trade crashes when attempting ent
fb57942	0.485224	0.942241	0.679312	2.341423	0.907309	0.752271	3.758	79.885	12.12	0.635	38	discard		Diagnosis: 0-trade crash — Donchian breakout (price > 20-bar high) combined with ADX>18 is too restrictive on daily data; the condition rarely fires. Revert to baseline EMA(15/45) crossover with relax
435e092	-0.231642	-0.121620	-0.034299	-0.132563	0.476421	0.277248	-0.182	39.348	59.82	0.472	33	discard		Diagnosis: Last 10 rows show persistent oscillation between baseline EMA(15/45)+ADX>25 generating 25–43 trades with val_sharpe≈0.333, and 0-trade crashes when attempting entry relaxation. The EMA cros
5831326	0.460727	1.434915	1.127830	10.696022	0.948403	0.864673	0.534	7.168	71.23	0.626	129	discard		Diagnosis: Recent rows show the strategy is oscillating between baseline EMA(15/45)+ADX>25 (25–43 trades, val_sharpe≈0.333) and repeated 0-trade crashes when attempting entry relaxation. The EMA cross
d3eca46	-0.178836	-0.027346	0.050909	0.165215	0.539479	0.329224	0.001	34.068	61.15	0.515	36	discard		Diagnosis: Last 10 rows show oscillation between baseline EMA(15/45)+ADX>25 (val_sharpe≈0.333, 25–43 trades) and 0-trade crashes when relaxing entry. The fundamental issue is that EMA crossovers are r
6ed181e	-0.183855	-0.087866	0.005230	-0.054025	0.505401	0.286263	-0.822	35.079	45.10	0.442	54	discard		Diagnosis: Last 10 rows show repeated oscillation between baseline EMA(15/45)+ADX>25 (val_sharpe≈0.333, 25–43 trades) and 0-trade crashes when relaxing entry conditions. The EMA crossover is too rare 
bc6f54c	0.000000	0.000000	0.000000	0.000000	0.000000	0.000000	0.000	0.000	0.00	0.000	0	crash		Diagnosis: Last 10 rows show the strategy is trapped oscillating between baseline EMA(15/45)+ADX>25 (val_sharpe≈0.333, 25–43 trades) and 0-trade crashes when attempting entry relaxation. The EMA cross
bbc67d8	0.287779	0.618724	0.556576	1.653936	0.838881	0.644333	1.680	36.725	26.63	0.472	38	discard		Revert to baseline EMA(15/45) crossover entry with ADX>20 (relaxed from 25) and trailing stop; RSI<30 entry generated 0–2 trades across all three symbols because mean-reversion pullbacks are too rare 
1ae16b3	0.131407	0.830138	0.615895	3.997372	0.727646	0.555657	2.338	53.109	30.70	0.524	32	discard		Replace EMA crossover entry with RSI(14) < 30 mean-reversion in uptrend (price > EMA(200)), keeping trailing stop exit; ADX filter removed to widen entry set and escape 0-trade crashes observed in las
a8d3e81	0.000000	0.000000	0.000000	0.000000	0.000000	0.000000	0.000	0.000	0.00	0.000	0	crash		Add RSI(14) < 35 filter to baseline EMA(15/45) crossover entry to reduce whipsaw trades and improve risk-adjusted returns; the baseline currently generates 38 trades with val_sharpe=0.485 but many are
017458b	0.485224	0.942241	0.679312	2.341423	0.907309	0.741536	3.758	79.885	12.12	0.635	38	discard		Revert RSI oversold entry filter (< 35) that caused 0-trade crashes; return to baseline EMA(15/45) crossover with ADX>20. The RSI filter is too restrictive—mean-reversion pullbacks to RSI<35 rarely co
b805cbc	0.000000	0.000000	0.000000	0.000000	0.000000	0.000000	0.000	0.000	0.00	0.000	0	crash		Diagnosis: Last 10 rows show the baseline EMA(15/45)+ADX>25 is stable at val_sharpe≈0.485, 38 trades, 12.12% max_dd. Recent attempts to relax entry conditions (Donchian, RSI pullbacks, ADX threshold r
02f9d4d	0.165183	0.521251	0.466959	1.518047	0.770445	0.580515	1.976	48.255	38.22	0.478	31	discard		Fix TypeError: Position.close() does not accept 'size' parameter in backtesting.py. Revert to simple trailing stop exit (1.5-ATR) without partial profit-taking, which was stable at val_sharpe=0.485 wi
919a130	-0.085155	0.613455	0.339243	3.439471	0.606306	0.471737	2.101	61.398	30.05	0.544	31	discard		Diagnosis: Last 10 rows show repeated oscillation between baseline EMA(15/45)+ADX>25 (val_sharpe≈0.485, 38 trades, 12.12% max_dd) and 0-trade crashes when attempting entry relaxation. The EMA crossove
