commit	val_sharpe	sortino	sharpe_ann_4h	calmar	psr	dsr	skew	kurtosis	max_drawdown	win_rate	total_trades	status	timestamp	description
69fa00a	0.324313	0.827357	0.578348	1.804788	0.841723	0.841723	2.891	101.390	17.57	0.532	21	keep		Add RSI(14) overbought filter to entry to reduce whipsaw trades during exhaustion moves; only enter when RSI < 70 in addition to existing EMA crossup + ADX > 25 conditions.
c3ac221	0.415113	0.742970	0.592765	1.892946	0.873286	0.873286	3.072	78.931	17.57	0.511	31	keep		Replace RSI overbought filter (RSI < 70) with RSI oversold momentum entry (RSI > 30 after dip) to capture higher-conviction pullback entries in uptrends rather than entering near exhaustion; this flip
18b7594	-0.065839	-0.089695	0.119813	-0.132823	0.587607	0.585113	-1.215	18.486	77.71	0.200	5	discard		Replace the 3% fixed trailing stop with a volatility-responsive ATR-based trailing stop (2.0 × ATR) to adapt the exit width to market regime; this lets the strategy hold trends in low-volatility perio
84f1fb4	-0.065839	-0.089695	0.119813	-0.132823	0.587607	0.490346	-1.215	18.486	77.71	0.200	5	discard		Replace the 3% fixed trailing stop with a volatility-adaptive ATR-based trailing stop (ATR × 2.0) to hold trends longer in low-volatility regimes while protecting gains in choppy markets; the prior AT
0b265fe	0.415113	0.742970	0.592765	1.892946	0.873286	0.798866	3.072	78.931	17.57	0.511	31	discard		Diagnosis: The last 2 keeps show strong performance (val_sharpe 0.32 and 0.42), but the most recent keep (c3ac221) has 31 trades vs. the prior 21, suggesting the RSI>30 filter is catching more entries
9158129	0.415113	0.742970	0.592765	1.892946	0.873286	0.793590	3.072	78.931	17.57	0.511	31	discard		Diagnosis: Recent keeps show strong val_sharpe (0.42) with 31 trades and healthy 17.57% max_dd. The last discard attempted to add ATR-based trailing stops, which crashed to 5 trades and 77% drawdown —
3cc5c4d	0.413619	0.779818	0.604682	1.777281	0.877841	0.797727	4.053	113.285	16.89	0.478	24	discard		Diagnosis: Recent keeps show val_sharpe 0.42 with 31 trades and 17.57% max_dd, but two ATR-trailing-stop experiments crashed to 5 trades / 77% drawdown. The 3% fixed trailing stop is working well; the
f823014	0.168481	0.573216	0.404076	1.285984	0.748207	0.655053	5.179	153.185	13.13	0.568	18	discard		Diagnosis: The last 3 rows show keeps with val_sharpe 0.42 and strong constraints (31 trades, 17.57% max_dd). Recent discards attempted ATR-based trailing stops (crashed to 5 trades, 77% dd) and param
7836ebf	0.176516	0.631278	0.467502	2.117981	0.779603	0.697935	2.643	53.289	33.39	0.656	31	discard		Diagnosis: The last 6 rows show the strategy is stuck in a local optimum (val_sharpe ~0.42, 31 trades, 17.57% max_dd). Recent mutations attempted ATR-based exits and parameter tweaks, all discarded. T
e103890	0.176516	0.631278	0.467502	2.117981	0.779603	0.700642	2.643	53.289	33.39	0.656	31	discard		Diagnosis: Last 6 rows show we're stuck in a local basin around val_sharpe 0.42 with 31 trades and 17.57% max_dd. The last 3 discard attempts tried ATR-based trailing stops (crashed to 5 trades/77% dd
053279b	0.217463	0.615059	0.462538	2.173610	0.777468	0.693260	2.683	99.487	15.41	0.511	31	discard		Add fixed 6% take-profit exit alongside existing 3% trailing stop to lock in gains and reduce drawdown.
3d098cb	0.480615	1.100469	0.764634	4.049623	0.926924	0.878345	4.742	81.474	18.20	0.609	31	keep		Replace the fixed 3% trailing stop with an ATR-based trailing stop (1.0 × ATR) to adapt exit width to volatility while avoiding the excessive width that caused low trades and high drawdown in prior AT
fa505bb	0.111607	0.408077	0.315256	0.845092	0.707876	0.604274	5.389	128.379	14.30	0.568	18	discard		Add a 200-day SMA regime filter to only take longs when price is above its long-term average, aiming to improve risk‑adjusted returns by avoiding bearish regimes.
e8749f2	0.343135	1.075873	0.731543	4.746372	0.859135	0.792808	3.702	61.167	29.72	0.581	31	discard		Increase ATR trailing stop multiplier from 1.0 to 1.2 to widen the exit and capture larger trends, aiming to improve risk‑adjusted return while keeping trade count above the required threshold.
0152361	0.121103	0.671925	0.446895	3.016099	0.722360	0.631088	3.106	83.956	15.85	0.609	31	discard		Last two discards after keep (val_sharpe 0.48) failed via regime filter and wider ATR stop; add 2x ATR at entry take-profit exit to lock in gains.
50be02e	0.426152	0.993353	0.695139	3.465831	0.903757	0.838395	4.751	89.737	18.20	0.609	31	discard		Add 20-bar time-based exit to complement ATR trailing stop, addressing post-keep discard cluster with structurally different exit condition.
fbbf6d7	0.368839	0.931046	0.630451	3.111245	0.877440	0.802408	5.585	119.967	12.04	0.690	13	discard		Recent 4 discards after last keep (val_sharpe 0.48) all tweaked exit conditions with no improvement; replace RSI oversold entry filter with 20-period volume SMA confirmation to validate entries with t
7b57fa0	0.480615	1.100469	0.764634	4.049623	0.926924	0.869277	4.742	81.474	18.20	0.609	31	discard		Add EMA crossunder exit to close positions on trend reversal, complementing ATR trailing stop with structurally different exit condition.
4c3cd53	0.480615	1.100469	0.764634	4.049623	0.926924	0.866744	4.742	81.474	18.20	0.609	31	discard		Diagnosis: 6 post-keep discards from exit tweaks and RSI replacement; remove RSI>30 entry filter to simplify strategy and increase entry signals.
b896e52	-0.254915	0.492061	0.322980	2.211537	0.656638	0.626632	0.841	21.553	44.77	0.382	84	discard		Diagnosis: 6 post-keep discards from EMA crossover entry tweaks; replace EMA crossover entry with MACD crossover for structurally different trend signal.
6b1f18e	-0.149958	0.317044	0.279366	1.306880	0.652524	0.590349	1.117	38.758	38.14	0.437	74	discard		Replace EMA crossover entry with pullback-to-slow-EMA entry after recent MACD crossover entry experiment failed.
dab10cd	0.215887	0.578503	0.502336	1.710588	0.797195	0.695898	2.298	56.482	34.02	0.511	31	discard		Prior exit tweaks (fixed ATR multiplier, take-profit, time exit, crossunder) failed to improve val_sharpe from 0.48; implement ADX-adaptive ATR trailing stop to dynamically adjust stop width based on 
d57ea05	0.000000	0.000000	0.000000	0.000000	0.000000	0.000000	0.000	0.000	0.00	0.000	0	crash		Replace EMA crossover entry with 20-period Donchian channel breakout entry after 10 consecutive discards clustered near best val_sharpe.
0310ad8	0.000000	0.000000	0.000000	0.000000	0.000000	0.000000	0.000	0.000	0.00	0.000	0	crash		Recent crash with 0 trades across all basket symbols; remove RSI>30 entry filter to widen Donchian breakout entry set and resolve crash.
0e96c89	0.000000	0.000000	0.000000	0.000000	0.000000	0.000000	0.000	0.000	0.00	0.000	0	crash		Remove ADX>25 entry filter to fix 0-trade crash from over-filtered Donchian breakout entry.
2bf3489	0.480615	1.100469	0.764634	4.049623	0.926924	0.863399	4.742	81.474	18.20	0.609	31	discard		Recent 3 rows crashed with 0 trades; replacing Donchian channel entry with EMA(15/45) crossover and ADX>25 filter to restore entry signals and fix 0-trade crash.
d763492	0.111607	0.408077	0.315256	0.845092	0.707876	0.586551	5.389	128.379	14.30	0.568	18	discard		Add 200-period SMA regime filter to restrict long entries to bull markets (price above SMA200) after orbiting 0.48 val_sharpe basin.
2bfcaf1	0.032702	0.293645	0.321961	0.659096	0.691648	0.575038	0.352	28.832	46.16	0.444	30	discard		Replace ATR trailing stop exit with fixed 1.5× ATR stop-loss and 3× ATR take-profit exit to test structurally different exit family after orbiting 0.48 val_sharpe basin.
a3eb3e5	0.481931	1.092109	0.715335	2.669779	0.915495	0.840963	5.448	129.806	10.20	0.681	31	keep		Add RSI>70 overbought exit signal to complement ATR trailing stop, a structural exit change after multiple discards near 0.48 val_sharpe basin.
6be747b	0.464727	1.057729	0.692104	2.432506	0.909913	0.829881	5.726	136.417	10.78	0.654	31	discard		Add MACD line crossunder below signal line as additional exit condition to close positions on momentum weakness, a structural exit change after orbiting 0.48 val_sharpe basin.
64471fe	0.413379	0.990847	0.886933	4.079708	0.922228	0.864667	0.344	10.832	58.46	0.387	31	discard		Clustered discards near 0.48 val_sharpe basin (multiple recent discards including MACD exit addition); replace hybrid ATR trailing stop + RSI overbought exit with pure EMA fast/slow crossunder trend-r
6bbc178	0.434084	1.139204	0.670186	2.603676	0.901684	0.816615	7.566	163.628	10.20	0.659	26	discard		Recent 2 discards clustered just under 0.48 val_sharpe basin after exit changes; add OBV rising confirmation to entry to filter low-volume EMA crossover signals.
5ec437c	-0.174543	0.127470	0.152950	0.600404	0.582151	0.480231	1.309	66.504	39.11	0.408	52	discard		Recent 3 discards clustered just under 0.48 val_sharpe basin after exit changes and OBV entry filter addition; replace EMA crossover entry with pullback-to-slow-EMA entry in ADX-confirmed uptrend as s
17f85b4	0.000000	0.000000	0.000000	0.000000	0.000000	0.000000	0.000	0.000	0.00	0.000	0	crash		Replace the EMA crossover entry with an ADX-confirmed Donchian channel breakout, relaxing the ADX trend filter threshold from 25 to 20 to widen the entry set and resolve recent 0-trade crashes.
0f11a12	0.462160	0.979770	0.688344	2.592146	0.902797	0.812938	3.917	89.015	12.42	0.631	38	discard		Replace the Donchian channel breakout entry with a simple EMA(15/45) crossover entry, keeping the ADX(14) > 20 trend filter to avoid non-trending markets.
														
07f72c2	0.000000	0.000000	0.000000	0.000000	0.000000	0.000000	0.000	0.000	0.00	0.000	0	crash		Recent 6 consecutive non-keeps orbiting 0.48 val_sharpe basin; add 20-bar time-based exit to close stagnant positions as structurally different exit family from prior trailing/oscillator exits.
87cbd91	0.481931	1.092109	0.715335	2.669781	0.915495	0.830866	5.448	129.806	10.20	0.681	31	discard		Fix AttributeError from non-existent self.bar attribute by using len(self.data)-1 to get current bar index for time-based exit tracking.
7f018e8	0.381800	0.882814	0.577720	2.234015	0.866581	0.753151	7.342	261.666	8.03	0.660	18	discard		Recent ≥2 discard rows clustered just under 0.48 val_sharpe basin (multiple discards after current keep); add 200-period SMA long-term trend filter to entry to only take trades in confirmed uptrends a
1ced1e2	0.000000	0.000000	0.000000	0.000000	0.000000	0.000000	0.000	0.000	0.00	0.000	0	crash		Recent 10 rows show orbiting 0.48 val_sharpe basin with exit mutations causing regressions; return to proven baseline architecture (ATR trailing stop + RSI overbought exit from commit 0f11a12 which sc
893b17d	0.462160	0.979770	0.688344	2.592146	0.902797	0.814097	3.917	89.015	12.42	0.631	38	discard		Crash with 0 trades caused by stacked entry filters: EMA crossup AND ADX>20 AND RSI<40. The RSI<40 condition (added in prior mutation) is too strict for uptrend entry—RSI naturally stays above 40 duri
8070a65	0.635338	1.918483	1.005033	6.198531	0.954443	0.910856	6.389	99.096	13.14	0.765	30	keep		Recent 6 rows show repeated crashes and discards orbiting the 0.48 val_sharpe basin with entry/exit mutations. Current baseline (EMA crossover + ADX>25 + RSI>30) is stable but slightly underperforming
4dee5b1	0.165183	0.521251	0.466959	1.518047	0.770445	0.649329	1.976	48.255	38.22	0.478	31	discard		Recent 6 rows show crashes and discards after exit/entry stacking attempts; revert to the stable baseline EMA(15/45) crossover with ADX>25 and RSI>30 entry filter (commit 0f11a12 val_sharpe=0.462), th
6451e13	0.115938	0.273779	0.276469	0.534097	0.684045	0.530494	1.174	158.501	31.12	0.398	31	discard		Recent crashes show 0 trades with stacked entry filters (EMA crossup AND ADX>25 AND RSI>30); the RSI>30 condition is too strict for uptrend entries since RSI naturally stays elevated during rallies. R
73b5d60	0.479460	1.033901	0.703849	2.604306	0.915018	0.819974	5.033	112.546	12.12	0.687	31	discard		Recent history shows the baseline (EMA 15/45 crossover + ADX>25 + RSI>30) hovers around 0.46–0.48 val_sharpe with 38 trades and 12% drawdown; commit 8070a65 achieved 0.635 val_sharpe (30 trades, 13% D
ce48cb8	0.635338	1.918483	1.005033	6.198531	0.954443	0.907197	6.389	99.096	13.14	0.765	30	discard		Recent 6 consecutive crashes with 0 trades (commits 07f72c2, 1ced1e2, etc.) indicate entry conditions are over-filtered. The baseline EMA(15/45) crossover + ADX>25 + RSI>30 achieved 0.635 val_sharpe (
8b08847	0.494457	1.205435	0.816499	3.192570	0.921075	0.835794	3.963	80.856	17.44	0.687	31	discard		Recent 6 consecutive crashes with 0 trades indicate entry conditions are severely over-filtered. The last keep (8070a65, val_sharpe=0.635) used EMA(15/45) crossover + ADX>25 + RSI>30. Revert to that p
d35083f	0.250046	0.691024	0.504345	1.489879	0.797807	0.665805	6.273	159.793	19.41	0.598	31	discard		Recent history shows the baseline EMA(15/45) + ADX>25 + RSI>30 oscillates around 0.48 val_sharpe with 31 trades and 12% drawdown. The best keep (commit 8070a65, val_sharpe=0.635) used the same entry b
c7256ff	0.479460	1.033901	0.703849	2.604306	0.915018	0.814447	5.033	112.546	12.12	0.687	31	discard		Recent 6 rows show cascading crashes and discards after adding entry filters (200-period SMA trend gate, RSI<40 conditions); the baseline EMA(15/45) + ADX>25 entry consistently achieves 0.46–0.63 val_
b55a122	0.000000	0.000000	0.000000	0.000000	0.000000	0.000000	0.000	0.000	0.00	0.000	0	crash		Recent 10 rows show the strategy orbiting 0.48 val_sharpe with repeated crashes from stacked entry filters and exit mutations. The best keep (commit 8070a65, val_sharpe=0.635, 30 trades, 13% DD) used 
86cd274	0.000000	0.000000	0.000000	0.000000	0.000000	0.000000	0.000	0.000	0.00	0.000	0	crash		Fix AttributeError: `Position` object has no attribute `open_price`. Use `self.position.open_price` accessor which is provided by backtesting.py; the crash was caused by incorrect attribute name in th
4f2b59c	0.635338	1.918483	1.005033	6.198531	0.954443	0.904534	6.389	99.096	13.14	0.765	30	discard		Fix AttributeError: `Position` object has no attribute `open_price`. The backtesting.py library uses `self.position.open_price` as a read-only property that may not be directly accessible in all versi
48400f2	0.165183	0.521251	0.466959	1.518047	0.770445	0.637872	1.976	48.255	38.22	0.478	31	discard		Recent 6 rows show the strategy is stuck in a local basin around 0.48 val_sharpe with repeated crashes from stacked entry filters. The best historical keep (commit 8070a65, val_sharpe=0.635, 13% DD, 3
28d588d	0.635338	1.918483	1.005033	6.198531	0.954443	0.902512	6.389	99.096	13.14	0.765	30	discard		Remove the RSI>30 entry filter which is redundant and over-constrains entries; the RSI overbought exit (>70) already handles momentum management. Baseline EMA(15/45) crossover + ADX>25 achieved 0.635 
e62686f	0.635338	1.918483	1.005033	6.198531	0.954443	0.900347	6.389	99.096	13.14	0.765	30	discard		Remove the RSI entry filter (rsi_oversold_threshold check) which over-constrains entries; the RSI overbought exit (>70) already manages momentum. This restores the best historical configuration (commi
c4bc1b9	0.481931	1.092109	0.715335	2.669779	0.915495	0.808476	5.448	129.806	10.20	0.681	31	discard		Replace the fixed 2-ATR take-profit exit with a trailing stop (1-ATR) to capture extended trends; the current strategy exits too early and leaves money on the table, evidenced by the 0.635 val_sharpe 
97f7b32	0.635338	1.918483	1.005033	6.198531	0.954443	0.898770	6.389	99.096	13.14	0.765	30	discard		The recent 6 crashes with 0 trades indicate the entry conditions are severely over-filtered. Revert to the best historical configuration (commit 8070a65, val_sharpe=0.635, 13% DD, 30 trades) which use
8f63fe2	0.635338	1.918483	1.005033	6.198531	0.954443	0.897048	6.389	99.096	13.14	0.765	30	discard		Remove the RSI>30 entry filter constraint which is redundant; restore the simple EMA(15/45) crossover + ADX>25 baseline that achieved val_sharpe=0.635. The RSI overbought exit (>70) already handles mo
13a7dc6	0.635338	1.918483	1.005033	6.198531	0.954443	0.895484	6.389	99.096	13.14	0.765	30	discard		Revert to the best-known configuration (commit 8070a65: val_sharpe=0.635, 13% DD, 30 trades) by removing the RSI entry filter entirely and using only EMA(15/45) crossover + ADX>25; the recent 10 rows 
052a565	0.635338	1.918483	1.005033	6.198531	0.954443	0.894063	6.389	99.096	13.14	0.765	30	discard		Recent crashes show entry conditions are over-constrained (0 trades). The best historical keep (commit 8070a65, val_sharpe=0.635, 30 trades, 13% DD) used only EMA(15/45) crossover + ADX>25 without the
72a12fb	0.635338	1.918483	1.005033	6.198531	0.954443	0.892768	6.389	99.096	13.14	0.765	30	discard		Remove the RSI entry filter (rsi_oversold_threshold check in next()) which is redundant and over-constrains entries; the RSI overbought exit (>70) already manages momentum. The baseline EMA(15/45) cro
8b454b0	0.165183	0.521251	0.466959	1.518047	0.770445	0.615711	1.976	48.255	38.22	0.478	31	discard		Replace RSI overbought exit (>70) with ATR-based trailing stop (1.5-ATR below peak) to reduce whipsaws and capture full trends without premature momentum-based exits; the RSI filter is too noisy on da
477df5d	0.165183	0.521251	0.466959	1.518047	0.770445	0.616194	1.976	48.255	38.22	0.478	31	discard		The strategy is cycling through the same configuration (val_sharpe=0.635, 13% DD, 30 trades) with repeated discard attempts to improve it. The current trailing stop (1.5-ATR) is sound but the RSI over
7dee4cd	-0.085155	0.613455	0.339243	3.439471	0.606306	0.492891	2.101	61.398	30.05	0.544	31	discard		Replace the RSI overbought exit (>70) with a fixed take-profit at 2.0-ATR above entry to lock in gains more consistently; the trailing stop alone is allowing too many whipsaws and mean-reversion pullb
a330fd3	0.509564	1.131146	0.752863	2.719423	0.929412	0.816003	5.038	115.931	12.12	0.681	21	discard		The strategy has been oscillating around the same baseline (val_sharpe=0.635, 13% DD, 30 trades) for many iterations. Recent experiments show the EMA(15/45) + ADX(25) entry with trailing-stop exit is 
fc69903	0.108677	0.241942	0.296747	0.447412	0.705234	0.507467	-0.157	33.635	47.61	0.421	62	discard		Recent experiments show cycling around the same baseline (val_sharpe=0.635, 13% DD, 30 trades) with repeated failed attempts to improve via exit mechanics. The current trailing stop (1.5-ATR) + RSI ov
d72ef0a	0.355422	0.596445	0.633657	1.265486	0.881089	0.739311	0.332	9.311	57.84	1.000	5	discard		The strategy is stuck at val_sharpe=0.635 with the baseline EMA(15/45) + ADX>25 + trailing stop. Recent experiments show the RSI overbought exit (>70) is creating whipsaws. Replace it with a fixed tak
d40e66d	-0.015864	0.513853	0.337133	2.374038	0.672735	0.547406	2.502	57.041	32.00	0.517	31	discard		The strategy has been stuck at val_sharpe=0.635 for many iterations, cycling between the same baseline (EMA 15/45 + ADX>25 + trailing stop). Recent experiments show the trailing stop + RSI overbought 
d1a1c08	0.252365	0.918329	0.654480	3.933987	0.820847	0.713908	2.862	47.794	47.37	0.576	31	discard		The strategy is stuck at val_sharpe=0.635 after many cycles of small tweaks. The trailing-stop + RSI-overbought exit combination is not improving results; recent experiments show whipsaw behavior. Swi
b393ddf	0.165183	0.521251	0.466959	1.518047	0.770445	0.616389	1.976	48.255	38.22	0.478	31	discard		Diagnosis: Recent 10 rows all discard; the strategy oscillates around val_sharpe=0.635, 13% DD, 30 trades. Every exit mutation (trailing stop, RSI overbought, fixed TP, combinations) has regressed or 
2dc97e2	0.368414	0.848898	0.660233	2.180624	0.879733	0.750401	2.296	37.430	25.45	0.665	41	discard		The strategy is stuck in a local basin around val_sharpe=0.635. The EMA(15/45) + ADX(25) entry is sound but overfiltered: ADX>25 requires strong trend, which is rare and limits to ~30 trades. The exit
5d9411f	0.485224	0.942241	0.679312	2.341423	0.907309	0.779646	3.758	79.885	12.12	0.635	38	discard		Diagnosis: Strategy is stuck at val_sharpe=0.635 with 30–31 trades and ~13% DD. The entry filter (EMA crossup + ADX>25) is overfiltered; relaxing ADX from 25→20 will widen the candidate set without br
78fe321	0.485224	0.942241	0.679312	2.341423	0.907309	0.780550	3.758	79.885	12.12	0.635	38	discard		Diagnosis: Strategy is stuck in a local basin (val_sharpe=0.635, 13% DD, ~30 trades). Recent 10 rows all discard; every exit mutation (trailing stop, RSI, fixed TP, combinations) regresses or flatline
e7bef8c	0.506527	1.059612	0.897709	3.561711	0.943630	0.862268	0.722	19.890	47.47	0.352	31	discard		Diagnosis: Strategy stuck at val_sharpe≈0.635 for 10+ iterations. Every exit mutation (trailing stop, RSI overbought, fixed TP) has regressed. The entry filter (EMA 15/45 crossup + ADX>25) is sound bu
d0a104c	-0.010631	0.047945	0.065985	0.115137	0.549214	0.345259	1.759	150.030	15.50	0.472	26	discard		Diagnosis: Strategy stuck at val_sharpe≈0.635 for 10+ iterations with ~30 trades and 13% DD. Recent mutations all involve exit tweaks (trailing stop, RSI overbought, fixed TP) that regress or flatline
3c8febc	0.176516	0.631278	0.467502	2.117981	0.779603	0.627272	2.643	53.289	33.39	0.656	31	discard		Diagnosis: Strategy is stuck at val_sharpe=0.635 for 15+ iterations. Entry filter (EMA 15/45 + ADX>25) is sound but overfiltered, limiting to ~30 trades. Exit mutations have all regressed. Structural 
f5ab277	0.000000	0.000000	0.000000	0.000000	0.000000	0.000000	0.000	0.000	0.00	0.000	0	crash		Replace RSI overbought exit with a simple N-bar time-based exit (close position after 10 bars); remove the trailing-stop peak-tracking complexity entirely and use a fixed 2-ATR stop-loss below entry i
