commit	val_sharpe	sortino	sharpe_ann_4h	calmar	psr	dsr	skew	kurtosis	max_drawdown	win_rate	total_trades	status	timestamp	description
42671f3	0.153823	0.384047	0.392844	1.019782	0.758427	0.535935	1.356	37.802	49.97	0.567	30	discard		Diagnosis: Last 10 rows show the baseline EMA(15/45)+ADX>25 is stable at val_sharpe≈0.485, 38 trades, 12.12% max_dd. The strategy is trapped in a local optimum because EMA crossovers alone are too rar
7bfd8a0	0.000000	0.000000	0.000000	0.000000	0.000000	0.000000	0.000	0.000	0.00	0.000	0	crash		Diagnosis: The baseline EMA(15/45)+ADX>25 is stuck at val_sharpe≈0.333–0.485 with 25–38 trades. Recent 6 rows show crashes when relaxing entry conditions (RSI<30, Donchian, ADX<20) because the EMA cro
7dbc06c	0.165183	0.521251	0.466959	1.518047	0.770445	0.581552	1.976	48.255	38.22	0.478	31	discard		Fix AttributeError: Position object has no attribute 'open_price'. The backtesting.py library uses `self.position.close` not `open_price`. Replace with trailing stop exit (1.5-ATR) which was stable at
28201aa	0.294062	0.943336	0.625005	2.911294	0.827180	0.677531	4.184	85.756	18.62	0.702	30	discard		Current baseline is stuck at val_sharpe≈0.485 with 38 trades and tight 12.12% max_dd. Recent mutations adding filters (RSI, Donchian, ADX relaxation) all crashed with 0 trades, proving the EMA(15/45) 
de8725c	0.014302	0.892900	0.602441	4.210039	0.702806	0.644377	0.837	28.908	36.64	0.457	58	discard		Diagnosis: Last 10 rows show baseline EMA(15/45)+ADX>25 stable at val_sharpe≈0.485 but orbiting the same basin with failed entry relaxations. The strategy is overly dependent on rare EMA crossovers (3
5fa40ce	-0.372451	0.377154	0.137255	1.646569	0.629044	0.544942	1.273	65.001	38.12	0.483	79	discard		Diagnosis: Last 10 rows show repeated crashes (0 trades) when trying to relax entry conditions, proving the EMA(15/45) crossover set is too sparse (38 trades in 5 years = ~7/year). The baseline is tra
b17833b	0.214771	0.787024	0.563682	3.774590	0.784153	0.622422	4.210	83.141	19.79	0.459	31	discard		The baseline EMA(15/45) crossover with ADX>25 is stable at val_sharpe≈0.485, 38 trades, and 12.12% max_dd, but orbits the same basin. Recent 6 mutations attempted entry relaxation (RSI filters, Donchi
575a92f	0.000000	0.000000	0.000000	0.000000	0.000000	0.000000	0.000	0.000	0.00	0.000	0	crash		The baseline EMA(15/45)+ADX>25 is stuck at val_sharpe≈0.485 with only 38 trades over 5 years. All entry relaxations crash (0 trades). Diagnosis: The EMA crossover signal is too rare and strict. Instea
1afcee3	0.479460	1.033901	0.703849	2.604306	0.915018	0.756973	5.033	112.546	12.12	0.687	31	discard		Diagnosis: 0-trade crash on all three symbols. The Donchian breakout + ADX>25 combination is too restrictive—the breakout signal is rare and occurs *before* ADX has time to rise, causing a missed-sign
1e2d9e6	0.103941	0.388923	0.387511	1.159531	0.727976	0.529821	0.540	35.739	35.97	0.525	206	discard		Replace the rare EMA(15/45) crossover entry with a Donchian(20) breakout + ADX>20 confirmation. The EMA crossover generates only ~7 trades/year; Donchian captures volatility breakouts more frequently 
d66e05a	-0.067309	1.217372	0.713349	8.500056	0.682458	0.663375	1.141	30.480	57.89	0.518	54	discard		The baseline EMA(15/45) crossover is generating only ~6 trades/year and is trapped in a local optimum. Replace the rare crossover entry with a Bollinger Band breakout (price > upper band) combined wit
8b78e67	0.359666	1.551302	1.045037	10.827245	0.833085	0.747914	1.517	24.124	45.53	0.518	68	discard		Replace the rare EMA(15/45) crossover entry with a Bollinger Band breakout (close > upper band) combined with ADX>20 trend confirmation, keeping the 1.5-ATR trailing stop exit. The EMA crossover gener
f9b4ba8	0.012974	0.471474	0.413979	1.512450	0.679827	0.513962	0.727	51.143	46.32	0.526	36	discard		Diagnosis: The baseline EMA(15/45) crossover with ADX>25 is stable at val_sharpe≈0.485 with 38 trades and 12.12% max_dd, but is trapped in a tight local optimum. Recent 6 mutations all crashed with 0 
eb7381c	-0.216226	-0.167281	-0.070630	-0.223823	0.451530	0.234254	-0.341	43.842	57.72	0.466	29	discard		The baseline EMA(15/45)+ADX>25 is stable at val_sharpe≈0.485 with 38 trades and 12.12% max_dd but trapped in a local optimum. All entry relaxations have crashed (0 trades) or stayed orbiting the same 
5dcde6d	0.088333	0.805869	0.698478	6.311566	0.774541	0.624196	0.360	14.591	70.25	0.404	116	discard		Diagnosis: The last 10 rows show the baseline EMA(15/45)+ADX>25 is stable at val_sharpe≈0.485 with 38 trades but trapped in a tight local optimum. All entry relaxations crash (0 trades) or orbit the s
880bbed	0.038089	0.440843	0.352345	1.212633	0.706934	0.519629	2.129	44.290	46.14	0.701	30	discard		The baseline EMA(15/45) crossover with ADX>25 is trapped at 38 trades / val_sharpe≈0.485. All attempts to add entry conditions (Donchian, Bollinger, RSI) have crashed or regressed. Switch the exit fro
763c876	0.209480	0.699234	0.686685	2.819644	0.840549	0.683667	0.317	10.254	57.31	0.415	159	discard		Replace the rare EMA(15/45) crossover entry with a simpler momentum signal: close > EMA(45) AND EMA(15) > EMA(45) (both conditions must hold), combined with RSI(14) not oversold (RSI > 30) to filter n
3e4cbd3	0.298857	0.489545	0.551596	0.969963	0.847907	0.647605	0.362	10.303	57.84	1.000	5	discard		Diagnosis: The baseline EMA(15/45)+ADX>25 is stable at val_sharpe≈0.485 with 38 trades but stuck in a local optimum. All entry relaxations crash (0 trades). The trailing stop exit at 1.5-ATR is exitin
8277cc0	0.149705	0.741636	0.523402	2.687581	0.753104	0.603725	3.504	62.789	26.70	0.530	31	discard		The baseline EMA(15/45)+ADX>25 is stable at val_sharpe≈0.485 with 38 trades and 12.12% max_dd but trapped in a local optimum. All attempts to *add* entry conditions (Donchian, Bollinger, RSI) have cra
56b26e5	0.363659	1.083588	0.736845	3.327062	0.885157	0.748486	3.390	51.943	57.84	0.967	27	discard		Diagnosis: Recent 10 rows show the baseline EMA(15/45)+ADX>25 is stable at val_sharpe≈0.485 with 38 trades but every entry relaxation crashes (0 trades) or regresses. The trailing stop exit at 1.5-ATR
6da2157	0.285043	0.904476	0.610114	2.421240	0.832416	0.673595	3.541	60.415	20.51	0.683	31	discard		Diagnosis: The baseline EMA(15/45)+ADX>25 is stable at val_sharpe≈0.485 with 38 trades but every entry *relaxation* crashes (0 trades). All exit experiments also regressed. The entry filter set is loc
3b05034	0.176516	0.631278	0.467502	2.117981	0.779603	0.595600	2.643	53.289	33.39	0.656	31	discard		Diagnosis: The baseline EMA(15/45)+ADX>25 is stuck at val_sharpe≈0.485 with 38 trades and 12.12% max_dd. All recent mutations crashed (0 trades) or regressed. The entry filter set is over-constrained.
9012252	0.176516	0.631278	0.467502	2.117981	0.779603	0.596103	2.643	53.289	33.39	0.656	31	discard		The baseline EMA(15/45) + ADX>25 is stuck at val_sharpe≈0.485 with 38 trades. All entry relaxations crash (0 trades); all exit mutations regress. The trailing stop + RSI overbought exit is firing too 
aa62fd6	0.123950	1.335091	0.477227	5.009413	0.704588	0.540390	7.398	190.373	17.71	0.559	31	discard		Diagnosis: The baseline is stuck at val_sharpe≈0.485 with 38 trades and 12% max_dd. All entry relaxations have crashed (0 trades) because the EMA(15/45) crossup + ADX>25 filter set is too tight. Rathe
84ebbba	0.258148	1.012902	0.657332	4.176578	0.811180	0.672567	3.882	72.526	32.90	0.544	31	discard		Diagnosis: The last 10 rows show the baseline EMA(15/45)+ADX>25 is trapped at val_sharpe≈0.485 with 38 trades and 12% max_dd. Every entry relaxation crashes (0 trades) because the filter set is over-c
794ffea	-0.015864	0.513853	0.337133	2.374038	0.672735	0.521993	2.502	57.041	32.00	0.517	31	discard		Diagnosis: The baseline EMA(15/45)+ADX>25 is stuck at val_sharpe≈0.485 with 38 trades. All entry relaxations crash (0 trades) because the crossover + ADX filter is over-constrained. Recent experiments
cf2b94a	0.301374	0.608658	0.553260	1.535437	0.843704	0.650308	1.629	34.517	26.63	0.463	41	discard		Diagnosis: The baseline EMA(15/45)+ADX>25 is trapped at val_sharpe≈0.485 with 38 trades and 12% max_dd. All entry relaxations crash because the crossover+ADX filter is over-constrained. The trailing s
69ece61	0.077358	0.321551	0.380056	1.136095	0.728683	0.519377	0.431	12.013	45.53	0.521	142	discard		Replace the tight EMA(15/45) crossover + ADX>25 entry filter with a simpler, wider momentum criterion: buy when RSI(14) crosses above 50 (from below), eliminating the ADX gate entirely. This widens th
6633d35	0.176516	0.631278	0.467502	2.117981	0.779603	0.598472	2.643	53.289	33.39	0.656	31	discard		The baseline EMA(15/45)+ADX>25 is stuck at val_sharpe≈0.485 with 38 trades and 12% max_dd. All entry relaxations crash (0 trades) because the crossover+ADX filter is over-constrained. Rather than rela
b6e2ebd	-0.015864	0.513853	0.337133	2.374038	0.672735	0.523062	2.502	57.041	32.00	0.517	31	discard		Diagnosis: The baseline is trapped at val_sharpe≈0.485 with 38 trades and the entry filter (EMA(15/45) crossup + ADX>25) is over-constrained—all relaxations crash with 0 trades. The trailing stop + RS
a359467	0.440750	0.898667	0.769199	2.433412	0.917136	0.781251	1.147	29.713	38.71	0.487	31	discard		Diagnosis: The last 10 rows show the baseline is trapped at val_sharpe≈0.485 with 38 trades. All entry relaxations crash (0 trades) because EMA(15/45) crossup + ADX>25 is over-constrained. Rather than
8fd6ff0	0.153823	0.384047	0.392844	1.019782	0.758427	0.540517	1.356	37.802	49.97	0.567	30	discard		The baseline EMA(15/45)+ADX>25 is trapped at val_sharpe≈0.485 with 38 trades and 12% max_dd. All entry relaxations crash (0 trades). Instead of further loosening the entry, swap the exit logic: replac
886a00e	0.132199	0.317570	0.354960	0.626309	0.736267	0.510911	0.692	19.471	40.96	0.438	179	discard		Replace the tight EMA(15/45) crossover + ADX>25 entry filter with a simpler momentum criterion: buy when RSI(14) crosses above 50 (upward), and exit on RSI > 70 or a fixed 2% trailing stop. This elimi
e49d7a9	0.176516	0.631278	0.467502	2.117981	0.779603	0.599563	2.643	53.289	33.39	0.656	31	discard		Diagnosis: The baseline EMA(15/45)+ADX>25 is stuck at val_sharpe≈0.485 with 38 trades and 12% max_dd. All recent entry relaxations have crashed (0 trades) because the crossover+ADX filter is over-cons
bfd27aa	0.176516	0.631278	0.467502	2.117981	0.779603	0.600025	2.643	53.289	33.39	0.656	31	discard		Diagnosis: The baseline is trapped at val_sharpe≈0.485 with 38 trades and 12% max_dd. All recent entry relaxations crash (0 trades) because EMA(15/45) crossup + ADX>25 is over-constrained. Rather than
9654cdd	0.178172	0.572648	0.409599	1.316273	0.764573	0.561705	4.011	103.493	14.63	0.554	31	discard		Diagnosis: All 10 recent rows are discards; the baseline EMA(15/45)+ADX>25 is trapped at val_sharpe≈0.485 with 38 trades. Every entry relaxation (RSI crossovers, wider ADX thresholds) crashed with 0 t
8812d2f	0.440750	0.898667	0.769199	2.433412	0.917136	0.782797	1.147	29.713	38.71	0.487	31	discard		Diagnosis: The last 10 rows show the baseline is stuck at val_sharpe≈0.485 with 38 trades and 12% max_dd. All entry relaxations (RSI crosses, ADX loosening) crashed with 0 trades because EMA(15/45) cr
10fec65	0.189583	1.038935	0.524836	3.712819	0.753163	0.608589	3.507	123.989	18.36	0.570	31	discard		Diagnosis: All 10 recent rows are discards. The baseline EMA(15/45)+ADX>25 is trapped at val_sharpe≈0.485 with 38 trades and 12% max_dd. Every entry relaxation attempt (RSI crosses, wider ADX) crashed
1cfde26	0.230339	0.435794	0.451416	0.766371	0.797071	0.584328	0.744	17.551	48.08	0.414	179	discard		Replace the over-constrained EMA(15/45) crossup + ADX>25 entry filter with a simpler RSI-based momentum entry: buy when RSI crosses above 50, and exit on RSI > 75 overbought or a fixed 2% trailing sto
1d098bf	0.186055	0.678261	0.478504	1.899691	0.783105	0.604838	2.959	64.330	31.47	0.656	31	discard		Diagnosis: All 10 rows are discards. The baseline EMA(15/45)+ADX>25 entry is over-constrained (crashes with 0 trades when relaxed). Rather than further mutate the entry, swap the exit logic entirely: 
d2e113c	0.355422	0.596445	0.633657	1.265486	0.881089	0.711633	0.332	9.311	57.84	1.000	5	discard		Diagnosis: All 10 rows are discards. The baseline EMA(15/45)+ADX>25 entry is over-constrained and crashes with 0 trades when relaxed. Rather than pile on more entry filters or relax existing ones (whi
a7c5691	-0.015864	0.513853	0.337133	2.374038	0.672735	0.525959	2.502	57.041	32.00	0.517	31	discard		Diagnosis: 10 consecutive discards. The baseline EMA(15/45)+ADX>25 entry crashes at 0 trades when relaxed. Current exit (trailing stop + RSI overbought) may be too aggressive, closing positions premat
ed2f894	0.440750	0.898667	0.769199	2.433412	0.917136	0.784472	1.147	29.713	38.71	0.487	31	discard		Diagnosis: 10 consecutive discards. The baseline EMA(15/45)+ADX>25 entry is over-constrained and crashes with 0 trades when relaxed. The trailing stop at 1.5-ATR is exiting too early, and RSI>70 overb
2bff51d	0.357564	0.754774	0.564439	1.997387	0.857088	0.671079	4.466	112.065	18.83	0.483	31	discard		Diagnosis: 10 consecutive discards show the baseline EMA(15/45)+ADX>25 entry is over-constrained (0 trades when relaxed) and the trailing stop at 1.5-ATR exits too early. Rather than mutate the entry 
c7477a7	0.176516	0.631278	0.467502	2.117981	0.779603	0.603270	2.643	53.289	33.39	0.656	31	discard		Diagnosis: 10 consecutive discards with the baseline EMA(15/45)+ADX>25 entry over-constrained (crashes with 0 trades when relaxed). The current trailing stop at 1.5-ATR + RSI>70 exit is exiting too ea
cd91f60	0.165183	0.521251	0.466959	1.518047	0.770445	0.589713	1.976	48.255	38.22	0.478	31	discard		Remove the RSI overbought exit (RSI > 70) which is closing positions prematurely; keep only the trailing stop at 1.5-ATR to allow trends to run longer and capture extended moves without being whipsawe
0cef997	0.440750	0.898667	0.769199	2.433412	0.917136	0.785650	1.147	29.713	38.71	0.487	31	discard		Diagnosis: 10 consecutive discards show the baseline EMA(15/45)+ADX>25 entry is locked at val_sharpe≈0.44 with 31 trades and 38% max_dd. Recent mutations (RSI crosses, wider ADX, exit tweaks) all cras
deff270	0.154310	0.702374	0.526197	2.029438	0.771692	0.623400	1.893	40.560	39.23	0.694	30	discard		Diagnosis: 10 consecutive discards. The baseline EMA(15/45)+ADX>25 is over-constrained at val_sharpe≈0.44, 31 trades, 38% max_dd. The trailing stop at 1.5-ATR is exiting too early. Switch exit from tr
632d7b5	0.485224	0.942241	0.679312	2.341423	0.907309	0.752449	3.758	79.885	12.12	0.635	38	discard		Diagnosis: 10 consecutive discards locked at val_sharpe≈0.44 with the baseline EMA(15/45)+ADX>25 entry. Recent mutations attempted RSI crosses, wider ADX thresholds, and exit tweaks—all crashed or reg
736cc6d	0.333799	0.700588	0.534841	1.818313	0.838947	0.650726	2.816	74.732	13.96	0.583	43	discard		Diagnosis: 10 consecutive discards locked at val_sharpe ≈ 0.44 with baseline EMA(15/45)+ADX>25 entry (31 trades, ~38% max_dd). All recent exit mutations (trailing stop tweaks, RSI crosses, time-based 
bef8eff	-0.116890	0.392792	0.434924	2.052024	0.691677	0.573490	-0.016	13.817	72.28	0.728	41	discard		Recent 10 rows all discard with val_sharpe≈0.44, 31 trades, 38% max_dd. The baseline EMA(15/45)+ADX>25 entry is locked in place and all exit mutations regress. Diagnosis: the strategy is stuck in a lo
172aade	0.440750	0.898667	0.769199	2.433412	0.917136	0.787045	1.147	29.713	38.71	0.487	31	discard		Remove the RSI overbought exit condition (RSI > 70) entirely and simplify the trailing stop logic to 2.0-ATR below peak price, allowing trends to extend longer without premature closes on overbought s
5a843ec	0.000000	0.000000	0.000000	0.000000	0.000000	0.000000	0.000	0.000	0.00	0.000	0	crash		The baseline EMA(15/45)+ADX>25 is locked at val_sharpe≈0.44 with 31 trades and 38% max_dd. All exit mutations have regressed. Switch the entry signal from EMA crossover to RSI oversold (RSI < 30) to c
f23d11b	0.165183	0.521251	0.466959	1.518047	0.770445	0.591764	1.976	48.255	38.22	0.478	31	discard		Diagnosis: The entry condition is over-constrained. RSI < 30 (oversold) AND price > slow EMA AND ADX > 25 creates a rare intersection (0 trades TSLA, 2 NVDA, 1 PYPL). Revert to the baseline EMA(15/45)
587691b	0.000000	0.000000	0.000000	0.000000	0.000000	0.000000	0.000	0.000	0.00	0.000	0	crash		Diagnosis: Last 10 rows show val_sharpe locked at 0.44 with 31 trades and 38% max_dd. The baseline EMA(15/45)+ADX>25 entry is over-constrained; all exit mutations (trailing stops, RSI crosses, time-ba
39d8f9a	0.440750	0.898667	0.769199	2.433412	0.917136	0.787403	1.147	29.713	38.71	0.487	31	discard		Diagnosis: 0 trades across all three symbols. The Donchian breakout entry (close > 20-bar high) combined with ADX > 25 is too restrictive. Revert to the baseline EMA(15/45) crossover entry, which cons
abf7696	-0.381272	-0.462679	-0.254459	-0.548457	0.316860	0.137875	-1.480	23.342	78.90	0.000	6	discard		Diagnosis: Last 10 rows locked at val_sharpe ≈ 0.44 with 31 trades and 38% max_dd. All exit mutations (trailing stops, RSI crosses) regressed. The baseline EMA(15/45)+ADX>25 entry is sound; the proble
f24611a	0.176516	0.631278	0.467502	2.117981	0.779603	0.600884	2.643	53.289	33.39	0.656	31	discard		Diagnosis: Last 10 rows locked at val_sharpe ≈ 0.44 with 31 trades and 38% max_dd. The baseline EMA(15/45)+ADX>25 entry is sound; all exit mutations (trailing stops, RSI overbought) have regressed or 
3f80c89	-0.381272	-0.462679	-0.254459	-0.548457	0.316860	0.134591	-1.480	23.342	78.90	0.000	6	discard		Diagnosis: locked at val_sharpe ≈ 0.44 with 31 trades and 38% max_dd for 10+ consecutive experiments. The baseline EMA(15/45)+ADX>25 entry is sound; all exit mutations (trailing stops, RSI overbought)
0165809	0.440750	0.898667	0.769199	2.433412	0.917136	0.778814	1.147	29.713	38.71	0.487	31	discard		Diagnosis: 10 consecutive discards locked at val_sharpe ≈ 0.44, 31 trades, 38% max_dd. The entry (EMA(15/45) crossup + ADX>25) is sound; all exit mutations (trailing stops, RSI overbought) have failed
d3f9c70	0.149705	0.741636	0.523402	2.687581	0.753104	0.605298	3.504	62.789	26.70	0.530	31	discard		Diagnosis: Locked at val_sharpe ≈ 0.44 with 31 trades, 38% max_dd for 10+ consecutive experiments. The baseline EMA(15/45)+ADX>25 entry is sound but overshoots and drawdown is high. Replace the traili
e7bcd46	0.149705	0.741636	0.523402	2.687581	0.753104	0.605649	3.504	62.789	26.70	0.530	31	discard		Diagnosis: Locked at val_sharpe ≈ 0.44 with 31 trades and 38% max_dd for 15+ consecutive experiments. The baseline EMA(15/45)+ADX>25 entry is sound. Recent mutations show all exit strategies (trailing
6381d63	0.067027	0.575467	0.436373	1.581227	0.697943	0.530384	1.421	46.078	28.55	0.602	69	discard		Diagnosis: Locked at val_sharpe ≈ 0.44 with 31 trades, 38% max_dd for 20+ consecutive experiments. The baseline EMA(15/45)+ADX>25 entry is sound; all exit mutations have failed. Switch from EMA(15/45)
6b14f77	0.000000	0.000000	0.000000	0.000000	0.000000	0.000000	0.000	0.000	0.00	0.000	0	crash		Diagnosis: 20+ consecutive discards locked at val_sharpe ≈ 0.44 with 31 trades and 38% max_dd. All exit mutations (trailing stops, RSI overbought) have failed to improve the metric. The entry (EMA(15/
4b9df9f	-0.065839	-0.089695	0.119813	-0.132823	0.587607	0.340885	-1.215	18.486	77.71	0.200	5	discard		Diagnosis: The RSI-oversold entry (RSI < 30) is too restrictive when combined with ADX > 25 and price > EMA(45). Recent crashes show 0–2 trades across all three symbols. The baseline EMA(15/45) crosso
54df660	0.185529	0.573357	0.406612	2.044244	0.765057	0.556221	3.630	137.444	15.41	0.715	31	discard		Diagnosis: 20+ consecutive discards locked at val_sharpe ≈ 0.44 with 31 trades and 38% max_dd. The EMA(15/45) crossover entry is sound; all exit mutations have failed. Pivot to a **fixed take-profit s
16cdc96	0.165183	0.521251	0.466959	1.518047	0.770445	0.615711	1.976	48.255	38.22	0.478	31	discard		Recent 10 experiments are discards orbiting the 0.635 val_sharpe baseline; remove RSI overbought (>70) exit condition to avoid premature trend exits, letting the 1.5-ATR trailing stop capture extended
5b78231	0.213242	0.622066	0.425117	1.397670	0.768599	0.593206	6.016	227.526	12.63	0.613	18	discard		Add 200-period SMA regime filter to entries to only take trades in long-term uptrends, breaking out of the 0.635 val_sharpe baseline basin.
57e3a6b	0.250046	0.691024	0.504346	1.489882	0.797807	0.639720	6.273	159.793	19.41	0.598	31	discard		Modify trailing stop peak tracking to use highest high instead of highest close since entry to align with standard chandelier exit logic after recent discards orbiting 0.635 val_sharpe baseline.
f9f9fc9	-0.070090	0.089780	0.168044	0.249421	0.605160	0.422211	0.284	29.358	48.71	0.495	83	discard		Replace EMA crossover entry with MACD crossover for structural momentum signal change after recent discards cluster under 0.635 val_sharpe baseline.
b1b10b5	0.165183	0.521251	0.466959	1.518047	0.770445	0.613105	1.976	48.255	38.22	0.478	31	discard		Replace RSI overbought exit with EMA crossunder trend-reversal exit and remove unused RSI indicator to simplify strategy.
e2f0100	0.545898	1.315352	0.801656	3.068279	0.928048	0.823313	4.869	83.937	4.55	0.687	31	discard		Switch to risk-based volatility-adjusted position sizing targeting 2% equity risk per trade, a structural sizing change after recent discards orbiting 0.635 val_sharpe baseline with entry/exit/regime 
314682c	0.230679	0.959768	0.610199	3.866131	0.791255	0.625752	4.725	92.891	24.91	0.526	31	discard		Diagnosis: 20+ consecutive discards locked at val_sharpe ≈ 0.44–0.55 with 31 trades and high max_dd. The EMA(15/45) crossover entry is sound but the fixed 2R take-profit is exiting too early, leaving 
